start_segment,end_segment,text
16512.0,16526.0,"Falando em China, Índia e China realizaram nessa semana, ontem de 18 de dezembro, mais uma reunião para uma solução em relação à sua disputa fronteriza"
16526.0,16550.0,"no Himalaya. Então, tivemos mais um encontro entre os enviados especiais dos dois países para essa questão fronteriza, dizendo que estão buscando uma solução justa e razoável e duradoura para essa questão fronteriza."
16550.0,16559.0,"Recapitulando para os os ouvintes, Índia e China tem uma frontera de fato, porém que nenhum dos dois países reconhece, porque ela é fascinada em 1912."
16559.0,16574.0,"Então, a China fala, quem assinou esse acordo foi o Tibet. O Tibet era um reino separatista que separou da monarquia, aproveitando a Proclamação da República, ele não é legítimo, então a gente não reconhece esse negócio."
16574.0,16582.0,"E a Índia fala, quem assinou esse negócio foi o Rage Britânico, motoridade colonial, que a gente não teve nenhuma voz e também não reconhece esse negócio."
16582.0,16589.0,"Lembrando que, no fundo, além dessa questão histórica de orgulho nacional, a disputa é por água."
16589.0,16598.0,"Ah, porque controle do Himalaya significa controle, inclusive, de nascentes de alguns os principais rios da região."
16598.0,16620.0,"Ainda falando em Índia, meu caro Matias, essa semana foi recebido, como Herói, no seu país Índia justamente, o Gukesh Domarajo, ele que se tornou o mais jovem campeão mundial de Chadres aos 18 anos de idade."
16620.0,16624.0,"Então, foi recebido na Índia como um Herói Nacional."
16624.0,16629.0,É um partido dos primos dele que não tem tal na Índia.
16631.0,16634.0,"Ah, mas vai ter de olho."
16634.0,16642.0,"É, na cidade, seu primo já era campeão mundial de Chadres e você está aí jogando fortes nais."
16642.0,16646.0,Não adianta nada desse negócio.
16646.0,16672.0,"Ainda em relação ao subcontinente indiano, meu caro Matias, tivemos vários registros nesse mês de ataques contra as minorias indústs em Bangladesh e isso levou a um protesto, inclusive, na frente de um dos consulados de Bangladesh na Índia."
16672.0,16684.0,"Isso ligado à queda da esse primeiro ministra, shake racina em agosto, que foi um dos temas principais do programa aqui naquela época."
16684.0,16700.0,"E em Myanmar, falando em Bangladesh, mas a fronteira Bangladesh e minha amara agora, está completamente controlada pelo exército de Arakan, um dos grupos rebeldes,"
16700.0,16704.0,contra a junta militar autoritária de Myanmar.
16704.0,16718.0,"Então agora toda a fronteira entre Myanmar e Bangladesh está sob controle do exército de Arakan, a junta militar de Myanmar tem sofrido diversos revéss nestas últimas semanas e não será surpreendente."
16718.0,16725.0,"Se nos próximas semanas ou nos próximos meses, a junta militar de Myanmar cair, não será surpreendente."
16725.0,16737.0,"Bem, passemos agora para o shake, no qual eu e o Felipe repercutiremos crises governamentais e eleições pelo mundo nas últimas semanas."
16767.0,16774.0,"Só sofrem em Pitman, após tentativa de alto golpe."
16774.0,16793.0,Essa notícia é do último sábado de 14 de dezembro e vem uns dias depois da tentativa de alto golpe dele com decreto de lei marcial para tentar calar o legislativo e oposição.
16793.0,16815.0,"Na época inclusive, nos dias eu participei do podcast o assunto falando um pouco sobre isso e vamos lá, o impeachment foi aprovado por 204 votos a favor, 85 contra, 3 abstensões e 8 votos nulos."
16815.0,16831.0,"O que isso quer dizer? Que não apenas mais de dois terços das cadeiras votaram pela impeachment mas que 14 deputados do Partido Conservador,"
16831.0,16844.0,"o Partido Governista, o Partido do Poder Popular votaram pela impeachment. Aliados do cara, aliados do Ion Suqeol votaram pela impeachment dele."
16844.0,16856.0,"Vamos recapitular um pouco, quando o Ion Suqeol foi leito em 2022, a comparação que a gente fazia aqui que era espécie de o sérgio Moro da Corea do Suq."
16856.0,16877.0,"Ele foi o procurador chefe dos casos de corrupção, incluindo o caso das fadas celestiais, um dos nossos programas mais queridos, cult, cult pelo público, em que ele pediu a prisão da ex-presidente,"
16877.0,16895.0,"o Parque Gão-Rê, por corrupção, também do outro ex-presidente, o Lee Mion-Bac, então ele vence eleição, com aquela coisa, eu sou candidato anti-corrupção, eu estou limpando a política, a política su coreana que é marcada por ligações,"
16895.0,16907.0,"muito complicadas, entre a política e os grandes conglomerados industriais su coreanos, ele também é uma plataforma conservadora, então a gente repercutiu aqui na época algumas das bizarrices,"
16907.0,16924.0,"então assim que o feminismo era a causa da baixa taxa de natalidade na Corea do Suq, coisas do tipo, então eu sou candidato anti-corrupção, sou candidato conservadora, eu emulava um pouco a questão do dono de Trump,"
16924.0,16943.0,"ele foi eleito, mas ele foi eleito com a margem mais apertada de votos da história da República da Corea, e o governo dele tem se mostrado um desastre, a aprovação política dele, ele não vencer eleição pra sínico hoje,"
16943.0,16950.0,"é abaixo dos 30%, a boca do jacaré foi se abrindo nos últimos meses,"
16950.0,16961.0,"eu ri porque eu matia a gesticulou com uma boca de jacaré aqui, no início do ano a gente repercutiu a eleição legislativa na Corea do Suq,"
16961.0,16981.0,"em que a oposição de centro esquerda venceu 190 das 300 cadeiras do Parlamento, então assim o governo dele estava um desastre, sempre esteja popular, congresso controlado pela oposição, e aí vieram os dois problemas,"
16981.0,16996.0,"primeiro, o congresso não estava provando o orçamento que ele desejava, e aí isso está ligado a crises, questões internas, a Corea do Suq, por exemplo a greve dos funcionários de saúde como que a gente repercontiu um tempo atrás,"
16996.0,17007.0,"e segundo, o Parlamento, queria estabelecer uma comissão de inquérito, contra a primeira dama, a primeira dama do candidato anticorupção,"
17007.0,17017.0,"ele está sendo investigada por corrupção, num esquema de manipulação de valores de ações, ali com informações privilegiadas,"
17017.0,17028.0,"ela teria recebido presentes ali, e nem mimos, bem caros, se o nosso programa não fosse 200 horas de edição,"
17028.0,17036.0,"eu matia a sua adapta da escola mededelírio de edição, podia por o áudio meme, do mimimei galera, mimimei,"
17037.0,17048.0,"eu não lembro que a família, que é uma, uma, uma, dessas influências, que se mimou, mas enfim, ela recebeu mimos bolsas de milhares de dólares e tal,"
17048.0,17059.0,"e aí o que ele fez, ele declarou lei marcial afirmando que o Parlamento estava agindo contra os interesses do Estado,"
17059.0,17071.0,"colaborando com os comunistas da Coreia do Norte, então é sempre o fantasma do comunismo, para destruir o país e eram traidores e tudo mais,"
17071.0,17088.0,"lembrando que na Coreia do Chul, a gente já explicou isso aqui algumas vezes, mas a divisão esquerda direita, ela também tem relação com a maneira de abordar o conflito na Península coreana,"
17088.0,17098.0,"então para os conservadores, a questão das relações da relação com a Coreia do Norte, é uma questão que tem que ser focada como uma questão de segurança,"
17098.0,17108.0,"partir da lógica militar, inclusive alguns mais jovens e direita hoje, defende, por exemplo, a declaração de dependência, que seja abandonada e ideia de reunificação,"
17108.0,17124.0,"enquanto a esquerda, ela busca, ela tem a política ali do sol brilhante, a política do brilho do sol, é difícil traduzir, que é a ideia de uma aproximação pacífica e que a Coreia do Sul eventualmente vai absorver a Coreia do Norte,"
17124.0,17134.0,"devido ao sucesso econômico e tal, um processo na visão deles, que seria o que ocorreu entre as duas alemanhas em minossas noventa."
17134.0,17155.0,"E a gente repercutiu aqui também já em outras oportunidades, que para joventude sul coreana, principalmente aquela, que lida com um desemprego, enfim, tem também um olhar de idealização em relação ao Norte do Parallelo 38."
17155.0,17157.0,Colocem idealização.
17158.0,17170.0,"De uma sociedade que funciona melhor, que é a Coreia do Sul, especialmente nesse jovens ou menjóveis desempregados, já que o índice desemprega na Coreia do Sul recentemente foi relativamente alto."
17170.0,17180.0,"Principalmente para joventude, que não consegue se colocar no mercado de trabalho, dada alta competitividade do mercado sul coreano."
17181.0,17204.0,"Então, a gente vê que na verdade foi uma queda de braço entre presidente e parlamento, um presidente que perdi as eleições parlamentares, com pouco prestígio, um governo que não está conseguindo funcionar, que está sendo afetado por questões de coopção, e ele quis, em um caso clássico de autogolpe, via a lei marcial,"
17204.0,17222.0,"em serrar atividades políticas, fechar o parlamento, proibir o direito de Assembleia, e então basicamente anular um dos poderes constituídos, e quando um poder constituído busca anular o outro nome disso é autogolpe."
17222.0,17251.0,"O grande exemplo é do Fujimori, na década de 1990 no Peru. Então, é importante lembrar também que a lei marcial pode ser implementada numa democracia, eventualmente numa tragédia humanitária, num caso de uma guerra, mas nesse caso, o clara deturpar de um mecanismo, em produe do governo, para fazer uma manobra autoritária e tentar um autogolpe de Estado, um poder anular o outro."
17251.0,17276.0,"Aí tropas do exército, cercaram o parlamento, porém alguns parlamentares já estavam lá outros conseguiram entrar, apesar desse bloqueio por parte das tropas, e eram tropas inclusive de uma unidade específica do exército da Corea do Sul, que é localizada em seu U."
17276.0,17295.0,"E aí os parlamentares dentro da Assembleia Nacional votaram uma moção para suspender a lei marcial. Então, em apenas algumas horas, assim, o presidente declarou a lei marcial as 22 horas e 27 minutos."
17295.0,17311.0,"As 4 horas e 30 minutos, ou seja, em 6 horas, o próprio gabinete presidencial teve que suspender a lei marcial, suspender o comando da lei marcial."
17311.0,17323.0,"Aí, importante mencionar também uma outra coisa, que a gente, várias vezes, fala disso aqui, às vezes a gente fala como piada e tal, mas a gente vai falar muito sério."
17324.0,17340.0,"O K-pop, como símbolo do que ocorreu, porque assim, a Corea do Sul, gente, ela afuma de Tadura até 177. Ela era uma ditadura militar da guerra fria, marcada por golpes Estado, por assassinatos,"
17341.0,17364.0,"teve um golpe dentro do golpe, golpe dentro do golpe, o pai da Parquegué é um refaz assinado no cargo, e aí veio a redemocrada, veio a abertura no contexto ali do Jogos Olímpicos de C.U. 188, e o que é isso que é ver com o K-pop? Até o início da década de 1990, gente, as 12 públicas coreanas, a Corea do Sul, a Corea do Norte, elas tinham índices econômicos muito parecidos, muito parecidos."
17364.0,17388.0,"Só que a abertura democrática na Corea do Sul, e claro, o fim do Norte do Norte também, não é único fator, mas em relação ao Corea do Sul, a abertura democrática contribuiu muito para o crescimento econômico e a projeção da Corea do Sul pelo Globo."
17389.0,17406.0,"Em 1995, nós tivemos o anúncio das bases da política do Halil, da onda coreana, que é uma política de Estado, que existe até hoje, de projeção da Corea do Sul pelo Globo."
17407.0,17412.0,"É um caso clássico de textbook, sim, de soft power."
17413.0,17420.0,"Dio, vamos ser um país mais presente no Globo, e isso vai trazer benefícios econômicos, benefícios de imagem."
17421.0,17434.0,"Então, a partir da década de 1990, você vai ter o Estado da Corea do Sul, da República da Corea, incentivando produções audiovisuais, exportação de produções audiovisuais,"
17434.0,17440.0,"exportação de produtos cosméticos, por exemplo."
17441.0,17453.0,"Então, hoje, você tem o K-pop, fomosíssimo pelo mundo, nós tivemos o filme Parazita, Ganosca, de melhor filme, temos os K-dramas presentes nos streamings."
17453.0,17463.0,"O coreano se tornou uma das línguas mais estudadas do mundo, a Corea do Sul se tornou um dos países mais visitados do mundo."
17463.0,17466.0,Também por conta do tratamento estético.
17466.0,17470.0,"Isso, produtos estéticos e tal."
17470.0,17472.0,Se você não já é plásticas também.
17472.0,17474.0,Estou arido também.
17474.0,17480.0,Estimas que cada dólar investido na indústria cultural suco-oreana vira 5 dólares de volta.
17481.0,17484.0,"Então, e que é que tudo isso é ver?"
17484.0,17496.0,A população mais jovem da Corea do Sul não tem uma espécie de falso-sautosismo do período de ditadura militar como alguns mais velhos vão ter.
17496.0,17502.0,"E como ocorre também no Brasil, alguns setores conservadores. Não, é porque a ditadura era bom, porque tudo funcionava."
17502.0,17513.0,"Não, eles falam, não, a poddutadura que nosso país se tornou conhecido, as pessoas vem visitar a gente, nós pais cresceu, as nossas empresas estão presentes no mundo inteiro."
17513.0,17519.0,"Então, você vai ter Samsung, LG, Hyundai, por Aivai."
17520.0,17528.0,Lembrando que essas empresas suco-oreanas foram criadas num contexto da guerra na peninsula da Corea.
17528.0,17539.0,"A LG não foi criada para fazer televisão, para vender televisão e estampar camisa do São Paulo no período que São Paulo golgou tudo."
17539.0,17552.0,"A LG foi criada para fazer censor de armamento, a Hyundai, da EU, foram criadas para fazer carro de combate, para fazer tanque, para fazer armamento."
17552.0,17561.0,"E só que a ecora abertura com a expansão dos exportações, ok, vamos fazer o tanque também ainda fazem."
17561.0,17569.0,"Só que também vamos fazer o carro para vender o HB20 lá no Brasil. Vamos produzir o celular, etc."
17569.0,17583.0,"Então, essa abertura cultural da Corea do Sul nessas últimas décadas, pós-95, ou seja, o processo que não tem nem três décadas, é muito marcante no desenvolvimento econômico suco-oreano."
17583.0,17592.0,"Então, assim, os jovens suco-oreanos, eles escolhem os frutos dessa abertura democrática."
17592.0,17606.0,"Então, por isso que nós também tivemos a organização civil suco-oreana, um massa se organizando para impedir esse autogól, e para responsabilizar esse governo, dizendo olha só, esse cara tem que sair, tivemos anunz de greve e tudo mais."
17607.0,17624.0,"Então, vocês podem ver imagens de jovens em frente o paralamento enfrentando as tropas desertas, para permitir que os parlamentares entrassem no paralamento e pudessem votar contra a medida."
17624.0,17630.0,"Não foi cinco das pessoas que foram para o Fernando Parlamento, não, ele foi cercado especialmente por jovens."
17631.0,17655.0,"E aí, nós tivemos o pedido de desculpas pelo presidente, e tal, mas ele foi impitimado, e agora o impit mande- ele, como disse, ele foi aprovado, porém, pela lei, pela constituição suco-oreana, ele está suspenço do cargo,"
17655.0,17666.0,"e agora, a corte constitucional vai julgar-lo para confirmar ou não o afastamento dele e a perda dos direitos políticos."
17666.0,17673.0,"É mais ou menos como, por exemplo, um impitiman no Brasil nos Estados Unidos, você tem o impitiman na Câmara e o julgamento no Senado."
17674.0,17687.0,"O julgamento no Senado, no Brasil, por exemplo, foi presidido no caso da Dilma pelo Levant Doves, no caso da Corea do Sul, até por cima o parlamento único-meral, quem faz segundo etapa, é a Suprema Corte."
17687.0,17695.0,"E isso pode ser um processo demorado, até porque um dos assentos da Suprema Corte, o suco-oreano, está vago."
17696.0,17707.0,"Mas então, nós tivemos essa tentativa de autogolpe bizarra durante esse processo, inclusive, o líder da oposição, que foi candidato presidencial nos últimos eleições."
17707.0,17715.0,"O Ligiai Mung, os militares tentaram prender-lo, lembrando que no início desse ano ele sofram atentado, inclusive contra a vida dele,"
17716.0,17742.0,"no último dia 11, o gabinete do presidente sofram a batida policial, o ex-miniço da defesa, e o ex-chefe do exército suco-oreano, foram presos pelo envolvimento deles, essa tentativa de autogolpe, não está rolando, não estão servindo pizza, não é curado do Sul, quer dizer, dipim-bap, não estão servindo o quinti, entendeu,"
17742.0,17770.0,"então prender o ex-miniço da defesa que renunciou depois da tentativa de autogolpe, e prender o ex-comandante do exército, e agora o primeiro ministro da Coreia do Sul, que é o chefe de gabinete, que está interinamente como presidente, está tentando tranquilizar todo mundo, dizendo que for uma exceção, que vai ficar tudo bem, porque, porque inclusive o ON, a moeda da Coreia do Sul derreteu nesse processo todo,"
17770.0,17799.0,"porque rolou novamente, a gente está falando de uma economia agora que a economia globalizada, então assim, não é mais a economia fechada da ditadura militar da Coreia do Sul, e é curioso, porque assim, a ditadura militar da Coreia do Sul, tem muitos defensores, inclusive no Brasil, devido ao processo de industrialização que eles realizaram, que de fato foi um processo impressionante de industrialização, só que ele não pode se desencular de duas coisas, gente,"
17799.0,17821.0,"primeiro, criou uma verdadeira casta de campiões nacionais ali, que testem essas relações super promiscuas com a política, e que vamos lembrar durante muito tempo, não queriam confirmar morte do senhor Samsung, porque o imposto de dirância, o inventário,"
17821.0,17837.0,"podia parar a cadeia produtiva do país, isso, porque assim, a economia, as relações entre a política, a economia, esses grandes congomerados, então promiscuam que a morte do senhor Samsung podia paralisar a economia inteira,"
17837.0,17856.0,"gente, repercutiu bastante aqui no programa, a gente fala bastante coreque, e segundo, isso também não dá pra desvincular, o processo de industrialização sul coreano, ele foi facilitado e legitimado pelo fato de ter um clima de conflito permanente com o visinho do norte,"
17856.0,17875.0,"então assim, a Coreia do Sul, ela não se enduci... vou repetir, ela não se enducielizou pra fazer carro pra vender carro no Brasil, ela se enducielizou pra fazer tanque, o fazer carro é um efeito colateral, olha só, vamos ver uma grana aqui fazendo carro também, mas a linha de produção pra fazer carro de combate,"
17875.0,17904.0,"vamos produzir televisão, porque a gente já faz os chips, porque a gente usa nos sensões de comunicação dos armamentos, então assim, o processo de industrialização da Coreia do Sul é muito difícil de ser usado como um exemplo pro Brasil, por exemplo, porque a situação já opulítica muito diferente, mas enfim, em 100 500, o fato é que o presidente sul coreano foi impitimado depois dessa patacada,"
17904.0,17923.0,"desse autogompe, aí, eu mati a gente estava até conversando aqui, esse bloco vai ser o bloco das crises das eleições, e tal, porque a gente vai ter que dar uma robada, a gente vai ter que por notícias de tudo que é canto aqui, então a gente vai começar um mega giro pelo mundo, agora a gente vai pra Mozambique,"
17923.0,17948.0,"da Coreia do Sul, a gente vai pseudo-continente africano, já que segundo algumas organizações da sociedade civil, Mozambicana e a Aniston Internacional, nas últimas sete semanas, após eleições Mozambicanas, pelo menos 110 pessoas morreram por ações de forças do Estado,"
17948.0,17969.0,"tá contra protestos, contra políticos da oposição, então assim, a situação em Mozambique, ela não está fácil, não está resolvida, de Mozambique, nós vamos para a Namibia, onde tivemos a eleição da primeira mulher presidente do país,"
17969.0,17991.0,"a Netumbo Nandi Indytoa, ela que é do partido governista, suapo, a gente já falou aqui na organização popular do sudoeste africano, e foi eleita com 58% dos votos, com o comparecimento de 76% dos votos,"
17991.0,18008.0,"o primeiro turno, estava programado por dia 27, porém, algumas onas eleitorais tiveram que realizar o voto no dia 30 de novembro, devido a questões logísticas no interior desertico do país, certo?"
18008.0,18017.0,"da Namibia, meu caro Matias, nós vamos para a Ghana, onde o Memphis do Corinthians esteve recentemente, o Estado, sei?"
18017.0,18018.0,E o MC Ariel também.
18018.0,18023.0,"E lembrando que Ghana é o país preferido do nosso querido Augusto de Doz, ele está muito feliz com a voz..."
18023.0,18026.0,Muito feliz que a presidente do Memphis lá.
18026.0,18043.0,"E Ghana realizou eleições no último dia sete de dezembro, e o John Marana venceu as eleições, ele que foi presidente de 2012 a 2017,"
18043.0,18055.0,"ele é do Congresso Nacional Democrático, que é o partido guarda-chuva, que é o partido de centro esquerda de Ghana, ou seja, um retorno da esquerda ao poder em Ghana,"
18055.0,18070.0,"depois de 8 anos, e o candidato da oposição conservadora, o Marramudu Pavumia, ele que teve 41% dos votos, ele concedeu a derrota, ele que era inclusive,"
18070.0,18084.0,"ouvi-se presidente de Ghana, quer dizer, ele ainda é, então ele era o candidato governista, porém foi derrotado, então Ghana vai voltar a ser governada pelo John Marama agora."
18084.0,18104.0,"De Ghana, meu caro Matias, nós vamos para a Burkina Facho, onde a Junta Militar, do Ibrahim Traore, emitiu um decreto encerrando, de solvendo o gabinete civil e as funções do gabinete,"
18104.0,18122.0,"o decreto diz que as funções oficiais, o primeiro ministro, estão encerradas, os ministros vão ficar interinamente no cargo até com o novo governo, no seja formado, o decreto não deu nenhuma justificativa para essa ação,"
18122.0,18130.0,"e, ou seja, mostrando a tutela dos militares sobre o poder civil em Burkina Facho."
18130.0,18146.0,"E ainda no Sahel, mais precisamente no Niger, a Junta Militar suspendeu a transmissão da BBC por 3 meses, por conta da Iabru aspas para o comunicado de 12 de dezembro,"
18146.0,18164.0,"transmitir informações errônias que podem levar a destabilização da paz social, também houve um comunicado similar em relação a Radio France, por OXC, por Orquestar, uma campanha de disinformação."
18164.0,18184.0,"Aí meu caro Matias do Sahel, nós vamos para o Calcaso, já que tivemos no último dia 14, as eleições indiretas presidenciais na geórgia, a presidência da geórgia é leita por 300 pessoas do colégio eleitoral,"
18184.0,18197.0,"que reúne representantes do Parlamento Nacional e também dos Parlamentos locais. Porém, a oposição, ou melhor dizendo o que sobrou da oposição,"
18197.0,18213.0,"boi cotou o voto, então com 224 votos dos 300, ou seja, 100% dos votos, o candidato dos sonhos de orjiano foi eleito, o Mickey Hill,"
18213.0,18229.0,"Cavela Chvilly, ele que teve uma passagem inclusive pelo Manser City, ele jogava de atacante, esse jogador de futebol, antes do Manchester City ele ter dinheiro, frisas."
18229.0,18252.0,"É, João, na época de Vacas, na época em que, para jogar no Manser City, você só precisava saber na linha reta, não me pode usar o bebê, e esse presidente, Solomé Zura Bichiville, ela disse que não reconhece a eleição e que ela vai continuar sendo a presidência legítima da geórgia."
18252.0,18277.0,"O novo presidente é uma figura ligada à extrema direita, Georgiana, ante União Europeia. Porém, obviamente os países da região, com gratular, a vitória dele e tal, até para evitar jogar mais gasolina na fogueira."
18277.0,18293.0,"O fato é que vamos ter essa, continuá tendo essa queda de braço, continuá tendo esses protestos pro União Europeia na geórgia, e inclusive várias lideranças da oposição nessas últimas semanas foram presas na geórgia também."
18294.0,18309.0,"Falando em eleições contestadas, meu carmatizão, para a Romênia, já que no dia 24 de novembro, nós tivemos o primeiro turno da eleição presidencial Romena."
18309.0,18328.0,"E a gente repercutiu aqui, inclusive o fato de que o Calin de Ortezco ficou em primeiro, ele que é um candidato nacionalista de extrema direita, ante União Europeia, que compartilhe inclusive várias teorias da conspiração sobre a COVID e tal."
18328.0,18351.0,"Porém, esse turno da eleição presidencial Georgiana foi anulado pela Suprema Corte afirmando que suspeitas de fraudes e que documentos de inteligência mostram interferência externa no pleto."
18351.0,18379.0,"Nomeadamente, da rússia via o Tik Tok, inclusive a Comissão Europeia, iniciou nessa última terça-feira de 17 de dezembro, uma investigação contra o Tik Tok, por supostamente ter adotado medidas e políticas que beneficiaram o candidato da extrema direita na Romênia."
18380.0,18394.0,"O Tik Tok nega as acusações, diz que protege a integridade da sua plataforma, entre todas as eleições pelo mundo, que não aceita nos políticos, que removê-lo todos os conteúdos que violavam suas políticas sobre disinformação, etc."
18395.0,18412.0,"O fato aqui, o Tribunal Constitucional da Romênia anulou esse primeiro turno sobre essa acusação de interferência externa pro rússia e que teria sido realizada via Tik Tok."
18412.0,18420.0,"Agora, o pleto será realizado apenas em 2025."
18420.0,18438.0,"Ao mesmo tempo, no dia 1 de dezembro, nós tivemos as eleições parlamentares na Romênia, com 134 acentos no Senado e 331 acentos no Câmara de Deputados, em jogo, todos os acentos."
