start_segment,end_segment,text
3664.0,3668.0,"O portavô, a Saudita, disse que a Araba Saudita não participou do ataque,"
3668.0,3672.0,e que a Araba Saudita não permite que o seu espaço aéreo seja utilizado
3672.0,3675.0,"por aviões de combate de outros países,"
3675.0,3682.0,"só que assim, é virtualmente impossível um avião,"
3682.0,3689.0,"Israelense, saíre de Israel, chegar no IEM sem esbarrar no espaço aéreo saudita,"
3690.0,3695.0,"porque mesmo que ele vá pelo sul, ele vá ali por aelate,"
3695.0,3700.0,"vá pelo marvermelho, ele ou vai violar o espaço aéreo egípcio,"
3700.0,3703.0,"ou saudita, e aí depois você vai ter o espaço aéreo sudaneio,"
3703.0,3708.0,"o espaço aéreo dele treia, então assim, a Araba Saudita,"
3708.0,3712.0,"ou não detectou os aviões esredenses,"
3712.0,3716.0,"ou se fez isso entendida, ou autorizou expressamente,"
3716.0,3721.0,"lembrando que a Araba Saudita e os Utis são inimigos também,"
3721.0,3725.0,então qual foi o papel da Araba Saudita nisso tudo?
3725.0,3729.0,"saber, esse é o ponto, porque não tem como avião,"
3729.0,3734.0,"saíre de Israel, chegar no IEM sem pelo menos esbarrar no espaço aéreo saudita,"
3734.0,3738.0,"a não ser que foi pelo espaço aéreo egípcio e de lá pro espaço aéreo sudanei,"
3738.0,3744.0,"então, enfim, novamente, ou não detectaram, ou fizeram desentendidos,"
3745.0,3748.0,"segundo as autoridades relências, foi um atac aéreo,"
3748.0,3756.0,"100% coordenado e realizado por Israel sem participação de qualquer outro ator,"
3756.0,3759.0,"ou seja, sem participação dos Estados Unidos,"
3759.0,3763.0,"e segundo uma empresa de satélites, Nerlandesas,"
3763.0,3769.0,"33 tanques de combustível, tanques de petróleo no porto,"
3769.0,3773.0,"foram destruídos, segundo as imagens de satélite"
3773.0,3777.0,"e segundo os próprios autis, seis pessoas ficaram mortas."
3777.0,3783.0,"Os autis depois realizaram um ataque contra a cidade de Eilat,"
3783.0,3787.0,"que fica bem no extremo sud Israel, justamente na costa do Mar Vermelho,"
3787.0,3791.0,"onde você tem tanto um porto quanto uma área de resort,"
3791.0,3795.0,"o mar de praias e tal, e para esses ataques,"
3795.0,3800.0,"utilizaram, melhor dizendo, misses balísticos e, novamente,"
3800.0,3803.0,"o espaço aerosaldy está no meio,"
3803.0,3806.0,"e aí ocorreu uma questão interessante,"
3806.0,3811.0,"que é, no dia 23 de julho, ou seja, depois dos ataques,"
3811.0,3816.0,"esraelenses, depois do ataque ao T e do ataque esraelense,"
3816.0,3822.0,"nós tivemos um novo acordo entre os autis e o governo em eminta de SANA,"
3822.0,3827.0,a assinatura desse acordo teve a presença do inviado especial da ONU
3827.0,3830.0,"para as negociações, o Hans Grunberg,"
3830.0,3838.0,"e falam na retomada de voos regulares da empresária Ieménia entre SANA e a Jordânia,"
3838.0,3846.0,"também entre SANA e o Cairo, também a ideia de retomarem serviços bancários,"
3846.0,3856.0,"removerem restrições bancárias, revogarem algumas decisões de confiscos de propriedades,"
3856.0,3860.0,e desescalarem a situação entre os dois atores.
3860.0,3865.0,"Pode não ter nada a ver com Israel, essa decisão, pode,"
3865.0,3873.0,"mas também pode ter ligação, e aí eu estou falando com a cabeça de apaixonado por história."
3873.0,3877.0,"Durante a primeira guerra do Gulfo em 1991,"
3877.0,3883.0,"o Sadan Hussein, ele ordenou ataques com misses balísticos,"
3883.0,3891.0,"escudos contra Israel, porque? Porque ele queria provocar uma reação em Israelense"
3891.0,3897.0,"para com a provocação, com o ataque à Israelense,"
3897.0,3901.0,os outros países árabes que estavam lutando contra o iráquido Sadan Hussein
3901.0,3905.0,"e aí especialmente a Araba Saudita, porque foi a partir da Araba Saudita"
3905.0,3910.0,"que ocorreu toda a intervenção militar dos Estados Unidos e do Reino Unido,"
3910.0,3914.0,"os outros países árabes, falassei, olha a sua apere não, vamos sair da guerra,"
3914.0,3917.0,porque a gente não vai lutar do mesmo lado que Israel.
3917.0,3921.0,"O governo dos Estados Unidos da época, do Bush Pie,"
3921.0,3924.0,"isso já é bastante documentado, já é bastante conhecido,"
3924.0,3929.0,teve que fazer vários esforços diplomáticos para disso a dia das autoridades
3929.0,3932.0,"esredaleses de retaliarem contra o Sadan Hussein,"
3932.0,3937.0,"para justamente isso não ocorrer, para não correr o risco de Araba Saudita,"
3937.0,3943.0,"Syria, Jordania, Polar em fora da coalizão antes Sadan."
3943.0,3947.0,"Então pode estar ocorrendo algo similar,"
3947.0,3951.0,"dos UTIs e do governo de Sanaa, os UTIs apados pelo ira,"
3951.0,3954.0,"governo de Sanaa que era poeda pela Araba Saudita,"
3954.0,3958.0,"mas a outra facção do Sul, apoiada pelos Emirados Árabes Unidos,"
3958.0,3962.0,"ele seitare falar, olha só, vamos deixar a nossa guerra de lado,"
3962.0,3966.0,porque a gente tem que se unir por contra Israel primeiro.
3966.0,3969.0,"É possível, não estou afirmando que isso ocorreu,"
3969.0,3976.0,"estou especulando, agora vamos falar da agência da ONU para refugiados palestinos"
3976.0,3979.0,e do funcionamento do próprio governo palestino.
3979.0,3985.0,"Primeiro, o Parlamento Israelense aprovou uma moção que declararia"
3985.0,3992.0,"a agência da ONU para refugiados palestinos como uma organização terrorista,"
3992.0,3996.0,"ela vai passar pelo comitê de relações exteriores ainda,"
3996.0,4001.0,"porém muito provavelmente isso precisaria de um reconhecimento do executivo,"
4001.0,4006.0,"do governo Netaniarro, não sei se o governo Netaniarro estaria disposto"
4006.0,4012.0,"a essa briga nesse momento, porém não podemos duvidar de nada."
4012.0,4015.0,"E eu digo nesse momento, nesse momento,"
4015.0,4018.0,"de versos para de lição nos Estados Unidos,"
4018.0,4021.0,de rotas diplomáticas para Israel e tudo mais.
4021.0,4027.0,"Ao mesmo tempo, o reenunido anunciou que vai retomar o financiamento da agência"
4027.0,4030.0,que havia sido paralisado durante o governo Richi Sunak
4030.0,4035.0,e vai enviar 27 milhões de dólares para agência.
4035.0,4044.0,"E finalmente, a autoridade palestina vai receber 435 milhões da União Europeia"
4044.0,4049.0,"já que a autoridade palestina está num total colapso financeiro,"
4049.0,4054.0,"já que o governo Israelense, pelo ministro Esmôtrit,"
4054.0,4058.0,está barrando os repasses para a autoridade palestina.
4058.0,4062.0,"E lembre-se, a autoridade palestina é responsável por pagar o salário de professores,"
4062.0,4066.0,"pagar os salários públicos, pagar o salário de médicos e tudo isso."
4066.0,4069.0,"Ah, mas Felipe, tem muita corrupção na autoridade palestina."
4069.0,4073.0,Tem? Tem para caramba! Você não tem a dúvida nenhuma disso.
4073.0,4079.0,Mas isso não quer dizer que também não tem pessoas que dependem dessa...
4079.0,4083.0,"desse dinheiro, que dependem dessa estrutura de governança,"
4083.0,4090.0,"que mesmo sofrendo todas as amarras possíveis, ainda é uma estrutura de governança nacional."
4090.0,4097.0,"Falamos agora de gása, começando pelo fato de que, na última terça-feira de 23,"
4097.0,4104.0,"OMS declarou um estado de preocupação com possíveis epidemias em gása,"
4104.0,4109.0,"já que foram encontrados amostras do polio-vírus tipo 2,"
4109.0,4115.0,"que eu vi os da polio-milite, justamente em amostras de água residual."
4115.0,4124.0,Também foram registrados casos de hepatite e possibilidade de surtos de cólera
4124.0,4130.0,"já que a água tratada está se tornando cada vez de mais difícil acesso,"
4130.0,4134.0,já que toda a estrutura foi destruída pelos ataques aéreos israelenses.
4134.0,4139.0,"Essa semana tivemos, pelo menos, 89 pessoas mortas,"
4139.0,4146.0,"num ataque aéreo na região de Caniunis, que deixou mais de 250 pessoas feridas também."
4146.0,4151.0,"Também nessa semana, o governo israelense ordenou a evocuação"
4151.0,4157.0,de uma das onas humanitárias para mais uma um elemento terrestre da ofensiva.
4157.0,4162.0,E a gente já explicou aquilo programa que essas evacuações começam a se tornar
4162.0,4165.0,cada vez mais impraticáveis.
4165.0,4172.0,"A ONU também falou via o escritório da ONU para os territórios palestinos ocupados,"
4172.0,4178.0,"afirmando que gása está com problema já de um estado de anarquia,"
4178.0,4190.0,"incluindo SAC e assassinatos execuções extra judiciais e violência contra trabalhadores humanitários,"
4190.0,4196.0,devido o total colapso do tecido social da faixa de gás.
4196.0,4203.0,"E finalmente, uma notícia desse dia 25, dessa quinta-feira,"
4203.0,4214.0,"o governo israelense anunciou que resgatou 5 corpos de refenso que foram tomados no dia 7 de outubro no ano passado,"
4214.0,4217.0,4 homens e uma mulher.
4217.0,4223.0,"Agora vamos para notícias relacionadas a israel, 3 delas."
4223.0,4232.0,"Primeira delas é que o partido, o Trortodoxos, Xaz, ordenou que os seus integrantes resistam a ordem"
4232.0,4238.0,"de conscrição, a ordem de serviço militar obrigatório, que foi autorizada pela Suprema Corte,"
4238.0,4244.0,"é a pauta que tomava a política esraelense já nos últimas duas décadas, sobre as três décadas."
4244.0,4249.0,"E o Xaz é um partido que é da base do Netanyahu,"
4249.0,4254.0,ele que precisa dos partidos ortodoxos para se manter no poder.
4254.0,4259.0,"Também relacionado a israel, o ministro da educação, o IOV Kish,"
4259.0,4267.0,está defendendo no Kineset um projeto de lei que estabeleceria um comitê nomeado pelo governo
4267.0,4277.0,que teria autoridade para demitir funcionários e professores de universidades que expressem apoio ao terrorismo
4277.0,4281.0,"e que caso os universidades não cumpram com essas eventuais decisões de demissões,"
4281.0,4285.0,poderiam ter os seus financiamentos cortados.
4285.0,4294.0,Em bom português estamos falando de um instrumento estatal de censura que inclusive tem sido chamado
4294.0,4307.0,"no debate público-Israelense de Macartista, incluindo numa carta da associação de diretores universitários de Israel."
4308.0,4318.0,"E finalmente o governo australiano, essa semana, anunciou a sessões financeiras de viagem"
4318.0,4331.0,contra sete colonos esraelenses e um grupo de juventude esraelense por violência política contra palestinos na sejordana.
4332.0,4337.0,"E para a gente fechar esse giro entre aspas pelo nente médio, mas foi basicamente questão palestina"
4337.0,4346.0,"e israel, essa semana o baixar alaçado, o presidente ditador herdeiro da ditadura Siria,"
4346.0,4352.0,se encontrou com o Vladimir Putin no Kremlin. Isso é importante porque muito provavelmente
4352.0,4359.0,"teremos um encontro tripartite em breve entre assade, Putin e Erdogolum."
4360.0,4369.0,"E agora a gente vai para as efemérides da semana que vem, já que se já estão me aguentando aqui, já tem um tempo."
4373.0,4375.0,A semana na história
4376.0,4390.0,"29 de julho de 1899, a 125 anos, era assinada a primeira convenção de AIA."
4390.0,4400.0,"As duas convenções de AIA, de 1899 e de 1997, elas são muito importantes como marcos do Direito Internacional,"
4401.0,4413.0,"é na segunda delas inclusive, que o Rui Barbosa recebeu a apelido AIA pela sua defesa do princípio de que cada estado tem que ser igual ao outro."
4413.0,4422.0,"Então o voto de um estado não pode ter um peso maior que o outro, então o voto da França não podia ter um peso maior que o voto do Brasil,"
4422.0,4429.0,"embora a França fosse uma potência colonial, uma potência militar, e por aí vai."
4429.0,4443.0,"Então são marcos importantes, a conferência de 1899, ela lida, especialmente com o tema do desarmamento, já que a Europa vivia naquele momento, uma corrida militar,"
4443.0,4457.0,"uma escalada militar que combina na primeira guerra mundial, inclusive, ela proposta pelo que Zárnikolau segundo, justamente para não necessariamente evitar, mas diminuir os temores de uma guerra na Europa."
4457.0,4469.0,"Que era bastante previsível. Isso, e assim, novamente ela é importante estabelece provisões importantes que se tornam bases legais, posteriores,"
4469.0,4485.0,"porém sempre entra aquele pasterisco ali na eficácia do Direito Internacional, já que por exemplo a primeira convenção de AIA, que estamos aí relembrando 125 anos, ela proibia o uso de gases em guerra."
4485.0,4491.0,"E a gente sabe que na primeira guerra mundial o que não faltou foi gasmos tarda entre outras armas químicas, né?"
4491.0,4505.0,"Ela proibiu a bala Dundun, aquela bala que expande dentro do corpo e causa mutilações, algo que também não foi muito para frente, mas 125 anos então da primeira conferência de AIA."
4505.0,4520.0,"27 de julho de 1924, 100 anos atrás eram encerrados os jogos olímpicos de Paris, uma sensação de de Javu."
4520.0,4525.0,"Pois é, não, não, não, não, não, não, você viu os final de Javu, de Paris de 1924?"
4525.0,4527.0,"Não, eu vi o de 1910."
4528.0,4537.0,"Bem, serve inclusive por um alto jabado o último nerodologia de história sobre justamente os outros dois jogos olímpicos em Paris,"
4537.0,4548.0,"e o jogo de 204, está de olímpico de 1924, vai ser utilizado agora modernizado, claro, para o oque na grama, inclusive, né?"
4548.0,4578.0,"É, é, é, é, é, é, é, é, é, é, é, é, é, é, é, é, é, é, é, é, é, é, é, é, é, é, é, é, é, é, é, é, é, é, é, é, é, é, é, é, é, é, é, é, é, é, é, é, é, é, é, é, é, é, é, é, é, é, é, é, é, é, é, é, é, é, é, é, é, é, é, é, é, é, é, é, é, é, é, é, é, é, é, é, é, é, é, é, é, é, é, é, é, é, é, é, é, é, é, é, é, é, é, é, é, é, é, é, é, é, é"
4578.0,4608.0,"é, é, é, é, é, é, é, é, é, é, é, é, é, é, é, é, é, é, é, é, é, é, é, é, é, é, é, é, é, é, é, é, é, é, é, é, é, é, é, é, é, é, é, é, é, é, é, é, é, é, é, é, é, é, é, é, é, é, é, é, é, é, é, é, é, é, é, é, é, é, é, é, é, é, é, é, é, é, é, é, é, é, é, é, é, é, é, é, é, é, é, é, é, é, é, é, é, é, é, é, é, é, é, é, é, é, é, é, é, é, é"
4608.0,4638.0,"é, é, é, é, é, é, é, é, é, é, é, é, é, é, é, é, é, é, é, é, é, é, é, é, é, é, é, é, é, é, é, é, é, é, é, é, é, é, é, é, é, é, é, é, é, é, é, é, é, é, é, é, é, é, é, é, é, é, é, é, é, é, é, é, é, é, é, é, é, é, é, é, é, é, é, é, é, é, é, é, é, é, é, é, é, é, é, é, é, é, é, é, é, é, é, é, é, é, é, é, é, é, é, é, é, é, é, é, é, é, é"
4638.0,4655.16,"Mas ele competiu como Frances, era filho de um diplomata e competiu como Frances, tal qual o filho do barão do Rio Brão que era o jogo de rugby foi éxa campeão francês, né? E uma outra curiosidade desse jogos de Paris de 1924 é que se você olhar o logo, né?"
4655.96,4671.28,"Eles são os jogos da oitava olimpiada, né? Porque olimpiada um ciclo de quatro anos, mas eles foram os setemos jogos, porque os jogos de 1916 não ocorreram por motivos óbvios, inclusive, seriam em Berlim. É impressionante que assim,"
4671.28,4686.28,"a olimpiada que é cancelada durante uma guerra mundial ainda é num país que perdeu, né? Vamos colocar nessa maneira, né? Porque Berlim era 1916 e toque o 1942, né? Então..."
4686.28,4716.28,"É, é, é, é, é, é, é, é, é, é, é, é, é, é, é, é, é, é, é, é, é, é, é, é, é, é, é, é, é, é, é, é, é, é, é, é, é, é, é, é, é, é, é, é, é, é, é, é, é, é, é, é, é, é, é, é, é, é, é, é, é, é, é, é, é, é, é, é, é, é, é, é, é, é, é, é, é, é, é, é, é, é, é, é, é, é, é, é, é, é, é, é, é, é, é, é, é, é, é, é, é, é, é, é, é, é, é, é, é, é, é"
4716.28,4746.28,"é, é, é, é, é, é, é, é, é, é, é, é, é, é, é, é, é, é, é, é, é, é, é, é, é, é, é, é, é, é, é, é, é, é, é, é, é, é, é, é, é, é, é, é, é, é, é, é, é, é, é, é, é, é, é, é, é, é, é, é, é, é, é, é, é, é, é, é, é, é, é, é, é, é, é, é, é, é, é, é, é, é, é, é, é, é, é, é, é, é, é, é, é, é, é, é, é, é, é, é, é, é, é, é, é, é, é, é, é, é, é"
4746.28,4754.68,"ainda na área esportiva, vamos agora para três de agosto de 1949, já que no sábado da"
4754.68,4763.48,"semana que vem, teremos a celebração dos 75 anos da criação da National Basketball"
4763.48,4771.48,"Associations nos Estados Unidos a popular NBA. A NBA, né, ela é fundada a partir de uma"
4771.48,4781.48,"fusão, né, porque existia a Basketball Association of America e a National Basketball League, né,"
4781.48,4789.48,"e aí, a Basketball Association of America, ela foi fundada em 1946 e durante muito tempo,"
4789.48,4799.48,"a data de 1946 era considerada a data de fundação da NBA, né, só que posteriormente a NBA passou"
4799.48,4809.48,"a dotar a data de 1949, tanto que foi agora, né, que nós tivemos a escolha, né, eleição do time de 75"
4809.48,4817.48,"anos de NBA, né, que como qualquer eleição esportiva sempre vai dar suas polêmicas e tal, e lembrando"
4817.48,4825.48,"posteriormente, né, em 1976 tem a fusão com a aba, né, American Basketball Association que cuja"
4825.48,4829.48,"pegada por um momento, o San Antonio Esports, né, então a..."
4829.48,4833.48,"Jogaram com aquela bola de color, né, com as colhas da..."
4833.48,4841.48,"Da bandeira, exatamente, que hoje não enti a Moneyball, né, não, mas então assim, tem um debate, né,"
4841.48,4849.48,"não debate não, né, você tem escolha sobre qual seria a data de fundação da NBA, mas a data, né,"
4849.48,4857.48,"da da fusão e que criou nome, né, NBA, em 1949, porque é a junção dos dois domes, né,"
4857.48,4864.48,"porque era Basketball Association of America e a outra, National Basketball League, então vira"
4864.48,4872.48,"National Basketball de uma com a association da outra, então 75 anos aí da NBA que para muitas"
4872.48,4878.48,"pessoas que engocem de basket fornece aí a diversão entre o entendimento, distração,"
4878.48,4886.48,defesa conspiração e raiva sofrimento e desejo de que um idoso largue o oço e transfero
4886.48,4892.48,"comando do Chicago Bulls para alguém disposto a ganhar alguma coisa, todo respeito."
4892.48,4894.48,"Tá aí, o carinho da torcida."
4894.48,4902.48,"Bem, passemos agora para o Met, no qual eu Felipe Assilve, aderemos aquele tradicional"
4902.48,4905.48,que é pela nossa quebrada latino-americana.
4933.48,4944.48,Eis presidente argentino Alberto Fernandes diz que foi desconvidado como observador de eleição na Venezuela.
4944.48,4953.48,"O Alberto Fernandes escreveu nas suas redes sociais uma carta dizendo que ontem, no caso,"
4953.48,4958.48,"ele escreveu na quarta-feira dia 24 de julho, entre ele se refere ao dia 23, né,"
4959.48,4966.48,"ontem o governo nacional, Venezuela, não me transmitiu, só vontade de que eu não viagem e desista de cumprir a tarefa"
4966.48,4969.48,que me foi dada pelo conselho eleitoral.
4969.48,4976.48,"A razão que me foi dada aqui na opinião do governo declarações públicas feitas por mim,"
4976.48,4983.48,"ao meio de comunicação nacional causaram desconforto e geraram dúvida sobre minha impartialidade,"
4984.48,4991.48,"o que o Alberto Fernandes disse então, que se um aduro for derrotado o que ele deve fazer"
4991.48,4996.48,"é aceitar como disse Lula, quem ganha a ganha, quem perde, perde."
4996.48,5002.48,"Vou fazer o que me pediram, ser um observador das eleições para que tudo funcione bem."
5002.48,5010.48,"Claro, esse é um resumo da carta do Alberto Fernandes e um dos principais tópicos do nosso programa de hoje,"
5010.48,5018.48,"obviamente, mais se as eleições venezuelanas deste final de semana e a nossa querida Silvia está em Cucuta,"
5018.48,5023.48,"na Colomba, na fronteira, que a Venezuela, inclusive ela se teve durante o dia no Venezuela,"
5023.48,5030.48,"ela que está lá trabalhando pelo Minduse, inclusive acompanhe também a repercussão das eleições venezuelanas"
5030.48,5037.48,"lá no Minduse, que vai contar com a Silvio, o trabalho dela, e também pode potencialmente contar com matias"
5037.48,5043.48,caso a agenda permita porque rockstar é complicado.
5043.48,5045.48,"Na verdade, o fight for me."
5048.48,5054.48,"Muito bem, eu achei essa resposta da Alberto Fernandes uma tristeza,"
5054.48,5063.48,"porque a gente vê que ele usou todo tipo de eufemismos e circos-loques para dizer que ele entendeu o que não deveria ir,"
5063.48,5074.48,"mas que não está chateado e que respeita democracia, mas que enfim, ele não conseguiu explicar que ele não tinha"
5074.48,5077.48,"ficado chateado de ter sido desconvidado, né?"
5077.48,5081.48,"Por ou menos era esse para parecer ser a intenção da carta, né?"
5081.48,5083.48,"No que ser conflitivo, né?"
5083.48,5091.48,"E onde estava vendo o programa de entrevistas do Jaime Bailey, que é um jornalista peruano bem ácido, assim?"
5091.48,5095.48,Com o cabelo de roqueiro britares uns 70.
5095.48,5103.48,"Exato, descoorda de mundo que ele disse, mas ele é muito agudo nas suas observações e ele disse,"
5103.48,5108.48,"bom, a Alberto Fernandes tinha sido convidado para ser observador de estraído, né?"
5108.48,5111.48,"E por tanto, não vai fazer muita falta."
5111.48,5116.48,"Enfim, essa, essa, o capítulo Alberto Fernandes, dessa crise regional que virou,"
5116.48,5121.48,"essas declarações do Maduro ao redor da expressão banho de sangue, né?"
5121.48,5122.48,Mas seguimos.
5122.48,5130.48,"E junto com isso, o TSE desistiu de acompanhar as eleições da Venezuela,"
5130.48,5134.48,"já que o Maduro, ele primeiro, né?"
5134.48,5140.48,"Ele não citou o nome do Lula, mas ele usou aquela expressão banho de sangue que vocês repercutiram no programa Passas,"
5140.48,5141.48,né?
5141.48,5149.48,"E ele disse que quem ficou assustado devia tomar um chá de camomila, ou seja, se refenindo ao Lula."
5149.48,5160.48,"E depois, ele mentiu, podemos usar o verbo correto dizendo que no Brasil não existe a audição das atas eleitorais,"
5160.48,5162.48,nem na colombia.
5162.48,5168.48,"Nem na colombia e que o sistema eleitoral venezolano é muito superior ao sistema eleitoral brasileiro,"
5168.48,5178.48,"e aí o TSE é, provavelmente, em concerto, com restante as instituições do governo brasileiro,"
5178.48,5183.48,"melhor dizendo, já que o TSE é uma instituição de Estado, uma instituição de governo,"
5183.48,5187.48,"disse que não enviaria mais os técnicos para acompanhar as eleições,"
5187.48,5193.48,"já que o Maduro fez essas acusações sem fundamento, ou emitiu essas mentiras,"
5193.48,5198.48,sobre o sistema eleitoral brasileiro.
5198.48,5208.48,"Então, a ausência do TSE, ao meu ver, não sei a visão de vocês, aí vocês vão discutir aí,"
5208.48,5216.48,a contribui para diminuir ainda mais a eventual legitimidade do pleito venezolano
5216.48,5223.48,"e eventual imagem de lizura ou falta d perante a comunidade internacional,"
5223.48,5226.48,mas aí tivemos essas duas em relação ao Lula.
5226.48,5236.48,"Na verdade, somando isso ao fato de Gustavo Petro ter decidido não enviar mais o Luis Murillo,"
5236.48,5243.48,"que é o seu chão de seler, o seu seu sonorim deles, a Caracas, nos faz pensar,"
5243.48,5253.48,"qual é a chorada aí, a ideia é fazer a observação para ajudar a legitimar o verusutado,"
5253.48,5259.48,"que seja a pró de tadura ou oposição, ou tira o time de campo,"
5259.48,5263.48,"porque a gente já sabe que vai ser um fraude, é melhor a gente não está envolvido,"
5263.48,5266.48,"não entendi direito, porque não ir então."
5266.48,5270.48,"É bem possível que seja esse segundo cenário que você me insionou também,"
5270.48,5275.48,"e no caso do TSE, pelo menos, eu consigo entender a lógica,"
5275.48,5278.48,"e é uma lógica que a gente já viu em vários acasionais,"
5278.48,5284.48,"que é, se você offende ou ataca um outro país, um outro chefe de governo,"
5284.48,5286.48,"numa instituição de outro país,"
5286.48,5289.48,"depois você não pode também querer que essa instituição,"
5289.48,5291.48,"esse país copérico, você, né?"
5291.48,5297.48,"Então, mas essa segunda possibilidade que você levantou também é muito possível,"
5297.48,5302.48,"de que essas retiradas brasileiras, colombiana,"
5302.48,5307.48,"seja também um sinal de qual é só, já o jogo já está armado,"
5307.48,5309.48,não vamos ajudar a legitimar isso.
5311.48,5315.48,"Sim, eles podem ter uma interna, de que ele vai roubar de porquê jeito,"
5315.48,5317.48,"porque já sabe que não tem os votos, não sei."
5317.48,5321.48,"O mercado especulativo está a fúli,"
5321.48,5324.48,"não é necessitias, com relação a domingo."
5325.48,5330.48,"E aproveitando, e aí vocês têm bastante coisa de Venezuela para discutir também,"
5330.48,5336.48,mas aproveitando o gancho é importante mencionar que todas pesquisas
5336.48,5343.48,"que estão sendo publicadas mais recentes estão dando uma vitória dua de mundo com os alhos,"
5343.48,5347.48,"e uma vitória relativamente confortável,"
5347.48,5354.48,"algumas instituições que as exisão descreditadas como serem antimadura,"
5354.48,5359.48,"alguma coisa assim, porém outras instituições de pesquisa eleitorais,"
5359.48,5362.48,"tanto dentro, quando fora da Venezuela, como por exemplo,"
5362.48,5368.48,"algumas instituições peruanas, estão dando uma vantagem dua de mundo com os alhos."
5368.48,5369.48,Sim.
5369.48,5372.48,"Claro, as pesquisas já foram desmentidas antes, mas assim,"
5372.48,5375.48,"você tem a pesquisa, por exemplo, do poder estratégia,"
5375.48,5380.48,"está dando uma diferença de 60% dos votos pro mundo com os alhos,"
