start_segment,end_segment,text
0.0,4.0,O Podiqueche que você ouve agora uma produção da Centra III.
4.0,17.0,Começa agora ao Chadreis Verbal.
17.0,27.0,Bom crepúsculo ouvintes da Centra III está começando mais o Medição do Chadreis Verbal.
28.0,33.0,O nosso arrevista semanal de política internacional em formato Podiqueche.
33.0,36.0,Meu nome é Matias Pinti como sempre estou ao lado dele.
36.0,43.0,"Meu amigo e companheiro, Felipe Nobre, Figueiredo, o homem por trás da tabuleiro."
43.0,45.0,"Olá, meu caramatias. Olá, todos nós ouvintes."
45.0,48.0,Todo mundo que nos houve nos prestigios nos divulgamos tolera nos âmonos deseja.
49.0,57.0,"Desqui nos odeia, mais um nos tira do ouvido, chegando aqui mais uma edição do Chadreis Verbal."
57.0,64.0,"Programa de número 388. Você tem algum ônibus com esse número, meu caramatias?"
64.0,74.0,"888. Olha, Felipe, no último final de semana fiquei novamente na casa dos meus amigos Daniel e Anne Luise."
75.0,84.0,"Daniel é um busólogo, gosta de ele e falou que o 388 é a maior linha do Rio de Janeiro em extensão."
84.0,88.0,A linha Cesarão terminal da Candelária.
88.0,92.0,"Candelária eu conheço, Cesarão não faça a mínimidade onde seja."
92.0,94.0,"Pois é, também não conheço."
94.0,98.0,Se você está nos ouvindo no Cesarão um abraço para você.
98.0,100.0,E vai pela vinha da Brasil?
101.0,106.0,A vinha da Brasil que todos conhecemos por causa da novela que revelou a lei da Pereira para o Brasil.
109.0,116.0,"E antes da gente começar, sempre iniciamos o programa com os comentários corressões sobre o programa passado."
116.0,131.0,"Então, tanto o Pedro quanto o Roberto Nogata trouxeram a informação que o calibre do RIFLE AR15 que foi utilizado para no atentado contra o Donald Trump,"
131.0,146.0,"era um calibre, o 5.5, o 5.5, o 5.5, o 5.5, o 5.5, o 6, o padrão otê, não era um ponto 22, o ponto 22 ou o ponto 22 LR, é aquela munição mais de diâmetro menor,"
146.0,158.0,"mais fraca entre aspas, essa embora seja um calibre muito parecido, ele tem ali uma casinha, a mais, ele tem um stojo maior com mais pòvora"
158.0,171.0,"e um projeto mais pesado, então ele é um projeto mais capaz, eu peço desculpas pela confusão, porém eu queria registrar que tenha R15 com o calibre 22 LR sim,"
171.0,186.0,"então não é que eu também cheguei a inventar o RIFLE, foi a informação que tinha ali na hora sobre o calibre da munição que atingiu o Donald Trump, e inclusive tivemos uma pessoa que faleceu no episódio,"
186.0,190.0,"então a gente agradece aos melhores ouvintes do mundo pela ajuda,"
190.0,194.0,"passamos agora para o primeiro bloco do giro de notícias,"
194.0,198.0,"de notícias,"
213.0,216.0,"giro de notícias,"
216.0,233.0,"notícias da sexta-feira passada de 19 de julho, União Europeia assina a cor do para exploração de lítio,"
233.0,249.0,"a União Europeia e a Cérvia assinaram acordo para exploração da mina de jadar, que contém lítio, é considerado nos maiores reservas de lítio potenciais do mundo,"
249.0,264.0,"e também boro, que é aquele mineral que muitas pessoas talvez se lembrem, tem alguma referência, por conta da tragédia de Chernobyl, que inclusive é mencionada na série Chernobyl,"
264.0,276.0,"que eles tentam usar o boro ali para cobrir o rombro no reator, essa mina tem 108 milhões de toneladas, deminérios,"
276.0,287.0,"porém não são 108 milhões de toneladas de lítio, o óxido de lítio está misturado ali no solo,"
287.0,297.0,"então você precisa ter também um processamento do que será minerado, e recentemente a gente comentou dessa notícia,"
297.0,298.0,por que?
298.0,308.0,"Porque inicialmente o governo serviu assinou um acordo com a Rio Tinto, uma das maiores mineradoras do mundo,"
308.0,314.0,alguns diriam que uma das maiores cometeroras de crimes ambientais do mundo também...
314.0,315.0,Não se esclui...
315.0,321.0,"Não, mas não somos nós que estamos falando via devogados, algumas pessoas diriam isso."
321.0,332.0,"E aí, em 2022, início de 2022, a gente comentou isso aqui no programa, nós tivemos vários protestos na Serbia contra o projeto por razões ambientais,"
332.0,337.0,e a Serbia revogou o acordo com o Rio Tinto.
337.0,349.0,"Nesse mês, entretanto, a Suprema Corte da Serbia disse que a revogação do acordo pelo governo serviu foi inconstitucional,"
349.0,359.0,"e a Serbia, interessada em cumprir pelo menos parte das metas verdes da União Europeia, pensando no eventosa ascensão,"
359.0,369.0,"um dia, assinou esse acordo agora com a União Europeia para estabelecer os critérios para a exploração dessa reserva."
369.0,372.0,"E isso se liga algo que a gente falou recentemente, né?"
372.0,378.0,"Quando nós tivemos aquela tentativa de golpe de estado na Bolívia, e deu inclusive uma fuzarca muito grande no Twitter,"
378.0,385.0,"porque eu escrevi lá no Twitter que nada indicava que tinha relação com o lítio, aquela tentativa de golpe de estado."
386.0,391.0,"A Bolívia tem grandes reservas de lítio, tem mais uma coisa que a gente falou naquele programa que eu falei no Twitter,"
391.0,394.0,"é, o lítio não é um mineral tão raro assim."
394.0,400.0,"A grande questão do lítio aqui, até agora, pouca, ele nem era procurado direito, porque ele não teria tantas utilidades."
400.0,406.0,"Agora que ele se torna um mineral mais importante, as pessoas vão começar a procurar por mais lítio,"
406.0,411.0,"em locais, inclusive, onde levantamentos geológicos já foram feitos, enfim."
411.0,414.0,"Então, tivemos esse acordo para a exploração de lítio na Serbia."
414.0,423.0,"Na Alemanha, a gente vai passar aqui para algumas notícias europeias brevemente, a Alemanha fechou o centro islâmico de Amburgo,"
423.0,432.0,"afirmando que ele era um local de difusão, de ideias extremistas, e ligado financeiramente ao resbolar,"
432.0,436.0,que é classificado na Alemanha como um grupo terrorista.
436.0,442.0,"Falando em Alemanha, um cidadão alemão foi condenado a morte em Bella Rousse,"
442.0,447.0,lembrando que Bella Rousse é o único país europeu que ainda tem a pena capital.
447.0,452.0,Ele foi condenado por terrorismo e atividades mercenárias.
452.0,463.0,"Não está claro ainda qual teria sido o papel dele, mas, aparentemente, ele foi preso em Bella Rousse"
463.0,468.0,depois de combater na Ucrania pelos Ucranianos.
468.0,475.0,"Então, ele foi preso em Bella Rousse por e condenado por essas atividades mercenárias e terrorismo."
475.0,483.0,"Já cruzando a fronteira da Alemanha, com a Dinamarca, a Polícia de Na Marqueza aprendeu o Canadém-se Paul Watson."
483.0,493.0,Ele foi preso na Groenlandia e ele é um dos maiores atuantes internacionais de combate a Caça as Baleias.
493.0,502.0,O pedido de prisão dele ocorreu 12 anos atrás no Japão que como unicou a Interpol e consequentemente tinha
502.0,508.0,um aviso pela sua detenção no sistema internacional da Interpol.
508.0,515.0,Ele tem 76 anos de idade e o Japão solicitou a sua prisão.
515.0,521.0,Já que em 2010 ele estava em um barco que realizou ataques.
521.0,529.0,"Não sei se tentativa de abarramento, se cair um d'água contra a Baleia e os japoneses nantartica."
529.0,535.0,E os advogados dele dizem que se tratou de uma emboscada.
535.0,543.0,"Porque o alerta vermelho da Interpol, que solicitava sua prisão, desapareceu da internet meses atrás."
543.0,550.0,"Isso daqui é um resumo. Vocês podem ler o relato completo, a reportagem completa."
550.0,560.0,"No autoria do Jorge de Souza, lá no Histórias do Mar, do Al, que já recomendem aqui algumas vezes o trabalho dele."
560.0,565.0,"Continuamos com protestos contra turistas na Espanha, meu caro Matias,"
565.0,573.0,"dessa vez foram em maiorca e finalmente a União Europeia retirou o conselho,"
573.0,582.0,"o europeu mais especificamente, retirou da unguria a capacidade de cediar a cúpula de ministros que ocorreria,"
582.0,594.0,"mas que vem em represália pelo fato de ele ter realizado visitas, a Moscoa e Pequim sem ter debatido essas visitas antes com a União Europeia."
594.0,600.0,"Alguns aos ouvintes podem falar, mas estão punindo o Orban por ter visitado esses países."
600.0,606.0,"A grande questão é que, no momento, ele, como chefe da unguria, como chefe de governo da unguria,"
606.0,613.0,ocupa a presidência rotativa das instituições europeias.
613.0,622.0,"Então, ele, ao visitar Moscoa e ao visitar Pequim, ele, nesse momento, ele não era apenas o primeiro ministro da Unguria,"
622.0,626.0,ele também era o presidente rotativo da União Europeia.
626.0,635.0,"E por isso, no entendimento dos seus colegas, ele deveria ter articulado essas visitas ou consultado antes,"
635.0,640.0,"os seus colegas, perdendo a redundância, e por isso, a punição."
640.0,653.0,Notícia do último domingo de 21 de julho. Suprema a corte de Bangladesh e revisa a lei de cotas após dezenas de mortos em protestos.
653.0,661.0,"Infelizmente, meu caromatias, o número de mortos já passa de 200 pessoas."
661.0,672.0,E mais de 2.500 pessoas presas. Vamos recapitular brevemente o que a gente falou no programa passado.
672.0,679.0,"Bangladesh já vem há anos com crises internas, apesar do seu grande crescimento econômico."
679.0,689.0,"Uma dessas crises é o do desemprego entre os jovens. E em Bangladesh, estava ocorrendo um debate sobre"
689.0,699.0,"a lei de cotas no serviço público. Por que? Quando o Bangladesh se torna independente em 1971, naquele momento era o Paquistão Oriental,"
699.0,710.0,foi instituído uma lei de cotas que determinava que 30% dos cargos públicos seriam ocupados pelos descendentes e familiares
710.0,713.0,de pessoas que lutaram na guerra de independência.
713.0,723.0,"Como a maneira de criar um pequeno aparato de bem-estar social, já que muitas essas famílias perderam os seus parentes,"
723.0,729.0,perderam muitas vezes os homens que garantiam o sustento da casa naquele momento na guerra.
729.0,736.0,"Então, olha só, agora você tem uma viúva com filhos para cuidar, então vamos garantir que os filhos dela têm um emprego."
736.0,741.0,"Essa era lógica, em 1971, mais de 50 anos atrás."
742.0,749.0,"Com o passar do tempo, com duas gerações, entrando na terceira geração depois, criou-se uma espécie de casta,"
749.0,758.0,pessoas que vão ter ali uma carreira pública meio que garantida. E isso foi abolido numa reforma em 2018.
758.0,767.0,"Porém, nesse ano, de 2024, essa lei de cotas foi reinstaurada pela Suprema Corte de Bangladesh,"
767.0,773.0,"dizendo que a reforma de 2018 foi inconstitucional. Então, jovens foram as ruas protestar."
773.0,779.0,"Tivemos uma repressão violentíssima dos protestos que a gente já repercutiu semana passada,"
779.0,788.0,"e nessa semana a repressão se tornou ainda pior. Tivemos polícia nas ruas, tivemos exército nas ruas,"
789.0,800.0,blackout de internet e de televisão e também a formação de grupos contra manifestantes alinhados
800.0,807.0,"ao principal partido político da shake erracina, que é a primeira ministra de Bangladesh,"
807.0,812.0,"basicamente já há 15 anos, essa já é a segunda passagem dela pelo poder."
812.0,820.0,"Então, a repressão continuou, a repressão piorou, repito, passamos dos 200 mortos,"
820.0,828.0,"e a Corte de Bangladesh, a Suprema Corte de Bangladesh, voltou atrás na sua decisão anterior,"
828.0,837.0,"e elaborou uma espécie de meio termo ali, a principal entidade estudante de Bangladesh,"
837.0,849.0,"a pelô da decisão anterior, e aí agora pela nova decisão, 5% dos cargos públicos serão mantidos para famílias de veteranos de guerra,"
849.0,858.0,"2% serão cotas para minorias étnicas, pessoas trans e pessoas com deficiência,"
858.0,863.0,"que era uma Cota que já existia, que foi instaurada nessa reforma de 2018, que a gente mencionou,"
863.0,873.0,"e os outros 93% dos cargos serão alocados na base do mérito, ou seja, o Boenvelho concurso público."
873.0,884.0,"Essa notícia, que o Matias repercutiu, é uma notícia do início da semana, os protestos perderam força,"
884.0,894.0,"porém continuam alguns dos protestos, inclusive nós tivemos confrontos hoje na Universidade de Daca,"
894.0,903.0,"contra os integrantes de outra organização estudantil, porque nós temos brigas entre as organizações estudantes também,"
903.0,909.0,nós temos ali uma verdadeira guerra entre as instituições estudantes.
909.0,916.0,"Então, temos a decisão da Suprema Corte, porém ainda não temos um fim definitivo dos protestos,"
916.0,927.0,"e tivemos a denúncia que foi veiculada, em diversos veículos de imprensa, que após a instituição de um toque de recolher,"
927.0,933.0,"os soldados dos exércitos de Bangladesh que foram colocados para patrulhar as ruas de noite,"
933.0,942.0,"que os estímulos de inglês tinham ordens de inglês chute on site, ou seja, a tirar de primeira,"
942.0,948.0,"a tirar primeiro pergunta depois, se viciam pessoas violando o toque de recolher."
948.0,955.0,"E um complemento, meu caro Matias, antes de você puxar as próximas notícias, dois complementos, na verdade,"
955.0,965.0,"aqui, 57 cidadãos de Bangladesh foram presos nos Emirados Árabes Unidos, eles estavam protestando contra o governo de Bangladesh"
965.0,972.0,"e em frente, a embaixada de Bangladesh e foram presos pelas autoridades locais,"
972.0,981.0,"porque fazer manifestação é proibido nos Emirados Árabes Unidos, e eles vão pegar 10 anos de cana"
981.0,988.0,"para manifestarem contra o próprio governo em frente e embaixado, eram protestos que não tinham ligação com os Emirados Árabes Unidos,"
988.0,999.0,"mas vão pegar 10 anos de cana. E na vizinha, a minha mar, a vizinha a Bangladesh, no caso, o comandante do exército,"
999.0,1013.0,"o Min Raun Lang, foi impossado, presidente, temporário, presidente interino, já que, ou presidente, foi afastado devido a razões médicos."
1013.0,1025.0,"Duas notícias da terça-feira passada de 23 de julho, Estados Unidos anunciam negociações de César Fogo no Sudão."
1025.0,1034.0,"O António Blinken anunciou que convidou integrantes do exército Sudanes e das forças de apoio rápido, as milícias de Engaúid,"
1034.0,1047.0,"para conversarem em Washington em 14 de agosto. Lembrando que tivemos conversas na Araba Saudita que não tiveram frutos,"
1047.0,1059.0,"a Turquia já se ofereceu para cediar conversas, não foi para frente, então vamos ver, mas eu estou fazendo isso a vizio,"
1059.0,1068.0,"porque é seticismo. E claro, a guerra do Sudão, a guerra que quase não tem espaço, no jornal nacional,"
1068.0,1076.0,"é uma coisa assim, mas vamos lembrar que hoje, final de julho de 2024, estamos gravando esse programa na noite da quinta-feira de 25 de julho,"
1076.0,1088.0,"a guerra do Sudão é o motivo da principal crise de pessoas deslocadas no mundo hoje, então se ela não é, uma notinha de rodapela, não é algo insignificante, não."
1088.0,1101.0,"Então ela já é algo que causa efeitos regionais, tem atores regionais envolvidos, o Sudão tem uma costa no Mar Vermelho, que se relaciona a uma das principais rotas,"
1101.0,1114.0,"comerciais do mundo, e junto com a questão dos ataques utis aos navios no Golfo de Adem, está levando, por exemplo, o Egito a ficar com uma situação econômica ainda mais delicada,"
1114.0,1125.0,"porque o Egito é um país que tem nas divisas do canal de Suês, sua principal fonte da chamada Moeda Forte, euros ou dólares."
1125.0,1135.0,"Então o Egito já estava em crise econômica, o canal de Suês, o volume de navios pelo canal caiu muito, o Egito está entrando em crise,"
1135.0,1146.0,"está piorando, o Sudão está nessa tragédia, então é necessário um acordo de paz, mas temos que ser séticos."
1146.0,1159.0,"O Irã anunciou que vai restaurar sua embaixada no país no Sudão, no caso, pela primeira vez em 8 anos, já que em 2016,"
1159.0,1172.0,"quando nós tivemos um ataque contra a embaixada saudita inteira, o Sudão rompeu relações com o Irã, o Sudão, a Junta Militar Sudanesa, tanto atual,"
1172.0,1184.0,"quanto o governo do Marabaxir eram aliados sauditas, então temos agora a restauração dessas relações, e finalmente uma sugestão de leitura, especialmente para quem entende de homem inglês,"
1184.0,1211.0,"porque não entende o uso Google Tradutor, porque ajuda, vai ajudar hoje a qualidade do Google Tradutor é muito maior do que quando ele surgiu, o Mark Townsend publicou uma reportagem mostrando mais de uma dezena de passaportes dos Emirados Árabes Unidos encontrados com corpos, com cadáveres, de combateintes das forças de apoio rápido,"
1211.0,1230.0,"que as forças de apoio rápido elas têm apoio dos Emirados Árabes Unidos, é uma coisa que a gente até tinha falado aqui, uma coisa digamos assim não é segredo, mas agora a grande revelação aqui, nós podemos terem então tropas dos Emirados Árabes Unidos combateindo no Sudão em solo,"
1230.0,1252.0,"podem ser apenas oficiais, servindo de comandantes, o consultor de militares, podem ser soldados comuns também, essa reportagem que eu mencionei do Mark Townsend, ela teve acesso exclusivo a um documento de 41 páginas que foi elaborado numa investigação do Conselho de Segurança da ONU,"
1252.0,1264.0,"mostrando então que soldados 12 Emirados Árabes Unidos estão no solo, não é apenas o envio de armas, não é apenas lavagem de dinheiro, fornecimento de inteligentes."
1264.0,1271.0,Macrón rejeita indicada da esquerda francesa para a PREMIER.
1271.0,1299.0,"Eu vou usar o termo que o nosso querido Thomas Rickman de Barros, que participou do programa aqui duas semanas atrás, usou na trede dele no Twitter e eu vou citar-lo agora, que é o Constitucional Hardball, está fazendo o jogo mais duro possível dentro da Constituição, ele disse que são medidas na brecha da legalidade inclusive."
1299.0,1302.0,"Semana passada, é legal, mas é imoral."
1302.0,1314.0,"É, quase isso, é uma forçada de barra. Semana passada a gente já mencionou que os ministros franceses votaram na Assembleia sendo que,"
1314.0,1323.0,"naqueles, não poderiam votar, eles teriam que ser afastados até mesmo renunciarem ao cargo de ministro."
1323.0,1326.0,E aí o que aconteceu agora?
1326.0,1342.0,"A coligação, a nova frente popular, que é a frente de esquerda, que tem como principal força a França em Subimissa, mas também tem o Partido Socialista, o Partido Verde, que são os ecologistas, não é verdade?"
1342.0,1354.0,"Eles indicaram um nome para assumir o cargo de primeiro ministro, no caso é economista, Lucicastê, que tem 37 anos de idade."
1354.0,1365.0,"E o nova frente popular fala que nós temos a maior bancada do Parlamento, então nós temos o direito de apresentar o nome."
1366.0,1382.0,"E uma cron disse que, até meados de agosto, não estamos em posição de mudar as coisas, porque isso criaria desorden, e que antes seria necessário criar uma maioria."
1382.0,1392.0,"E aí perguntaram para ele, tá, mas, porque você não pode aceitar o nome dos carros com que você inclusive fez aliança, em vários distritos durante eleição?"
1392.0,1404.0,"Lembrando, se você quiser uma cobertura completíssima sobre as eleições francesas, ouça os nossos últimos programas, inclusive, especialmente o programa com o professor Thomas Zikman de Barros."
1404.0,1418.0,"E ele disse que, qual maioria pode surgir na Assembleia Nacional para que um governo da França possa aprovar reformas, aprovar orçamento e fazer o país avançar?"
1418.0,1427.0,"Ou seja, ele na prática diz que ele quer um nome que vai aprovar as reformas dele, que vai aprovar o orçamento dele, dele e macron."
1427.0,1434.0,"Então, ele quer, no mínimo, um nome que ele possa contar ali junto dele."
1434.0,1453.0,"O macron, lembrando, algo insistir nisso, ele possivelmente pretende criar um raixa na nova frente popular, separar o partido socialista, que é um partido de centro esquerda tradicional, do frances submissa, que é um partido mais a esquerda."
1453.0,1468.0,"E aí você tem partidos ainda menores, para que acha que o frances submissa ou estalin? Você tem, por exemplo, partido anticaptalista, que é um partido de fato comunista."
1468.0,1484.0,"Então, você dizer que o macron gostaria de causar esse raixa na esquerda não é nenhum, devanei, porque tem uma parte da esquerda com quem ele acredita que pode governar junto, e tem uma parte com a qual ele não quer se associar."
1484.0,1495.0,"A gente falou que várias vezes, do discurso dele de colocar o Melanchon e a Marina Le Pen, no mesmo Patamar, e aí isso foi repetido, por exemplo, pela imbapê durante a Eurocop."
1495.0,1513.0,"Então, o macron está nessa relutância, aprovou o nome para chefear os procedimentos na Assembleia Nacional, e a Elbrão Pv, que foi mantida no cargo, usando aquela manobra dos ministros, podendo invotar."
1513.0,1532.0,"Então, assim, ele não vai formar um governo até agosto usando o limpie da justificativa, mas por trás dos panos o que ele vai fazer é tentar forçar esse raixa na esquerda e criar um bloco de dissentro, com partidos socialistas, republicanos e os macronistas."
1532.0,1538.0,"E inclusive, os jogos olímpicos têm tudo para ser uma dor de cabeça para o macron também."
1538.0,1551.0,"Ah, é, já estava com... teve greve dos dançarinos, essa semana, não teve ensaio da abertura, lembrando que se eu não gravando isso antes da abertura, então assim, se a abertura for um desastre, for um sucesso, a gente não tem como saber."
1551.0,1560.0,"E aí, meu caro Matisse, o frasí submissa, não vai ficar lá sentado tomando o tabef na cara do macron."
1560.0,1569.0,"Então, o que eles falaram? Olha só, a gente, então, vamos rever a reforma previdenciária que foi feito no passado."
1569.0,1583.0,"Que vamos lembrar, a gente falou aqui no programa que o macron aprovou aquela reforma previdenciária de maneira autoritária, usando um mecanismo da constituição francesa que permitia ele aprovar via decreto."
1583.0,1599.0,"Então, aquela não foi votada, foi via decreto. Novamente, como Matisse Olor, não foi ilegal, mas é... é ticamente questionável, porque via um mecanismo bastante autoritário, fruto ali, inclusive, de outro contexto francesa."
1599.0,1605.0,"E como, né, drama porca é bobagem, né, que é a culpa da política internacional não precisa ver novela."
1605.0,1618.0,"Quem já saiu em público dizendo que, se for votar para rechazar a reforma da previdencia, vai votar contra a reforma da previdencia do macron, o reunião nacional da Marina Elepain."
1618.0,1632.0,"Aí, do outro lado, o que que o macrono vai fazer? Ele vai falar, olha só, viram como melanchou em a elepencia a mesma coisa, eles querem votar contra a reforma da previdencia, que foi aprovada, repito, de uma maneira autoritária."
1632.0,1645.0,"O cujo principal ponto foi o aumento da idade aposentadoria, de 62 para 64 anos, mas não era só esse ponto, né, tinham vários outros pontos dignos de polêmica."
1645.0,1655.0,"Então, a França ainda promete muita dor de cabeça ou diversão, para que, que se olhar de fora, nas próximas semanas ou meses."
1655.0,1666.0,"Bem, passemos agora para a Coluna Aberta, na qual o Felipe observará o movimento das peças no sempre complicado tabuleiro do Oriente Médio."
1667.0,1678.0,Coluna Aberta
1681.0,1687.0,"Bem, pessoal, nesse bloco, nós vamos ver algumas das principais notícias dessa última semana,"
1688.0,1700.0,"algumas das mais importantes com mais repercussão, começando pelo fato de que, na última sexta-feira, de 19 de julho de 2024,"
1700.0,1715.0,"a Corte Internacional de Justiça emitiu a sua opinião consultiva sobre abro aspas, práticas de Israel no território palestino ocupado, incluindo o Jerusalém Oriental."
1716.0,1727.0,"Essa opinião consultiva da Corte Internacional de Justiça, que fica cediatim aia, muitas vezes chamada de Corte de Aia, embora esse termo causa confusão, né,"
1727.0,1734.0,"porque a Aia também está o Tribunal Penal Internacional, e a partir daqui eu vou chamar apenas pela Cígula SIGI."
1735.0,1755.0,"Então, esse parecer da CígI, ele foi provocado por um pedido da Sembleia Geral da ONU, em 30 de dezembro de 2022, ou seja, antes de qualquer evento recente, antes do ataque do ramás de 7 de outubro de 2023,"
1755.0,1766.0,"quando a Sembleia Geral da ONU, então, solicitou a opinião da Corte sobre os efeitos da ocupação esredência na palestina."
1766.0,1773.0,"Quando se fala aqui em ocupação da palestina, qual critério usado para essa avaliação?"
1774.0,1791.0,"As fronteiras de 1967, antes da guerra dos 6 dias, então, quando fala palestina e palestino ocupada, aqui, está falando desses territórios, ou seja, se Jordânia, faixa de Gaza, Jerusalém Oriental."
1792.0,1811.0,"Aquela solicitação pela Sembleia Geral da ONU foi aprovada com o voto da maioria dos países, incluindo aí Rússia e China, enquanto 27 países votaram contra, destacando Israel, Estados Unidos, Alemanha."
1812.0,1831.0,"Quem quiser ver o placar na íntegra, vocês podem ver, podem procurar pela resolução, a barra, resta de resolução, barra, 77, barra, 247."
1832.0,1836.0,"Fora 87 votos a favor, 26 contra 53 abstensões."
1836.0,1859.0,"Então, passando rapidamente pelo mecanismo da ONU, a moção aprovada no Comité Especial de Descolonização foi para a Sembleia Geral, a Sembleia Geral aprovou, daí vai para o secretário-geral António Guterres e a Secretaria Geral manda o pedido para a CIGI, dezembro de 2022, decisão saiu agora."
1861.0,1882.0,"Rapidamente, então, os pontos principais, tá lembrando que, para quem quiser ler o documento na íntegra, ele está amplamente disponível na internet, especialmente em inglês, mas acredito que seja possível encontrar em outros idiomas."
1882.0,1888.0,A presença continuada do estado de Israel no território palestino culpado é ilegal.
