start_segment,end_segment,text
5987.26,6002.26,"Sim, imagino desespero, né, porque, às vezes que aconteceu comigo que atrasar para descer, da mais com esse cenário que tem que ir acabando combustível, é uma coisa um pouco desesperadora."
6002.26,6011.26,"Nunca me aconteceu quatro horas, acho que é um pouco incomin, inclusive, mas deve gerar um certo neroposismo, porque também você não sai do lugar, né."
6011.26,6024.26,"O curioso é que a estade do México é tão grande, tão enorme, espalhada por vários e vários mais de 70 quilômetros, que eles devem ter de cada essas quatro horas sem ver outra coisa que é a própria cidade mesmo."
6024.26,6036.26,"Isso se o poluição deixasse, porque tem o efeito do fogue ali, até por conta da alta altitude, né."
6036.26,6050.26,"E esse episódio deve acender aí uma polêmica que já havia sido discutida no ano passado, que era de renovar a aeronave do presidencial brasileira,"
6050.26,6059.26,"porque imagina se a gente se acontece uma coisa com o presidente Abordo por conta de uma disputa política no Congresso, né."
6059.26,6077.26,"Pois é, e ainda relacionado ao México, tivemos nesta terça-feira uma interceptação de soldados das forças armadas mexicanas, contra um grupo de imigrantes que tentavam cruzar a fronteira com água temala,"
6077.26,6089.26,"que ocasionou a morte de seis pessoas, outros dez feridos num grupo que tinha 33 imigrantes de diversas partes do mundo, né."
6089.26,6102.26,"Não só aqui, na nossa quebrada latina americana, né. Além dos latinos ainda tinham imigrantes do Egito, Nepal, India e Pakistan."
6103.26,6115.26,"É, aumentando aí a contagem dos desaparecidos, alguns identificados outros não, de tantos mexicanos estrangeiros que buscam essa, essa, esse caminho, né."
6116.26,6130.26,"Bem, vindo aqui para o nosso país, tivemos também a entrega da medalha da amizade pelo Xi Jinping, né, o líder do governo chinês, a ex-presidenta de uma Rousseff,"
6130.26,6140.26,"que hoje comanda, né, o novo banco de desenvolvimento, mais conhecido como banco do Bricks em cerimônia que ocorreu em Shanghai, né."
6140.26,6150.26,"Inclusive, a ex-presidenta citou, né, que caiu tão veloz no exilho perguntando, né, cadê meu sol dourado, né."
6151.26,6174.26,"Enquanto que o Xi descreveu de uma, né, como uma representante excepcional dos muitos velhos amigos e bons amigos que compartilham os mesmos interesses com o povo chinês, 75 anos depois, né, aí no marco do Jubileu de Diamante, da República Popular, da China."
6175.26,6203.26,"Vamos agora para o país cito com algumas notícias locais, começando pela condenação, né, do militar da reserva Alexes Grahales, pelo homicídio do militante do Movimento de Libertação Nacional, o Guadaluç Santos, que foi torturado até a sua morte nos sexto regimento de Cavalaria, em 13 de setembro de 1973, justamente o ano, né, do golpe."
6203.26,6218.26,"Sive com militar na República Oriental do Uruguai, né, então mais um caso aí, né, de justiça em relação aos crimes contra a humanidade que ocorreram no conissu, né."
6218.26,6232.26,"Inclusive, a gente tem uma outra notícia depois nos tiles sobre esse mesmo contexto. E a pena foi de 22 anos de prisão, só que não consegui encontrar a idade do militar atualmente, né."
6233.26,6239.26,"Pensando que o crime ocorreu há mais de 50 anos, ele já deve ser um octagenaio, não é?"
6239.26,6240.26,"Certo, não."
6240.26,6246.26,"Não, provavelmente não era a cumprir, né, a pena integral, ou até pode ter um..."
6246.26,6248.26,"Um benefício, né."
6248.26,6261.26,"Enfim, falando em presos políticos, o ex-presidente Rossé Murrica recebeu em sua chá cara ali na saída de Montevideo Del, o cantor Porto Riquen,"
6261.26,6272.26,"o residente que estava em torner pelo país e acabou disse, né, que você sembrou cultivou, né."
6272.26,6273.26,Cultivo?
6273.26,6279.26,"Você escutivou muito com o canto, então peço que não ticarlhes, né."
6279.26,6290.26,"O residente que, enfim, já se envolveu em várias polêmicas, né, com pessoas do meio artístico, mas também com políticos, né, de vários espéxitos ideológicos,"
6290.26,6306.26,"mas teve se encontro ali na residência do ex-presidente que a gente repercutiu recentemente, passou, né, por um tratamento de cáncer, ainda está em observação, mas teve aí, né."
6306.26,6313.26,Esse momento aí de proximidade com o cantor Porto Riquenha.
6313.26,6330.26,"E falando da frente ampla, agora tivemos a renúncia do senador Charles Carrereira por um escândalo, né, que ocorreu por benefícios no tratamento do hospital policial, né."
6330.26,6346.26,"E o senador usou da sua prerogativa do cargo pra passar, né, pessoas próximas no tratamento em um hospital público e isso gerou, né, um escândalo, né, no Uruguai."
6346.26,6371.26,"E ele acabou entregando a sua renúncia que foi aprovada por quase a totalidade, né, dos legisladores presentes, foram 23 votos de 24 no total, e o único senador que não votou foi o Ravi Argarcia do Partido Nacional, que declarou que não é uma renúncia, mas sim uma fuga, né."
6371.26,6395.26,"E inclusive o Charles Carrereira é do MPP, né, que é o mesmo movimento do ex-presidente José Murrica, que havia questionado inclusive a dirigência dessa corrente dentro da frente ampla por não ter tomado nenhuma medida quando as denúncias vieram a público, né."
6395.26,6424.26,"Teve aí essa distenção também ali no seio do principal partido de oposição e favorito as eleições e falando das eleições no lugar que vão ocorrer agora no final do mês, os uruguais vão as urnas não só pra escolher, né, os próximos legisladores, presidentes, enfim, mas também pra se votar um plebiscito de segurança social, né, uma reforma da aposentadoria que tá"
6425.26,6454.26,"despertando bastante polêmica, né, pelo pela divisão mesmo, né, das legenas partidárias e o LAKGPV a público dizê para os seus apoiadores não votarem no plebiscito, né, anularem os votos pra, enfim, pra medida fracasar enquanto que o seu candidato, a sucessão, o Álvaro Delgado diz que observam um cenário catastófico para o Uruguai, por conta,"
6454.26,6480.26,"um cenário de uma, o que seria, né, uma catástrofe fiscal, né, então esse é um assunto que a gente vai observar bem de perto agora com a proximidade das eleições, pois além do, do pleto nacional, teremos a rir esse plebiscito da reforma da previdência, né, então, nas declarações do Álvaro Delgado,"
6480.26,6487.54,"na época, não 25 dias para evitar um desastre no Uruguai."
6487.54,6495.62,Lembrando que mesmo a frente ampla não tem uma posição consensual em relação ao plebiscito.
6495.62,6500.42,"Eu acho errado colocar plebiscito no meio da eleição, porque a maioria das pessoas vai"
6500.42,6506.18,"mal informada sobre o que distrata. Sempre parece uma coisa assim para colar, ali para"
6506.18,6513.9,"se ter mais fácil fazer assim do que fazer a campanha, a informação, debate e depois a votação"
6513.9,6521.54,"do ponto de vista legislativo. Mas não. Pois é, devia ter uma divisão mais nitida em relação."
6521.54,6529.38,"São porque são duas votações importantes, mas deviam ter cada uma o seu tempo e espaço."
6529.38,6537.22,"Bom, na gente cruza o charco, agora vamos para Argentina com algumas notícias locais também,"
6537.22,6544.34,a começar pela opos deio que foi acusada de explorar mulheres no país.
6544.34,6553.54,"Pois é, notícia terrível, enfim, sua presença de líderes da opos deio com o tamanho poder"
6553.54,6564.22,"do país é algo bastante assustador, eu diria, sim, eles sempre tiveram ali, inclusive"
6564.22,6569.02,durante a ditadura tiveram uma participação que está explorada em alguns livros sobre
6569.02,6576.26,"o período, eles tiveram a participação de apoio aos generais, parte importante da opos deio."
6576.26,6584.5,"Mas aqui a gente encontra esse setor da igreja comentei basicamente um crime, submentendo"
6584.5,6595.14,"mulheres a comportamentos comparáveis à escravidão. E isso iria desde 72 até os dias de hoje,"
6595.14,6604.46,"seja, era auxiliares, eram pessoas que passavam por lá. Enfim, se é que o papado de Jorge"
6604.46,6611.9,"Bergo Olho está chegando ao fim, essa é a grande questão que ele deixa aberto, embora"
6611.9,6621.38,"tenha feito muito pelas vítimas dos padres e dos religiosos que atuam na América do Sul,"
6621.38,6628.14,"vem vindo a torna cada vez mais delitos cometidos nessas entidades, e esse é mais um deles."
6628.14,6634.22,"Falando ainda em relação aos católicos na Argentina, tivemos a inauguração de um monumento"
6634.22,6640.3,"maior do que o Cristo Redentor. Conta pra gente aí, Silva, do que se tratou."
6640.3,6647.7,"Veja só, o monumento maior do Cristo Redentor também é um símbolo religioso, e é vir"
6647.7,6654.98,"do Vale, do Vale de Catamarca, que é um lugar belíssimo, é um lugar com um buscado"
6654.98,6661.58,"por turistas, mas também um lugar onde há muita exploração mineradora, é uma região"
6661.58,6670.7,"da Argentina muito católica, e recebeu aí essa gigante estátua. Imagino que seja"
6670.7,6678.52,"usada para a perigrinação e também para a orientação dos viajantes, porque daí é uma grande"
6678.52,6683.72,"extensão de montanhas, que cruza essas províncias do norte."
6683.72,6689.36,"Bom, não se ver, mas talvez a principal notícia que veio da Argentina nessa semana foram"
6689.36,6699.68,"os protestos estudantes, e não só, porque outras pessoas estavam na rua por conta do corte"
6699.68,6704.16,de verbas para as universidades públicas.
6704.16,6713.92,"É verdade, Matias, há alguns meses houve uma grande mobilização de estudantes, professores,"
6713.92,6721.44,"de distintas partes do país, inclusive, bem nacional, essa parece ter sido um pouco mais"
6721.44,6726.96,"voltada a água e nos aires, mas reflete um problema que não se resolveu, depois daquele"
6726.96,6734.08,"grande protesta alguns acordos, foram feitos para evitar o ajuste tão fortes,"
6734.08,6740.12,"principalmente nas aposentadorias os professores, nos recursos dos laboratórios, etc.,"
6740.12,6745.0,"mas não foi suficiente, e agora a gente teve mais um protesto. Esse protesto ele está"
6745.0,6754.48,"inserido num conjunto de outras insatisfações que vem surgindo na Argentina, não é claro,"
6754.48,6760.04,"não é uma tendência, a gente agora fala de Argentina caminhando por um estálido social,"
6760.04,6765.64,"algo assim, porém, há protestos muito significativos em distintas áreas importantes para economia"
6765.64,6772.24,"argentina. A educação é uma área simbólicamente importantíssima, a outra é essa notícia que vem"
6772.24,6779.36,"na sequência, que é que o Milei está acelerando a venda da aerolínea, a aerolínea sempre foi"
6779.36,6785.64,"uma novela, deve ser bem... Ela que surgiu como a empresa estatal foi privatizada, depois"
6785.64,6793.36,"estatizada e agora seria repravatizada. Repravatizada novamente, cada presidente tem uma visão"
6793.36,6801.2,"que é refundar a aerolíneas, teve uma época de fato que ela vinha muito detonada, depois melhorou"
6801.2,6807.88,"um pouco, na época do governo Máclil, ela estava bem melhor, ela estava fazendo trajetos que não"
6807.88,6812.84,"necessariamente tinham que passar por Buenos Aires, então federalizou mais aerolíneas."
6812.84,6821.96,"E esta vez seja a principal função da aerolíneas, até pensando... Porque a gente veio a Argentina,"
6821.96,6827.12,"ao lado do Brasil, ela não parece um país tão grande, mas é um dos maiores países do mundo,"
6827.12,6834.96,"então e um terço da população está na região metropolitana de Buenos Aires, então precisa"
6834.96,6842.04,"justamente dar a aerolíneas para integrar as demais províncias, principalmente no sul do país."
6842.04,6850.24,"Não faziam uma pessoa de negócios, de ruíter, que passava por Buenos Aires para ir ter uma reunião"
6850.24,6858.64,"em Sata Cruz. E isso vinha sendo feito em um plano, mas enfim, como a gente estava falando, cada presidente tem um plano,"
6858.64,6864.84,"agora o plano do milha, cortar, cortar, cortar, então vamos cortar aerolíneas, já tem uma visão muito negativa com"
6864.84,6872.0,"relação aos sindicalistas, as pessoas que fazem grévia, acho que estão todas manipuladas pelos capelos,"
6872.0,6881.0,"gréteres, escritinearistas, então a paciência dele para negociar é muito curta. E com isso, com esse impasto,"
6881.0,6887.0,"toda a gente viveu nas últimas semanas aí, uma semana de operação tartaruga no atendimento dos"
6887.0,6893.16,"passageiros, o que só atrapalha para todo mundo que quer viajar, precisa viajar para trabalhar, para estudar,"
6893.16,6901.68,"para mesmo ter suas atividades. Bem, se eventamente vamos mais um capítulo relacionado a as malvinas,"
6901.68,6911.04,"e dessa vez a vice-presidenta vitória Virjar-Ruel, ve ao público dizer que o reino unido,"
6911.04,6923.88,"Tata, os argentinos como tontos em relação às negociações, por medidas que aproximem os argentinos"
6923.88,6931.32,"do arquipélago, que é reenvidcado por vários setores da sociedade argentina, para não dizer todos,"
6931.32,6940.16,"teve algum ruído durante a gestão do Maurício Macron, por ter sido acusado de inquiquista em relação"
6940.16,6950.16,"a essa pauta, mas justamente a vitória Virjar-Ruel por ser muito próxima dos militares, ve ao público"
6950.16,6957.88,dizer que o reino unido só oferece migalhas para os argentinos em relação às malvinas.
6957.88,6966.72,"Essa é outra questão que muda muito com o tempo, e dependendo de quem é que está governando a Argentina,"
6966.72,6976.72,"já ouve também várias fases em que desde a guerra, que a gente na perdeu, por exemplo, durante os anos menem,"
6976.72,6985.76,"ouve uma tentativa de aproximação mais amigável com o reino unido, permitindo viagens dos familiares,"
6985.76,6992.72,"dos que estavam mortos ali, realizando até alguns eventos maratonas, jogos de rugby, para que as populações"
6992.72,6995.8,"conhecerem sem melhor, e para que houvesse mais volos."
6995.8,7003.08,"O grande reclamação dessa população tão pequena das ilhas falcras de malvinas, que são 3 mil pessoas,"
7003.08,7012.08,"que tem muito pouco acesso a tudo, tudo tem que vir de avião, tem que vir de Chile, tem que vir de enganar a terra,"
7012.08,7018.56,"não pode vir de Argentina, que ajudaria mais nesse momento do que ficar decidindo de quem é a soberania,"
7018.56,7023.08,"quem ganhou a guerra, quem chegou lá antes, era melhorar a vida como moram lá."
7023.08,7032.08,"E isso ocorreria com o retorno desses volos, mais correntes, um acordo, um passando por São Paulo,"
7032.08,7039.08,"mas que pudesse integrar mais essas ilhas tão isoladas, então em nósptas a nossa região."
7039.08,7051.08,"Pois é, e ainda no Atlântico Sul, tivemos uma notícia curiosa em relação à cidade-bonarence de Ilario-ascasub,"
7051.08,7063.08,"que fica próximo da costa do Atlântico, já que está tendo uma infestação de papagaios na cidade,"
7063.08,7072.08,"e que estão levando ao caos, tem cerca de 10 aves para cada habitante, e as aves estão roendo,"
7072.08,7082.08,"os cabos de eletricidade, gerando pequenos apagões, tem a questão da fases, que estão se amontoando,"
7082.08,7093.08,"mas teve essa notícia curiosa, mas que também tem uma relação com o desmatamento da região ali ao sul da província de Buenos Aires."
7093.08,7101.08,"Claro, claro, os animais são sinais também das mudanças climáticas e acabam produzindo fenômenos assim."
7101.08,7107.08,"Bonitinhos, os parrots de Ilario-ascasub, uma barriguinha vermelha."
7107.08,7114.08,"Que fica próximo ali da cidade de Bahia-Blanca, a capital do Basquete Argentino."
7114.08,7121.08,"A gente cruza agora a cordilheira dos Andes, vamos para o Chile, com duas notícias."
7121.08,7134.08,"A primeira delas é que o ex-procurador Alfonso Podelac foi condenado a 20 anos de prisão por conta de crimes relacionados a ditadura,"
7134.08,7149.08,"e ele que é um dos culpados pelo crime relacionado ao diretor do hospital regional de Temuco, o médico Hernan, em Rikis, a Ravena, justamente no ano do golpe."
7149.08,7164.08,"Então tivemos aí a condenação de 20 membros da força aérea do exército além de civis, por esses homicídios, além do Hernan, em Rikis, a Ravena."
7164.08,7174.08,"Tivemos também a morte do Alejandro Flores Rivera e das torturas contra o Jorge Sili Zarsar, Victor Paen Nemalh, a alegria,"
7174.08,7191.08,"e Sergio Rikielmi Inoscrossa, e no qual a figura mais voltuosa foi o ex-procurador Alfonso Podelac, é um reconhecido ex-colaborador da ditadura de Augusto Pinochet."
7191.08,7209.08,"E ainda em relação ao caso envolvendo a ex-ministra do governo Pineira, a Marcela Cubígios, que ganhava um salário fora da realidade pela Universidade de San Sebastiã,"
7209.08,7220.08,"e que tinha vários convenios com o poder público facilitados justamente pela proximidade dela com a alcaldesa de providência,"
7220.08,7237.08,"a Evelyn Matei, que é uma das favoritas nas próximas eleições chilenas, veio agora, inclusive, o sindicato dos futebolistas do Chile, que criticaram a fala da alcaldesa,"
7237.08,7255.08,"dizendo que existe uma inveja por parte dela, por parte da sociedade em relação ao salário da ex-ministra, na educação, e que ninguém reclama do salário de artistas e atletas."
7255.08,7271.08,"Os jogadores, através do seu sindicato, viram a público justamente para condenar essa declaração, e que, na verdade, não é inveja, mas é um escândalo de corrupção,"
7271.08,7289.08,"a televisão, no qual, uma funcionária que, inclusive, é acusada de nem atuar na Universidade, seria um cabide de emprego, de ganhar um salário fora da realidade a partir de recursos públicos."
7289.08,7315.08,"Claro, são casos muito diferentes, o que o salário de uma celebridade, de uma artista, de um jogador, e daí foram mais afundo, mostrando que, durante a sua atuação, como a menista da educação, foram transferidas cerca de um bilhão, 482 milhões de pesos chilenos para a Universidade de San Sebastião."
7315.08,7344.08,"Então, mostra aí, que foi um tomalado a carne. Buena do Chile, que tem uma grande comunidade a Teana, vamos agora para o país caribenho, já que de acordo com um relatório da ONU, pelo menos 3.600 mil pessoas foram mortas nesse ano em virtude da guerra das gangues que assola o país."
7344.08,7373.08,"Pois é, esse é um drama que só faz aumentar, a guerra entre as gangues estados controladas, não é de hoje, não há saída possível, as soluções vão sendo tomadas, improvisadas, colocadas em vigor, mas na realidade a gente não vê uma solução para a pressa-queção das gangues, e o que só faz com que o país sofre mais."
7374.08,7383.08,"É uma família, suas crianças, suas instituições e níveis como da fome e de outras indice sociais que só vão piorando."
7384.08,7403.08,"E por fim, vamos repercutir a fala do representante Equatoriano na Assembleia General das Nações Unidas, que foi o José Raviér Delagasca, que é um representante permanente ali na Sede da ONU,"
7403.08,7430.08,"e que, em sua fala, lembrou do episódio da embaixada mexicana Enquito dizendo que o México permitiu a entrada de um cidadão Equatoriano com duas sentensas contra ele e que ficasse como convidado apesar dos desforços de plomáticos feitos pelo Equador, para que isso não ocorresse."
7430.08,7457.08,"Então foi aí uma justificativa por parte do Equador da do Cerco, que ocorreu na representação consular mexicana, mas, enfim, acabou escalonando e deu essa crise de plomática entre dois países e que está longe de se resolver."
7457.08,7472.08,"Sim, só deu mais espaço para que não se resolva, né, para o telônda mais e é o que parece o que a gente lê sobre o Equador e sobre a boa popularidade que tem ano boa,"
7472.08,7491.08,"nesses meses anteriores a eleição, antes que essa atitude internacionalmente repudiada foi correta, então não há nenhuma pressão para que esse caso seja investigado, ou seja, enfim, de alguma forma admonistado, né, enfim."
7491.08,7497.08,"Bem, Silva, e a gente encerra esse bloco com a sua recomendação cultural."
7497.08,7512.08,"Minha recomendação cultural é um livro que eu comecei a ler esses dias e que é muito tocante, que é um livro da Maria Moreno, uma escritora argentina, muito reconhecida, trabalha com temas da ditadura,"
7512.08,7527.08,"e ela recolheu textos do Rodolfo Orsch, Rodolfo Orsch, que foi o autor do operação massáculo, um livro clássico sobre a perseguição e a repressão nas ditadoras argentinas,"
7527.08,7541.08,"e esse livro é especificamente sobre a relação dele com a sua filha, ele tinha uma filha montonera, bastante ativa, bastante combativa de pava na luta armada, e ela morre antes dele."
7541.08,7548.08,"Rodolfo Orsch, depois, será perseguido ele mesmo, e também será desaparecido pelo regime."
7548.08,7564.08,"Então, é um texto muito forte, muito vigoroso, a Maria Moreno escreve muito bem, e o livro está sendo lançado no Brasil pela editora Mondarel, que tem lançado aí alguns livros interessantes de não ficção, vale a pena ficar de olho."
7564.08,7587.08,"Inclusive, durante muito tempo, eu achava que a Maria Lena Woch, a compositora fosse paremente, mas fui pesquisar e não tem nenhuma relação, e fica aqui também a indicação, eu ainda não li, mas está sendo lançado, está tendo a prevenda,"
7587.08,7608.08,"do livro Mafalda, História Social e Política, da escrita pela professora de história da Universidade Nacional de Samartin, na Argentina, a Isabella Cossi, está sendo publicado aqui no Brasil pela Casimira Editora, como eu falei, está em prevenda com 20% de desconto e fret grátis."
7608.08,7621.08,"Então, como eu disse, ainda não li, mas fiquei muito interessado por essa obra, pensando na FMM de 60 anos de publicação da primeira tirinha da clássica personagem Duquino."
7621.08,7631.08,"Claro, não tem muito como naerrada essa publicação, porque são justamente as tirinhas que fizeram tão famoso."
7631.08,7645.08,"Pois é, bueno, a gente passa agora para o cheque, no qual eu e o Felipe observaremos o movimento das peças no sempre complicado tabuleiro do Oriente Médio."
7662.08,7676.08,"A ataque aéreo israelense contra a quartel general do resbolar, mata líder do grupo."
7676.08,7694.08,"Então, meu caro Matias, esse bloco aqui, teoricamente ele vai ser enorme, a gente vai tentar não manter ele tão enorme assim, porque vai ser uma mistura de Oriente Médio com Ono, a gente vai tentar dar uma transição mais ou menos suave,"
7695.08,7719.08,"e muitas coisas ocorreram no Oriente Médio nessa semana, começando pelo ataque na noite do dia 27 de setembro, no horário local da Força-Israelense contra o quartel do resbolar na região de Darrie, que fica ali perto de Beirut,"
7719.08,7736.08,"e que inclusive a gente já mencionou que ela é a origem de uma das doutrinas das Forças Armadas-Israelenses, a doutrina da Ria, na grafia em Ebraico, por conta da guerra do início dos anos 2000,"
7736.08,7756.08,"e que a doutrina de que Israel pode atingir centros de poder civil e de interesse econômicos que apoem alguma organização que esteja lutando contra Israel, e quem formulou essa política foi o general Gadi Ezenkot,"
7756.08,7782.08,"que recentemente inclusive a gente comentou aqui, que ele teve uma aparição pública, porque um dos filhos dele, que estava no serviço militar, morreu em Gaza, então esse bairro, essa região perto de Beirut, ela é icônica, digamos assim, por ser uma região central do resbolar, não, a touco a art.a o general fica avalado,"
7782.08,7804.08,"por isso que esse é um nome que vocês vão ver, estão vendo bastante na mídia, e aí nós tivemos esse ataque que deixou 33 pessoas mortas, 195 feridas, e dentre as pessoas mortas, nós tivemos basicamente um ataque de decapitação contra o resbolar, por que?"
7804.08,7824.08,"porque o líder do grupo, o Nazaralá, esse nome que os homens já ouviram aqui antes, o raçã Nazaralá, ele foi morto nesse ataque, e também tivemos um dos principais commandantes militares do resbolar morrendo, sendo morto no ataque, o Ali Karak,"
7824.08,7840.08,"e o comandante das forças cudes, que são um dos braços da Guarda Revolucionária-Islamica do Irã, também morrendo nesse ataque, um general iraniano que estava no local,"
7840.08,7869.08,"então se o número de vítimas fatais confirmadas são 33, ainda não está claro dessas vítimas, se teriam ou não civis, ou apenas integrantes do resbolar, porém, o principal é que foi um ataque de decapitação que tirou, eliminou de um ataque só, uma parcela considerável do comando do resbolar, e especialmente o Nazaralá,"
7869.08,7898.08,"que era o líder do grupo desde 1992, e aí meu caramatizou os ouvintes, que acompanham o nosso trabalho, mas tentando recapitular um aspecto recente, quando nós tivemos aquela explosão dos pagers, dos walktalks, eu mencionei que o resbolar, ele nasce como um grupo de resistência, a intervenção israelência na guerra civil do Libano, na década de 1980,"
7898.08,7927.08,"inspirado e financiado pela Revolucion Islamica-Chita do Irã, e que na década de 1990, o resbolar busca e consegue atingir na sociedade de Libanesa uma posição de legitimidade mais ampla, não, o resbolar vai disputar leições, vai se tornar o principal partido chita, vai participar, estará engajado em questões sociais de fornecimento atendimento médico, como uma maneira de buscar-los,"
