start_segment,end_segment,text
11569.8,11577.8,"então, uso de eletrochokes contra órfãos e pior ainda o documento diz que"
11577.8,11585.8,"pessoas nativas da região, como os maori, foram proporcionalmente maiores vítimas"
11585.8,11587.8,desse tipo de violência.
11587.8,11593.8,"Então, a gente pode esperar em uma repercussão nos próximos anos disso,"
11593.8,11599.8,"que nem no Canadá, envolvendo indenizações, pedidos e esculpas pelo Estado,"
11599.8,11603.8,"e finalmente, meu caro Matias, uma notícia que não tinha onde por,"
11603.8,11606.8,"então, pois não chega, porque é uma notícia que envolve todo mundo,"
11606.8,11611.8,essa semana tivemos o dia mais quente da história.
11611.8,11616.8,"Segundo o Instituto Copérnico da União Europeia,"
11616.8,11626.8,o último dia 21 de julho teve como média mundial 17.09 graus Celsius.
11626.8,11631.8,"Mas Felipe 17 graus não é quente, essa é a média mundial."
11631.8,11635.8,"Então, você pega a temperatura que estava lá,"
11635.8,11641.8,"o local mais frio do mundo, o local mais quente do mundo, a média deu 17."
11641.8,11647.8,Esse é o dia mais quente da história.
11647.8,11651.8,É simples assim. Vamos todos morrer.
11651.8,11657.8,"Bem, passemos agora para o Gambito da Dama com mais uma coluna da nossa"
11657.8,11662.8,economista substituta a professora Ana Paula Salviati.
11662.8,11664.8,Nos debildes.
11668.8,11670.8,Gambito da Dama.
11673.8,11678.8,"Olá, bom dia, boa tarde ou boa noite para essa bela audiência dos rapazes"
11678.8,11682.8,"dos Chadreis Gerbal. Aqui quem fala na Palá Salviati,"
11682.8,11687.8,eu estou aqui mais um dia cobrindo a licença maternidade da nossa queridíssima
11687.8,11691.8,Vivian em seu Gambito da Dama.
11691.8,11695.8,É um prazer falar com vocês. Então vamos lá.
11695.8,11700.8,"Eu queria falar com vocês sobre os 30 anos do plano real,"
11700.8,11703.8,"mas como nós estamos no Chadreis Gerbal,"
11703.8,11710.8,eu vou trazer a fala do plano real um pouquinho mais para esse contexto internacional.
11710.8,11714.8,"Então vamos lá, pessoal, mais novo que está nos ouvindo."
11714.8,11718.8,"Talvez nosso plano real acabou, mas eu uso o real."
11718.8,11721.8,"Nossa moeda não é o real, como assim o plano real acabou."
11721.8,11726.8,"Pois bem, o plano real acabou na virada do 99 para o 2000,"
11726.8,11732.8,"quando a gente criou uma nova forma de conduzir a política macroeconômica,"
11732.8,11736.8,"principalmente a monetária, com o regime de metas para a inflação."
11736.8,11743.8,"Nosso atual regime de condição monetária, certo de inflação de controle inflacionar."
11743.8,11748.8,"O plano real foi um projeto que contou com a emissão de uma nova moeda,"
11748.8,11753.8,"inclusive antes que a moeda de fato o nosso real, o nosso beijaflouro,"
11753.8,11759.8,"o nosso micro leandorado, as vezes uma tartaruga que aparece na nossa carteira raramente,"
11759.8,11764.8,"ele contou com a emissão de uma nova moeda, e inclusive contou com a ajuste da ORV."
11764.8,11768.8,Acho que isso todo mundo sabe um pouquinho de cabeça.
11768.8,11772.8,"A questão toda que o plano real foi mais do que a emissão de uma nova moeda,"
11772.8,11780.8,"mais do que a ORV, ele foi um conjunto de práticas baseados na âncora cambial,"
11780.8,11783.8,trago dessa forma para vocês.
11783.8,11788.8,"A âncora cambial foi um desenho proposto antes de mais nada,"
11788.8,11792.8,"pelo fundo monetário internacional, no conselso de Washington."
11792.8,11796.8,Então vamos dar uma olhadinha para esse capítulo da nossa história.
11796.8,11799.8,"Se vocês não se lembram, ainda na dita dora militar,"
11799.8,11803.8,nós entremos um processo de aceleração inflacionária brutal.
11803.8,11810.8,"Esse é o verdadeiro milagre que os militares nos legaram à aceleração inflacionária,"
11810.8,11813.8,a o milagre da multiplicação das dívidas. Isso sim.
11813.8,11816.8,Interessa a gente pensar que quando a aceleração inflacionária
11816.8,11819.8,"explodem durante a condução do regime militar,"
11819.8,11824.8,"a justa do demilitar, em 5 ou 6 anos, rola a redemocratização."
11824.8,11829.8,E o Onus da Péssima condução da dívida externa feita durante o período militar
11829.8,11836.8,fica com o civis que passam a receber o Onus da encompetência
11836.8,11839.8,e da incapacidade no controle inflacionária.
11839.8,11844.8,"Muito bem, mas fechando esse parênteses, é interessante notar que a nossa inflação"
11844.8,11848.8,"surge num contexto muito crítico,"
11848.8,11856.8,"porque não cabe a nós falar sobre exatamente de como se dá a aceleração interna da inflação,"
11856.8,11860.8,"mas nos cabe comentar que ali na virada do adecro de 800,"
11860.8,11866.8,"os Estados Unidos vão ajustar taxa de juros unilateralmente,"
11866.8,11873.8,o que para bibliografia francesa de economia é chamada de golpe de 79.
11873.8,11877.8,"E os Estados Unidos, como mais ou menos você já devem ter ouvido falar,"
11877.8,11882.8,ajusta o economia mundial de tal modo que todos os países entram em receção
11882.8,11884.8,de forma mais ou menos grave.
11884.8,11891.8,"Os países que dependem da liquidez internacional, como o Brasil dependia visceralmente"
11891.8,11895.8,"porque, naquele momento, ele estava rolando de índice com o dívida nova,"
11895.8,11897.8,a crise foi retumbante.
11897.8,11903.8,"Pois bem, então os anos 80, eles são uma situação crônica falando especificamente do Brasil"
11903.8,11909.8,"porque não existia dinheiro entrando para que a gente pudesse pagar as dívidas antigos,"
11909.8,11913.8,"a dívida externa, nós ficavamos tentando fazer acordos,"
11913.8,11919.8,"evidentemente falíveis com FMI, como normalmente são,"
11919.8,11923.8,"passamos por vários programas de ajustes estruturais,"
11923.8,11929.8,"nesse processo leia-se, todo o processo de desindustrialização é maturado nos anos 80 até"
11929.8,11932.8,alcançar o seu app nos anos 90.
11932.8,11938.8,"E hoje nós temos essa grandinação que plantando tudo da, que o Agro é pop."
11938.8,11943.8,"Veja só, nos anos 80, então nós estamos passando por uma série de programas de ajustes estruturais,"
11943.8,11949.8,tentando fazer uma série de projetos para tentar controlar a inflação que não são bem suceídidos
11949.8,11957.8,"especificamente, porque nós não temos acesso a liquidez internacional para fazer o"
11957.8,11961.8,"rescoalhamento das dívidas, é basicamente você tem uma dívida infinita,"
11961.8,11966.8,"você, no caso, um país, você, no caso, uma série de países individados,"
11966.8,11972.8,não tem acesso a uma re-estruturação da sua dívida que permita com que você
11972.8,11976.8,controle a inflação interna do seu país e continue crescendo.
11976.8,11982.8,"Em troca disso, nós estamos num contexto de ajustes que fazem com que todas as economias"
11982.8,11989.8,de uma forma mais acelerada ou outra abra as comportas para liquidez internacional
11989.8,11994.8,"através do panorama neoliberal. Então, quando a gente fala que o plano real"
11994.8,11999.8,"foi bem sucedido, ele antes de ser implementado na prática,"
11999.8,12006.8,ele é um plano que contou com a pactoação proposta para que essa liquidez
12006.8,12011.8,"voltasse a entrar no país. Trocanim e Udus, o plano real,"
12011.8,12017.8,"foi factível, ele foi bem sucedido, porque é o Brasil, em 94, só em 94,"
12017.8,12024.8,"ele aceita os termos do plano Brad, que ficou conhecido como plano de restruturação"
12024.8,12030.8,"dessa dívida externa, um plano muito interessante de se estudar,"
12030.8,12034.8,porque ele basicamente propõe que a dívida externa dos países seja reconvertida
12034.8,12038.8,"em dívida interna. E por mais que se discuta muito, as vezes a faria"
12038.8,12043.8,"ali não fica descontente, porque nós não temos capacidade de pagar a dívida interna"
12043.8,12048.8,"para a economia internacional, para os entusiastas, os economistas do FMI,"
12048.8,12051.8,"que devem entender pouco do assunto, eles entendem que a dívida interna"
12051.8,12056.8,"é necessariamente sempre paga, porque afinal de contas é a dívida do próprio país."
12056.8,12063.8,"Bom, o que nos importa entender é que o plano Brad, ele reconverte a dívida externa"
12063.8,12067.8,"em dívida interna, fazendo com que os países não possam mais, por exemplo,"
12067.8,12073.8,"dar um calote, pressionar para que uma rodada de negociação seja estabelecida,"
12073.8,12078.8,ele simplesmente engolha a dívida interna e passem teítulos públicos.
12078.8,12083.8,"Mas aí você pensa, mas que vantagem, os credores internacionais vão ter"
12083.8,12088.8,"seus países continuarem pagando a dívida na moeda desses países,"
12088.8,12091.8,"está obviamente com problema cambial, né?"
12091.8,12096.8,"Aí vem o segundo passo, no Conselso de Washington, como é tradicional,"
12096.8,12102.8,"aos programas de ajuste do FMI, se criou uma plataforma de estabelecimento das economias"
12102.8,12109.8,"que se partia da ideia de que o câmbio, a âncora, a câmbial seria o lastro necessário"
12109.8,12117.8,para estabelecer essas economias que estavam a deriva desde a crise dos anos 80.
12117.8,12121.8,"Olha só como a situação era grave. Então vejo só tigres asiáticos,"
12121.8,12127.8,"argentina, rússia, Brasil, entre tantas outras economias,"
12127.8,12134.8,"buscaram se adequar essa agenda e aplicaram, digamos assim, o mesmo remédio,"
12134.8,12139.8,"a economia é obviamente muito distinta. Se você pode puxar da sua memória,"
12139.8,12145.8,"a gente pode lembrar que a argentina, inclusive, colocou na sua legislação"
12145.8,12150.8,"a paridade cambial do peso argentino com a USD,"
12150.8,12154.8,"foi um pouquinho caótico para a economia daquele país. Pois bem,"
12154.8,12158.8,"no real, nós tínhamos aquela história de que um real vale a USD."
12158.8,12161.8,"Então, pois bem, essa é a nossa âncora cambial."
12161.8,12165.8,"Então veja, se você faz o pacto com o plano bread,"
12165.8,12168.8,"você toma a divina esterna por divina interna,"
12168.8,12171.8,"quando você vai pagar seus creedores internacionais,"
12171.8,12175.8,"garantindo para eles que a sua moeda, ela é equival ao USD."
12175.8,12178.8,Então para o creedor internacional é a melhor das condições.
12178.8,12182.8,"Finalmente, esses países vão ser obrigados a pagar a divina"
12182.8,12186.8,porque eles são em missores da divina interna e a moeda desses países
12186.8,12189.8,"passou a equivalê a USD. Pelo menos por um bom tempo,"
12189.8,12194.8,"até sofrierem choques especulativos, o que levou ao fim"
12194.8,12199.8,dessa grande ideia magnânima de ancorar as moedas ao USD.
12199.8,12203.8,Isso durou basicamente a década de 90 todo.
12203.8,12208.8,"Mas veja, o plano real foi bem sucedido porque ele passou"
12208.8,12212.8,"até acesso a liquidez internacional, porque ele tomou"
12212.8,12217.8,"para dentro da economia, ele converteu a divina esterna em divina interna,"
12217.8,12223.8,"ao mesmo tempo que pariu, ancorou a sua moeda ao USD."
12223.8,12226.8,"Bom, mas vou na pálise, mas é simples,"
12226.8,12230.8,"mas é só ancorar a economia ao USD, como é que funciona isso?"
12230.8,12235.8,"Então para você garantir que a sua moeda equivale a USD,"
12235.8,12239.8,"você tem que pagar por isso, como é que você paga"
12239.8,12243.8,"quando a sua economia é um país através da taxa de juros,"
12243.8,12246.8,"porque é assim você garantir que o investidor,"
12246.8,12250.8,"o agente da liquidez internacional, val seu país"
12250.8,12254.8,e receba os juros que você oferece pelo seu título público.
12254.8,12258.8,"Bom, foi assim que nós alcançamos até 48% de taxa de juros real,"
12258.8,12263.8,"numa das grandes, ondas especulativas que atingiram o Brasil,"
12263.8,12267.8,e que nos encaminharam para o fim desse modelo de condução
12267.8,12269.8,da inflação e do câmbio.
12269.8,12274.8,O plano real tem muitos méritos que foi o controle da inflação.
12274.8,12279.8,"Nós vejamos num contexto que é a inflação anual,"
12279.8,12282.8,"atravessar a todos os três dígitos,"
12282.8,12285.8,e anteriormente alcançava até 4 dígitos.
12285.8,12291.8,"Hoje, nossa inflação fica na casa dos 10, 15% ao ano,"
12291.8,12294.8,"coisa que nós não cançaremos, inclusive, nesse ano."
12294.8,12297.8,"Tudo, e esse é tema para outra conversa nossa,"
12297.8,12300.8,vale a gente comentar que o plano real não assistiu
12300.8,12302.8,o crescimento econômico algum.
12302.8,12305.8,Quais elevadas taxas de juros que eram praticadas?
12305.8,12309.8,"O crédito, o financiamento, o custo do dinheiro, era muito alto."
12309.8,12313.8,"Então ter acesso a novas mercadorias,"
12313.8,12317.8,"fazer financiamento, o crediados, o que fosse,"
12317.8,12321.8,"era muito custoso, mesmo o diante da valorização cambial,"
12321.8,12324.8,que foi feita com a inserção do plano real.
12324.8,12327.8,"Isso era uma estratégia, inclusive, do período,"
12327.8,12331.8,"para impedir que houvesse o momento do consumo familiar,"
12331.8,12334.8,algo que foi visto no plano cruzado
12334.8,12338.8,e era o objetivo de se deter de todas as formas.
12338.8,12340.8,"Mas o que eu estou querendo dizer, basicamente,"
12340.8,12344.8,"é que o plano real é ele controla inflação sem crescimento econômico,"
12344.8,12348.8,"sem garantir acesso à distribuição de renda,"
12348.8,12353.8,"sem promover necessariamente na sua cartilha de controle inflacionário,"
12353.8,12356.8,sem se comprometer com a agenda do plano emprego.
12356.8,12357.8,Olha que interessante.
12357.8,12361.8,A gente volta a falar em condições de impregabilidade
12361.8,12365.8,"e de aumento da capacidade de consumo das famílias,"
12365.8,12371.8,"só depois dos anos 2000, quando a gente tem a eleição do Lula 1,"
12371.8,12374.8,"digamos assim, já que nós estamos ter ser mandato do presidente Lula,"
12374.8,12378.8,a cartilha do Partido dos Trabalhadores é que rende série
12378.8,12383.8,"a ideia de plenim prego, de aumento do consumo das famílias."
12383.8,12387.8,"Tudo isso, meus amigos do Chadreis Rebalto, para terminar."
12387.8,12393.8,É importante a gente comentar que o atual governo está promovendo
12393.8,12396.8,"uma reforma tributária que estava engavetada,"
12396.8,12400.8,"está aguardando desde ontem a 40 anos, sefeita."
12400.8,12406.8,"Então, quando esse governo consegue tributar os fundos exclusivos,"
12406.8,12411.8,"que são fundos fechados de pionários do país,"
12411.8,12416.8,a gente está conseguindo iniciar um processo de tributação
12416.8,12421.8,"que incide diretamente sobre o sistema financeiro importantíssimo,"
12421.8,12425.8,"para o sistema na noção, a tributação desses fundos,"
12425.8,12431.8,"que não atingem três mil pessoas no país inteiro,"
12431.8,12435.8,só a dimensão desses fundos.
12435.8,12439.8,Eles já conseguem fazer com que a balança tributária
12439.8,12444.8,desse país penda positivamente graças essa tributação.
12444.8,12447.8,"Então, veja, o que eu quero dizer aqui que tributar,"
12447.8,12451.8,"proporma reforma tributária é condição sinécoa não,"
12451.8,12456.8,"associada ao ganho do poder de compra do salário mínimo,"
12456.8,12459.8,"para que a gente inicia um grande processo,"
12459.8,12463.8,"um longo e importante processo de redistribuição de renda,"
12463.8,12468.8,que é altamente deformada no nosso país.
12468.8,12471.8,"Em posto de renda, precisa ser revisto,"
12471.8,12474.8,"e já foi, já houve uma revisão de emposto de renda"
12474.8,12478.8,"nesse governo, mas ela precisa ser mais profunda."
12478.8,12482.8,A questão toda é a dificuldade de comunicação pública
12482.8,12488.8,"do governo federal, e explicar papel importante da reforma tributária,"
12488.8,12492.8,deixa perder de vista para todo mundo que está envolvido
12492.8,12495.8,e que não faz parte desses fundos exclusivos
12495.8,12499.8,nem participa do movimento reentista do nosso sistema financeiro que é brutal.
12499.8,12504.8,Perde de vista o tamanho do impacto nas contas públicas
12504.8,12506.8,que é a taxa ao sistema financeiro.
12506.8,12509.8,"Onde eu quero chegar ao final da nossa fala,"
12509.8,12514.8,"é que o plano real está belécio, o fim da inflação,"
12514.8,12520.8,"mas ele nos delega ainda a continuidade de taxas de juros elevadíssimas,"
12520.8,12523.8,"tornando crédito caro, isso crédito é caro,"
12523.8,12526.8,a capacidade produtiva fica amingua.
12526.8,12529.8,O plano emprego também fica a quenda desejada.
12529.8,12534.8,"O governo pode tentar fazer o ajuste salarial à cima da inflação,"
12534.8,12540.8,mas é ainda necessário uma reforma tributária que é a agenda do governo atual.
12540.8,12543.8,"Então amigos, eu falei de muita coisa aqui no nosso gambito da Dama."
12543.8,12546.8,"Espero não ter deixado vocês malucos,"
12546.8,12549.8,mas é um assunto importante que a interessa todos nós
12549.8,12554.8,e especialmente você carolvinte nos vemos na semana que vem até lá.
12554.8,12559.8,Passamos agora para o segundo bloco do giro de notícias.
12559.8,12566.8,Giro de notícias.
12566.8,12579.8,Notícias da terça-feira passada de 23 de julho.
12580.8,12585.8,Snoop Dogg carregará a Toche Olímpica por Paris.
12585.8,12590.8,"Essa foi a principal notícia da semana, brincadeiras a parte de lembrar."
12590.8,12593.8,"E o que o Matias falou é verdade, tá gente?"
12593.8,12599.8,O Snoop Dogg estará na cerimônia e embora a maioria das pessoas
12599.8,12602.8,"roviessem programas depois da cerimônia, inclusive."
12602.8,12605.8,"Mas é o nosso jeito de lembrar que nesse dia 26,"
12605.8,12610.8,"nessa sexta-feira, teremos a cerimônia de abertura"
12610.8,12615.8,dos jogos Olímpicos de Paris de 2024 e todo ano.
12615.8,12620.8,Já vamos aí para a nossa terceira olimpíada.
12620.8,12624.8,"Terceiro jogos Olímpicos, a gente sempre comenta as notícias"
12624.8,12629.8,"internacionais, os aspectos políticos do jogos."
12629.8,12633.8,E essa edição provavelmente vai ser o olimpíada mais pulitizada
12633.8,12637.8,"das últimas décadas, o que vai deixar muita gente triste,"
12637.8,12641.8,porque aquelas pessoas que acham que dá para separar
12641.8,12645.8,"política de esporte, como se as duas coisas não dacem juntas."
12645.8,12647.8,Porque esporte é uma bolha.
12647.8,12650.8,E se mistura com o resto.
12650.8,12655.8,Eu só quero ver os meus hominhos jogar bola na sexta.
12655.8,12660.8,"E a gente sempre lembra aqui, esporte é um dos melhores"
12660.8,12665.8,e mais visíveis termômetros sociais e políticos que existem.
12665.8,12670.8,E inclusive temos um fronteira a invisiveira do futebol sobre
12670.8,12676.8,"as olimpíadas, que daí a gente fala de diversos acontecimentos"
12676.8,12680.8,"políticos durante a realização dos jogos,"
12680.8,12685.8,justamente na agressa antiga era um período no qual as guerras se saavam.
12685.8,12687.8,"Isso, tinha tregua límpica."
12687.8,12691.8,"E um dos motivos a gente falar que vão ser jogos sermente politizados,"
12691.8,12695.8,"porque são os primeiros jogos depois da invasão russa da Ukraine,"
12695.8,12701.8,"feverei de 22, e menos de um ano do ataque do ramás contra o Israel."
12701.8,12704.8,"E pensando que as olimpíadas são na França,"
12704.8,12707.8,o governo francês classifica o ramás como um grupo terrorista
12707.8,12712.8,e ao mesmo tempo o Macron já disse que os ataques relenses em Gaza
12712.8,12716.8,são sem justificativa por causar em mortos de mulheres e crianças.
12716.8,12722.8,"E antes mesmo da abertura oficial dos jogos,"
12722.8,12728.8,já tivemos um jogo bastante tenso em relação aos bastidores
12728.8,12733.8,"que foi Mali e Israel na quarta-feira que passou,"
12733.8,12738.8,"já que Mali é um país de maioria muito humana,"
12738.8,12742.8,"com uma grande comunidade dentro da França,"
12742.8,12745.8,"já que foi uma escorônia francesa,"
12745.8,12750.8,e que está apoiando a Palestina.
12750.8,12755.8,"E aí entra outra notícia da semana, já que a DIDAS,"
12755.8,12760.8,"retirou a modelo Bela Radid da sua campanha publicitarolímpica,"
12760.8,12767.8,"porque a modelo é de origem Palestina, grupos para o Israel,"
12767.8,12772.8,"de sério que a campanha que teria feito declarações antisemitas,"
12772.8,12779.8,só que principalmente a Bela Radid seria modelo de um tênis
12779.8,12783.8,"que é inspirado, um tênis retrou,"
12783.8,12787.8,"inspirado nas olimpidas de Munique de 72,"
12787.8,12791.8,que é olimpida quando setembro negro teve uma sacra de munique
12791.8,12794.8,"com a morte de diversos integrantes da delegações e alêncio,"
12794.8,12797.8,eu falo integrantes porque tanto atletas quanto treinadores.
12797.8,12803.8,"Então teve uma reação muito grande, uma pressão muito grande contra a DIDAS,"
12803.8,12806.8,"e a DIDAS retirou a Bela Radid da campanha,"
12806.8,12811.8,ela inclusive disse que iria sionar os seus advogados.
12811.8,12815.8,"Que inclusive equivaleram a uma terrorista,"
12815.8,12819.8,"que é um absurdo completo, e a DIDAS depois,"
12819.8,12822.8,"inclusive, de desculpas oficialmente, porque é real."
12822.8,12825.8,"Sim, mesmo se você pensar apenas o ponto de vista de marketing,"
12825.8,12828.8,faltou o boi velho departamento de Vada Mérda.
12828.8,12832.8,"E a gente falou, a questão palestina,"
12832.8,12836.8,"ela se torna muito visível para muitas pessoas mundialmente,"
12836.8,12837.8,"só para terminar a frase,"
12837.8,12841.8,e para algumas pessoas não dizer que eu estou reduzindo a questão palestina
12841.8,12845.8,"a uma sacra de munique, obviamente que não."
12845.8,12849.8,"Mas uma sacra de munique é quando muitas pessoas,"
12849.8,12853.8,"pelo mundo, tiveram primeiro contato com a questão palestina."
12853.8,12858.8,"Sim, vamos lembrar que os meios de comunicação como era em 1972,"
12858.8,12861.8,muito mais limitados.
12861.8,12866.8,"Então, a questão palestina está também ligada ao histórico"
12866.8,12871.8,"do Jogos Olímpicos, ao imaginário dos Jogos Olímpicos recentes,"
12871.8,12877.8,"e nós temos diversos outros episódios que mostram essa relação,"
12877.8,12880.8,"nunca a gente repercutiu, inclusive, no Chadreserbal,"
12880.8,12882.8,"primeiro, o Olympiante Chadreserbal,"
12882.8,12886.8,"em 2016, o Rio de Janeiro, o Judoque Gipsy,"
12886.8,12889.8,"Islã El-Chehrabi, ele recusou com o primital Judoque,"
12889.8,12892.8,"Israelense Orsação, já expliquei aqui,"
12892.8,12895.8,"porque o Judo é muito popular, tanto em Israel,"
12895.8,12898.8,"quanto nos países árabes, tem ligação com a Nensoviética,"
12898.8,12901.8,porque os consultores militares soviéticos na Guerra Fria
12901.8,12903.8,"levavam o Judo para os países árabes,"
12903.8,12906.8,"e depois, o fim do nosso viética, quando muito judeus."
12906.8,12911.8,"Imigraram, posso finitar o Nensoviética para Israel,"
12911.8,12914.8,levaram o Judo e a prática do Judo.
12914.8,12917.8,"E por que eu to citando isso? Porque no Mundial de Abu Dhabi,"
12917.8,12921.8,"que foi dois meses atrás, nós tivemos um Judoque Gipsy,"
12921.8,12926.8,se retirando da competição para não enfrentar um Judoque Israelense.
12926.8,12931.8,"Então tivemos muita pressão nesse Jogos Olímpicos também,"
12931.8,12936.8,para que tivesse um boicote a Israel como ocorreram boicotes
12936.8,12939.8,"contra a África do Sul, do apartheid,"
12939.8,12945.8,"os atletas russo e belo russo, vão competir sobre o bandeira neutra de novo,"
12945.8,12948.8,"eu digo de novo, porque deu última vez,"
12948.8,12950.8,por que foi por causa da conversação de Dope.
12950.8,12953.8,"E só os russo, bem lembrado."
12953.8,12958.8,"Então, nós vamos ter, certamente, protestos e manifestações,"
12958.8,12962.8,"manifestações de apoio, inclusive, seja para atletas o croniano,"
12962.8,12966.8,"seja para atletas russo, atletas palestinos, atletas esraelenses,"
12966.8,12969.8,"serão oito atletas palestinos, um deles,"
12969.8,12973.8,"é um judoca, inclusive, e que tem um judoca esraelense"
12973.8,12976.8,na mesa categoria de peso que ele.
12976.8,12980.8,"Então, pode ser, que dependendo do sorteio,"
12980.8,12983.8,"nós tenhamos, em algum momento, o judoca palestino se encontrando"
12983.8,12985.8,contra os judoca esraelenses.
12986.8,12990.8,"É improvável, porque pelo ranking,"
12990.8,12993.8,"inclusive, pelo pouco que eu vi ali do ranking,"
12993.8,12997.8,"o judoca palestino ele também abaixo do ranking, inclusive."
12997.8,13000.8,Mas é uma possibilidade até.
13000.8,13004.8,"Então, teremos jogos bastante politizados"
13004.8,13008.8,e também em relação com o cenário político na França.
13008.8,13011.8,"E aí, meu carmatias,"
13011.8,13014.8,"o atleta francesa,"
13014.8,13017.8,"um campo a si lá,"
13017.8,13023.8,"ela vai participar da cerimona de abertura usando um boneh,"
13023.8,13028.8,"porque ela é uma humana, ela pretende usar um hijab,"
13028.8,13036.8,"porém, o comiteu límpico francesse usando as regras seculares da França,"
13036.8,13040.8,"disse que ela não poderia usar um símbolo religioso,"
13040.8,13042.8,durante o disfile.
13042.8,13044.8,"E aí entra aquela discussa que a gente já teve a esquira,"
13044.8,13046.8,"que é um símbolo religioso, que é uma peça de roupa,"
13046.8,13048.8,quando é que você consegue traçar a linha.
13048.8,13052.8,"Então, ela vai desfilar usando um boneh."
13054.8,13057.8,"E a gente vai usar,"
13057.8,13059.8,"assim eu estou até meio constrangido agora,"
13059.8,13060.8,"porque o que acontece,"
13060.8,13063.8,"quando recentemente passei pela França,"
13063.8,13065.8,"naquela viagem longa que eu fiz,"
13066.8,13070.8,"e eu trouxe de presente pro filho do Matias,"
