start_segment,end_segment,text
6822.48,6824.48,"daqueles que são mais velhos e também,"
6824.48,6827.48,"dos que tiveram papel a vai entre comigas,"
6827.48,6829.48,entre aspas menor.
6829.48,6831.48,"Então, a Vitória Vicharuel foi chamada"
6831.48,6832.48,"pra essa chapa de militares,"
6832.48,6833.48,"pra compor, pra ser mulher,"
6833.48,6836.48,"pra ser conservadora, pra ser antaborto,"
6836.48,6838.48,"pra ser pro militar,"
6838.48,6839.48,e o militares não me eniga muito
6839.48,6840.48,"pra essa questão de gênero,"
6840.48,6841.48,"muito menos de militar,"
6841.48,6842.48,"nem nada liga pra economia,"
6842.48,6845.48,"números, e cachorros,"
6845.48,6848.48,são as coisas que podem ter.
6848.48,6851.48,"E a Carina liga para poder,"
6851.48,6853.48,"e como anda o Congresso,"
6853.48,6855.48,"como o Congresso relacionou com o Ministério,"
6855.48,6857.48,que me leitam pouco com essa vez disso.
6857.48,6859.48,"Então, o que a gente vê aqui,"
6859.48,6862.48,"com esse episódio de racismo,"
6862.48,6863.48,"como gancho,"
6863.48,6867.48,"é Carina peitando se há vice-presidente,"
6867.48,6869.48,"porque Carina se impõe,"
6869.48,6871.48,"ali, como vice-presidente informal,"
6871.48,6874.48,"como primeira dame informal, etc.,"
6874.48,6877.48,"inclusive, ela parece que forçou,"
6877.48,6879.48,"um convite,"
6879.48,6881.48,"para estar na abertura dos jogos solímpicos,"
6881.48,6882.48,"em Paris,"
6882.48,6884.48,"acompanhando o Milei,"
6884.48,6886.48,"ela não havia sido convidada formalmente,"
6886.48,6887.48,parece que houve uma pressão
6887.48,6889.48,pra que ela fosse convidada.
6889.48,6890.48,"Então, eu acho que aí a gente vê,"
6890.48,6891.48,"assim,"
6891.48,6893.48,mais uma vitória de Carina Milei.
6893.48,6895.48,"E ela que tem um cargo de fato,"
6895.48,6897.48,ela é acertar a geral da presidência
6897.48,6899.48,"nesses dois cargos,"
6899.48,6901.48,"simbólicos,"
6901.48,6903.48,mas ela faz parte
6903.48,6906.48,da administração formalmente.
6906.48,6908.48,"Cargo, esse que foi criado,"
6908.48,6911.48,"depois que me lei numa ordem executiva,"
6911.48,6913.48,"tipo, no dia 11 de dezembro,"
6913.48,6915.48,"sei lá, no dia seguinte,"
6915.48,6917.48,"ela possa dele,"
6917.48,6919.48,ele acabou com a lei de nepotismo
6919.48,6921.48,no poder administrativo argentino.
6921.48,6923.48,"E a hetocontinu,"
6923.48,6926.48,ele deu esse cargo pra irmã.
6926.48,6929.48,"Bom, levamos esse parafroid, né, Felipe?"
6929.48,6930.48,Pois é.
6930.48,6932.48,"Voltamos ao Rio de Janeiro,"
6932.48,6934.48,"agora, uma outra roda de Sama,"
6934.48,6937.48,"mas com uma notícia não tão feliz, né,"
6937.48,6941.48,"quanto do embaixador sul-americano,"
6941.48,6944.48,"já que na sexta-feira passada,"
6944.48,6946.48,"na Praça Tiradentes,"
6946.48,6948.48,"no Centro da Capital Fluminense,"
6948.48,6951.48,"uma argentina que veio ao Rio,"
6951.48,6953.48,"né, pra participar do Foram Latina,"
6953.48,6955.48,"americano de educação musical,"
6955.48,6959.48,"e um homem fizeram imitações de macaco,"
6959.48,6962.48,"durante esse evento,"
6962.48,6965.48,"algo que viralizou bastante, né,"
6965.48,6970.48,"e está gerando aí um debate importante, né,"
6970.48,6971.48,"porque, de um lado,"
6971.48,6973.48,"já tão minimizando, né,"
6973.48,6974.48,"as acusações racismo,"
6974.48,6976.48,"mas assim, gente,"
6976.48,6979.48,"é uma, são um casal de pessoas"
6979.48,6982.48,que são não muito para os macacos na roda de Sama.
6982.48,6985.48,"Se isso não tem uma connotação racial,"
6985.48,6990.48,"enfim, eu não sei o quê mais assim, né, Juan?"
6990.48,6993.48,"É, a associação musical que ela faz parte,"
6993.48,6997.48,"que é inclusive, em homenagem"
6997.48,7000.48,"ao Carolf, ou autor de Carmina Burana."
7000.48,7003.48,"E que, assim,"
7003.48,7005.48,"ele durante muito tempo foi debatido se ele seria um nazista,"
7005.48,7008.48,"não, mas é um dos mais importantes pedagogos musicas,"
7008.48,7015.6,eles disseram que na Argentina aquele gesto não tem connotação racista.
7015.6,7019.44,Na Argentina está liberado em Mitama-Caco.
7019.44,7026.48,"Na Argentina quando se imita Macaco, estão falando brasileiro."
7026.48,7035.48,"Pois é, é muito direto, não é uma coisa subjetiva, enfim, ela já não está no Rio,"
7035.48,7041.8,mas que ela volte a país para ser acusada judicialmente.
7041.8,7050.2,"Mas é um absurdo, e justamente a comissão de combate ao racismo da Câmara do Véreador"
7050.2,7055.48,e do Rio de Janeiro pediu a identificação e punição do suspeito.
7055.48,7073.48,"Mas as imagens falam por si só, enfim, não tem, não é um ato muito direto, muito agressivo."
7073.48,7081.48,"E outra notícia, a triste, relacionada à Argentina ainda em relação ao caso do menino Loh,"
7081.48,7089.48,"que a Polícia Nacional do Paraguai está buscando o paradero dele na cidade de Vija Rica,"
7089.48,7097.48,"no departamento de Guairá, no sul do país, de acordo com dados da interpol relacionados"
7097.48,7103.48,ao desaparecimento do menino argentino de cinco anos.
7103.48,7109.48,E efetivos policiais paraguais realizaram procedimentos em diferentes locais
7109.48,7117.48,dessa cidade e outros discritos que estão localizados sobre a rodovia número oito do Paraguai.
7117.48,7125.48,"Esperamos que essa história tenha um desfecho feliz, mas é um caso que para o governo Millei"
7125.48,7130.48,não faz parte das prioridades momentâneas.
7130.48,7138.48,"Não, não faz parte da agenda e eu vejo como também o fenômeno mediático,"
7138.48,7144.48,"como se dizem português, é morboso, é muito morbido."
7144.48,7154.48,"Para tentar estimular as desconfianças e manter o rei sem saber a custa da vida de um garoto,"
7154.48,7160.48,"um garoto de nocente, obviamente, para que vocês tenham uma ideia,"
7160.48,7168.48,"até antes de eu sair da Argentina, eles estavam escrutinando a vida de cada um dos participantes do tal almoço,"
7168.48,7172.48,"que foi o último, que ele foi visto com vida."
7172.48,7178.48,"Enfim, espondo reputações, isso eu estou dizendo todas as televisões nacionais,"
7178.48,7186.48,"as rádios, esponda, vida dos irmãos, das tias, dos conhecidos, todos que estavam naquele almoço,"
7186.48,7190.48,"quase após os idáuxos interesses, onde moram e chamam-los ocupados."
7190.48,7196.48,"Então eu acho que aí há também uma serpa soberba da imprensa que é da capital,"
7196.48,7201.48,"da caba, da capital da cidade autônoma de Buenos Aires com relação ao que é ao interior,"
7201.48,7204.48,todos ali poderiam ter feito alvos.
7204.48,7209.48,"Então é muito triste isso, eu espero que tira a presta com vida,"
7209.48,7215.48,pois foi sequestrado para a trata de personas ainda ainda há uma experiência de que tira a presta com vida.
7215.48,7223.48,"Outro caso envolvendo a menor agidade, e aqui a gente diz que pode ser um tema sensível,"
7223.48,7228.48,e despertar gatilhos em parte da nossa audiência.
7228.48,7235.48,"Então sugerimos para essas pessoas que adiantem o programa em dois, três minutos,"
7235.48,7242.48,"já que o senador Raviér Macaia, da União Democrata independenta,"
7242.48,7247.48,"que é uma legenda conservadora do país fundada pelo Raimegos Man,"
7247.48,7255.48,que era o mentor intelectual do regime militar ali na virada dos anos 70 para os anos 80.
7255.48,7261.48,"Saiu em defesa do seu pai, o Eduardo Macaia,"
7261.48,7269.48,num caso de abuso sexual de duas meninas de 14 anos de idade.
7269.48,7279.48,"Ele foi condenado há seis anos de prisão, mas o senador diz que o caso está sendo contaminado,"
7279.48,7284.48,"que não dá para acreditar só no pastemunho das vítimas,"
7284.48,7294.48,"e então está gerando toda uma discussão, inclusive, com algumas organizações pedindo até a renúncia do senador,"
7294.48,7302.48,"que deixa o congresso, mas um caso que está repercutindo bastante no país,"
7302.48,7314.48,"transandino pela sensibilidade também, e que inclusive uma das netas do Eduardo Macaia testemora contra o próprio avô."
7314.48,7319.48,Então mostra aí a gravidade das denúncias.
7320.48,7327.48,"É muito interessante até penso no caso ao peróvite na Argentina,"
7327.48,7333.48,"como esses líderes, antes em questionáveis, considerados em unes,"
7333.48,7340.48,acabem caindo finalmente depois de anos e anos de abusar de mulheres vulneráveis.
7340.48,7345.48,É uma boa notícia nesse no mundo.
7345.48,7350.48,"O outro caso também está repercutindo bastante no Chile,"
7350.48,7356.48,"em relação ao Eduardo Rado, ex-alcalde de recoleta,"
7356.48,7363.48,"que a gente tem tratado já algumas semanas, já que foi instruída na Câmara de Deputados,"
7363.48,7368.48,"uma comissão especial para investigar o caso das farmácias populares,"
7368.48,7375.48,"pelo qual ele teve a prisão preventiva, nesse caso de corrupção,"
7375.48,7379.48,"que está atingindo também o governo Gabriel Bóriti,"
7379.48,7383.48,"já que o Rado faz parte do Partido Comunista,"
7383.48,7388.48,que é um dos principais partidos da base do Bóriti.
7388.48,7391.48,"Sim, eu acho que é meio urgente que se apure,"
7391.48,7397.48,"que se investigue essa questão dele com esses supostos candalos,"
7397.48,7401.48,"farmácias populares, mas também sempre remarcar que o Partido Comunista"
7401.48,7406.48,"é da base de apoio do Bóriti, mas é um partido dividido nesse apoio."
7406.48,7410.48,"A parte que apoia é a parte com andada pela Câmila Vallecos,"
7410.48,7413.48,que está no gabinete do Bóriti.
7413.48,7415.48,É a porta voz do governo.
7415.48,7419.48,"Oso governo e a parte que não apoia, que é mais radical,"
7419.48,7422.48,é a parte do Rado.
7422.48,7426.48,"Mas, enfim, é uma figura importantíssima na esquerda chilena"
7426.48,7429.48,"do ponto de vista internacional, a gente comentou aqui o apoio"
7429.48,7432.48,que recebeu do presidente Petro da Colômbia.
7432.48,7437.48,"Enfim, a gente se acompanha, mas eu sinto falta aqui,"
7437.48,7440.48,"nesse caso, fazendo já uma crítica em preença novamente,"
7440.48,7444.48,"embora eu gosto muito do declínic, eu acho que falta uma investigação de fato"
7444.48,7447.48,"da culpabilidade, do que de fato aconteceu,"
7447.48,7449.48,"para a gente não sair dizendo, é um corrupto,"
7449.48,7453.48,"ou não, é o jornal de direita,"
7453.48,7457.48,"que tem mais circulação, está causando de corrupto,"
7457.48,7465.48,"não sei, eu acho que me faltam informações para ter uma opinião informada"
7465.48,7468.48,pelo respeito da Néol Rádue.
7468.48,7471.48,"O declínic é uma publicação que eu recomendo,"
7471.48,7473.48,"que as pessoas nem sobre o Chile,"
7473.48,7477.48,"mas não é uma publicação de jornalismo investigativo,"
7477.48,7482.48,a experiência está fazendo alguns outros sites de informação
7482.48,7487.48,ou os próprios jornais domicinais como Elemercúrio e la terceira.
7487.48,7491.48,Principalmente la terceira que tem uma visão um pouco mais progressista.
7491.48,7494.48,"Pois a gente vai agora para o Peru,"
7494.48,7498.48,"com duas notícias relacionadas também, as condenações,"
7498.48,7502.48,"enfim, já que a Corte Suprema do País, a um pior de 14,"
7502.48,7505.48,"há 18 meses a ordem de prisão preventiva,"
7505.48,7508.48,"que é contas com o ex-presidente Pedro Castilho,"
7508.48,7517.48,por conta da tentativa de dissolver o Congresso em dezembro de 2022.
7517.48,7524.48,"Com isso, ele permaneceria detido até dezembro de 2025"
7524.48,7528.48,"com outras penas conjuntas,"
7528.48,7534.48,só que a procuradoria ainda tenta na uma condenação de 34 horas de prisão
7534.48,7540.48,pela tentativa de perpetar com golpe de estado no País.
7540.48,7546.48,"E ainda relacionado à sua ex-legenda político, o Peru Libre,"
7546.48,7550.48,o Poder Judicial também ordenou 12 meses de prisão preventiva
7550.48,7554.48,"contra o fundador da Cígla, o Vladimir Serrón,"
7554.48,7563.48,"por medidas restitivas dictadas no processo chamado Antausis,"
7563.48,7568.48,"o qual seria a parte de uma organização criminosa junto a Martín Bela,"
7568.48,7576.48,"onde locio defraudando o estado com mais de 26 milhões de solas,"
7576.48,7579.48,"até vezes de obras que executaram,"
7579.48,7583.48,"quando era presidente regional de RUNIN,"
7583.48,7586.48,entre os anos de 2011 e 14.
7586.48,7593.48,"Então, em caso da década passada, mas que está repercutindo ainda hoje."
7593.48,7596.48,"Sim, no caso do Vladimir Serrón,"
7596.48,7600.48,"ele foi, porque ele foi governador da província de RUNIN"
7600.48,7606.48,e ele nesse período foi acusado e condenado por opção.
7606.48,7611.48,Porque a sua espiração política era que ele fosse o candidato
7611.48,7615.48,"no ano em que Pedro Castílio se apresentou mais,"
7615.48,7618.48,"por conta da sua ficha, a SUJA, ele não pôde fazê-lo."
7618.48,7621.48,"E Castílio meia que apareceu como o maior net,"
7621.48,7624.48,ou apadrinhado de Vladimir Serrón.
7624.48,7627.48,"O que não me parece saudável nesses dois casos,"
7627.48,7630.48,aqui que existem tantas prisões preventivas.
7630.48,7636.48,A do Castílio já devia ter tido encaminhamento para um julgamento
7636.48,7640.48,"e começar um julgamento devido ali,"
7640.48,7643.48,"já há tempo para isso, tem que estar tendo prisão preventiva,"
7643.48,7646.48,post-tergado ou renovada.
7646.48,7649.48,"No caso do Vladimir Serrón, que já tem uma condenação,"
7649.48,7653.48,"não há muito que dizer, tem que acabar a presença preventiva,"
7653.48,7657.48,"e começar a cumprir a pena, e tem uma pena já."
7657.48,7660.48,"Enfim, são essas coisas da justiça peruana,"
7660.48,7666.48,infelizmente não é totalmente independente da executivo peruano.
7667.48,7672.48,"Agora, a gente passa para uma notícia de hoje mesmo na Colômbia,"
7672.48,7676.48,"que ainda não temos muito as informações,"
7676.48,7681.48,"mas tivemos distúrbios na Universidade Nacional de Bogota,"
7681.48,7687.48,inclusive com uma possível troca de tiros entre a polícia e emcapuzados.
7687.48,7691.48,"Se você, que já foi diversas vezes para Colômbia,"
7691.48,7695.48,"já cobriu essas revoltas estudantes,"
7695.48,7702.48,"que dá para falar em retrospectiva, não nesse caso, em específico."
7702.48,7706.48,"Sim, de fato estou na Colômbia, tecnicamente,"
7706.48,7710.48,"mas estou longe dessa problemático de hoje,"
7710.48,7715.48,que são esses distúrbios na Universidade Nacional de Bogota.
7715.48,7718.48,"Eu me refiro sempre ao ano de 2019,"
7718.48,7720.48,"como ano muito marcante na América Latina,"
7720.48,7723.48,"que muitas estudantes, manifestantes,"
7723.48,7726.48,"não as ruas para fazer manifestações antigoveras,"
7726.48,7728.48,"não é a Colômbia, não foi essa sessão,"
7728.48,7733.48,"e foi a partir dos estudantes que começaram os protestos ali por setembro,"
7733.48,7737.48,"o outubro, depois do Chile, o Chile foi o grande carro chefe"
7737.48,7741.48,dessas manifestações do Lava Colômbia veio na sequência.
7741.48,7743.48,"E muitos começaram entre os estudantes,"
7743.48,7747.48,"inclusive alguns heróis, martires, estudantes,"
7747.48,7753.48,"que foram mortos pela esmad, a famosa polícia..."
7753.48,7759.48,"A tropa de choque, da Colômbia."
7759.48,7763.48,"Então esse tipo de enfrentamento causa muita preocupação,"
7763.48,7768.48,"num país que vivem um contexto de violência,"
7768.48,7771.48,"há muitas décadas, embora amainado, acalmado,"
7771.48,7774.48,"por leis, por processos de negociação, etc."
7775.48,7778.48,"A violência é uma constante na Colômbia, não há como negar."
7778.48,7780.48,"Quando esse tipo de coisa acontece,"
7780.48,7782.48,"é bom abrir os olhos,"
7782.48,7785.48,"acho importante o chadrês verbal agora está mostrando isso,"
7785.48,7786.48,porque isso pode crescer.
7786.48,7789.48,"Por enquanto, não me parece algo muito grande,"
7789.48,7791.48,"pelo que eu lhe rapidamente hoje nos anteriores,"
7791.48,7793.48,"mas acho que pode vir numa escalada,"
7793.48,7798.48,em que a gente pode passar a se preocupar com o que acontece aqui nesse país.
7798.48,7802.48,"E outra notícia de hoje, que também a gente deve repercutir"
7802.48,7805.48,"mais na semana que vem,"
7805.48,7808.48,"mas acabou de ser anunciado,"
7808.48,7813.48,"foi a prisão do narcotraficante Ismael Elmaio Zambada,"
7813.48,7816.48,um dos fundadores do cartel de Sinaloa
7816.48,7821.48,"e do Roaquin Guzman Lopes, um dos filhos de El Chapo,"
7821.48,7824.48,também da mesma organização.
7824.48,7827.48,"E o que chama a atenção em relação ao Elmaio,"
7827.48,7831.48,"que ele acabou se enlegando as autoridades estadounidenses,"
7831.48,7836.48,"porque já vinha em uma operação desde o começo do mês pela sua captura,"
7836.48,7841.48,ele que está a cerca de 40 anos foragido da justiça.
7841.48,7845.48,"E era um narcotraficante que não ostentava,"
7845.48,7848.48,"inclusive, tem muitas poucas imagens dele,"
7848.48,7851.48,"registradas, então,"
7851.48,7855.48,um caso que vai ter bastante consequência
7855.48,7858.48,aí nas próximas semanas e meses.
7859.48,7861.48,Seguramente.
7861.48,7864.48,"E esse perfil do Elmaio, que você passou,"
7864.48,7865.48,é realmente...
7865.48,7869.48,"chama a atenção, porque o filho do El Chapo,"
7869.48,7871.48,"há muitos vídeos dele, inclusive,"
7871.48,7874.48,há vídeos dele com mandando seus...
7874.48,7878.48,"seus originados, alguns falando,"
7878.48,7881.48,"ocupar, enfim, ele é um cara..."
7881.48,7884.48,"um buen moço, como se diz na Argentina,"
7884.48,7886.48,"assim, a God Locking Guy."
7886.48,7889.48,E ele tem tudo para ser um cara carismático
7889.48,7891.48,afreites do Carnaval de Senhora Lua.
7891.48,7895.48,A prisão dos dois parece bastante importante.
7895.48,7898.48,"E eu acho que, enfim..."
7898.48,7903.48,"Vai ser um momento importante para o Carnaval de Senhora Lua,"
7903.48,7906.48,nesse momento em que ele está presente
7906.48,7909.48,"em vários países da América do Sul, né,"
7909.48,7912.48,"desde Ecuador, um pador muito forte aqui na Colômbia,"
7912.48,7915.48,"muito forte, na Venezuela muito forte,"
7915.48,7918.48,"nós sabemos ainda assim no norte do Brasil,"
7918.48,7920.48,"aí é preciso haver direito, mas..."
7920.48,7924.48,é um cartel com pretensões latinoamericanas.
7924.48,7927.48,"E muito provavelmente, né, o..."
7927.48,7932.48,"o novo chefe do cartel é um dos filhos do Elmaio,"
7932.48,7935.48,"o Ismail Zambada Sikairos,"
7935.48,7938.48,conhecido como Elmaító Flaco.
7938.48,7941.48,"Enfim, o agente, muito provavelmente,"
7941.48,7944.48,"deve voltar esse caso em breve, né?"
7944.48,7948.48,E para fechar a minha participação nesse bloco
7948.48,7952.48,"e já deixo aí o espaço pra cima, né,"
7952.48,7954.48,"fazer a sua recomendação cultural,"
7954.48,7956.48,"ficar aqui a minha indicação, né,"
7956.48,7960.48,da Coluna do Rossé Dennis Cruz
7960.48,7962.48,"para o portal de Verrentes,"
7962.48,7964.48,"chamado Kekeda,"
7964.48,7966.48,"dela revolucione sanguinista,"
7966.48,7968.48,"e ele responde já no título,"
7968.48,7970.48,"nada, né, no qual ele faz uma crítica,"
7970.48,7974.48,"a crítica, a partir de um olhar,"
7974.48,7978.48,revolucionário em relação ao sandinismo
7978.48,7984.48,e o que sobrou desse legado atualmente na Nicaragua.
7984.48,7986.48,Aqui interessante.
7986.48,7988.48,"Eu vou fazer uma dica dupla, então,"
7988.48,7990.48,"porque eu tinha pensado na minha dica,"
7990.48,7992.48,"eu vou falar dica pensada,"
7992.48,7994.48,e rapidamente da dica que eu pensei agora.
7994.48,7997.48,"Há uma... um filme, né,"
7997.48,7999.48,"um Netflix muito interessante,"
7999.48,8001.48,"chamado Goio,"
8001.48,8005.48,"é protagonizado pelo ator Nicolás Furtado,"
8005.48,8007.48,"que é aquele esquia-companho,"
8007.48,8009.48,"séries e filmes argentinos,"
8009.48,8011.48,vão se lembrar com o diaocito
8011.48,8013.48,"de ele marinal,"
8013.48,8015.48,"uma tia sabe perfeitamente que eu estou falando,"
8015.48,8017.48,se ele é um dia...
8017.48,8019.48,"Ele quer o Guai, né?"
8019.48,8023.48,"E ele faz aí um sujeito bem nascido,"
8023.48,8025.48,"de uma família rica, com irmãos compreensivos,"
8025.48,8029.48,"mas ele tem um diagnóstico de asperger,"
8029.48,8033.48,"e ele faz um personagem que é um guia de museu,"
8033.48,8035.48,"do museu nacional de Buenos Aires,"
8035.48,8039.48,"e ele tem ali um amor platônico,"
8039.48,8043.48,"que ele desenvolve, que ele transforme em arte,"
8043.48,8045.48,mas que depois vai se complicando.
8045.48,8048.48,"O filme é muito, muito sensível e interessante,"
8048.48,8051.48,"e mostra uma Buenos Aires sempre linda,"
8051.48,8053.48,porque afinal é Buenos Aires.
8053.48,8056.48,"Então, já que nós falamos..."
8056.48,8059.48,"E até puxei aqui a ficha do filme,"
8059.48,8062.48,que tem participação também da solidar de Villamil
8062.48,8066.48,"e do Pablo Rago, que estão em o segredo de seus olhos."
8066.48,8070.48,"Totalmente, eles são os irmãos do Gógio."
8070.48,8075.48,"Então é um filme com melhor do castinho argentino,"
8075.48,8076.48,ali...
8076.48,8078.48,"Ai, assistida rota, também."
8078.48,8080.48,"E assistida rota, na Viterana,"
8080.48,8083.48,é uma das musas do Amador.
8083.48,8085.48,"É, e as mulheres do Fito Pais,"
8085.48,8088.48,"e apesar de a gente estar falando de vocês nomes,"
8088.48,8090.48,"nomes todos, e nomes de Villamil,"
8090.48,8092.48,ela é excelente atriz.
8092.48,8096.48,"Enfim, o filme é muito bom, eu gostei bastante."
8096.48,8098.48,"Mas, enfim, como a gente falou aqui do El Chaco,"
8098.48,8100.48,"eu recomendo também um podcast,"
8100.48,8103.48,"da revista Vais, que se chama El Chaco,"
8103.48,8105.48,"Ele refe isso Ruício,"
8105.48,8108.48,que conta a história do El Chaco
8108.48,8111.48,desde um momento que ele era apenas um serviçal ali
8111.48,8114.48,dos outros grandes nomes dos Cartéis Mexicanos
8114.48,8116.48,até o seu julgamento.
8116.48,8118.48,Está bastante interessante.
8118.48,8121.48,"Mas, enfim, aí ficam com uma dica do Blow."
8121.48,8125.48,"Gógio, eu recomendo que comecei a ver já."
8125.48,8128.48,"Bueno, passamos agora para o cheque,"
8128.48,8133.48,no qual Ele o Felipe daremos uma volta pela bacia do Pacífico.
8133.48,8136.48,יא
8136.48,8138.5,א
8138.5,8143.04,Ze�
8145.54,8151.58,El camQa
8151.58,8163.42,Byden avisou o equipe um minute antes de desistir da eleição.
8163.42,8172.3,"a notícia do último domingo de 21, quando o presidente dos Estados Unidos, Joe Biden anunciou a"
8172.3,8180.58,"desistência da sua reeleição. E aí a gente começa a repercontir uma notícia do dia seguinte,"
8180.58,8190.38,"do dia 22, dada na BBC que o Biden avisou a equipe dele, segunda matéria, né? Literalmente um"
8190.38,8198.66,"minuto antes dele publicar a desistência. No dia anterior, inclusive os seus acessores de eleição"
8198.66,8206.1,"estava elaborando a sua agenda de compromissos de campanha, comícios e tal, depois que ele retornasse"
8206.1,8214.2,"aos compromissos públicos, já que ele estava isolado numa casa de praia na costa de Delauer, devido ao seu"
8214.2,8223.6,"diagnóstico, positivo de covid, um diagnóstico, né? Aqui, a gente já vai comentar, mas o principal é que a"
8223.6,8230.6,"senhora, a bela costa de Delauer, muito famosa, internazionalmente por suas praias, de areia branca,"
8230.6,8241.36,"né? E, enfim, quase um caribe, brincadeiras a parte, segundo, a matéria, o presidente de"
8241.36,8250.8,"Joe Biden mudou de ideia no domingo de manhã, tá? E segundo a imprensa dos Estados Unidos, aí"
8250.8,8259.0,"saindo dessa matéria da BBC, eu vi basicamente duas linhas argumentativas pra explicar a desistência dele."
8259.0,8267.0,"E elas não são eliminatórias, uma delas é que ele se reuniu ali com um pequeno círculo de"
8267.0,8273.6,"acessores, que incluia o Steve Hitchett, o Mike Donnellon, que era o estratégista chefe da campanha,"
8273.6,8280.4,"a sua vice-chefe de gabinete, Anne Thomasine, e o chefe de gabinete da primeira dama de Joe Biden. E nessa"
8280.4,8288.4,"reunião, ele já estaria, digamos assim, pedavida, já estava ali meio desgastado, meio de malmour,"
8288.4,8294.2,"devido a pressão, e aí a gente já vem repercutindo isso desde o debate, né, Condoron de Trump,"
8294.2,8300.6,"devido a pressão que ele estava sofrendo de doadores, de pessoas dentro do Partido Democrata,"
8300.6,8315.8,"para desistir da campanha. E nessa reunião, tá, teriam falado pra ele sobre pesquisas internas,"
8315.8,8322.6,"pesquisas novas que estariam pra sair e tal, mostrando que a chance de vitória dele,"
8322.6,8331.8,"contra o Donnellon de Trump, estavam de fato bastante enfraquecidas. Então, nessa reunião, com"
8331.8,8343.8,"seus acessores, né, próximos, ele decidiu fazer uma vídeo chamada por volta das 13 horas e 45 minutos"
8343.8,8350.8,"do domingo horário local de Delaué, uma hora atrás do horário de Brasil, fez uma vídeo chamada"
8350.8,8359.8,"com alguns funcionários graduados da Casa Branca, que não estavam ali presencialmente, e logo depois"
8359.8,8369.8,"anunciou então a sua decisão de desistir. Repito, isso é um resumo do que saiu na matéria da BBC,"
8369.8,8376.8,"e do que principal de saiu na imprensa dos Estados Unidos. Então, assim, quais são as duas linhas argumentativas,"
8376.8,8384.8,"que ele estava pedavida, desgastado, do saco cheio, sem se sentir parado pelo próprio partido democrato,"
8384.8,8392.8,"pelo menos por parte do partido democrata, e que pesquisas internas e pesquisas novas feitas nos"
8392.8,8400.8,"Estados chave, lembrando o formato, né, do delas eleições de Estados Unidos, teriam indicado que"
8400.8,8410.8,"ele já não necessariamente seria o homem forte a derrotar o dono de Trump, especialmente depois"
