start_segment,end_segment,text
0.0,4.0,O Podiqueche que você ouve agora uma produção da Centra III.
4.0,17.0,Começa agora ao Chadreis Verbal.
17.0,27.0,Bom crepúsculo ouvintes da Centra III está começando mais uma edição do Chadreis Verbal.
28.0,33.0,O seu revista Semanal de Política Internacional em Formato Podcastal.
33.0,36.0,Meu nome é Matias Pinto e como sempre é só ao lado dele.
36.0,42.0,"Meu amigo e companheiro, Felipe Nobre Figueiredo, homem por trás do tabuleiro."
42.0,45.0,"Olá, meu caro Matias. Olá, todos os uns ouvintes."
45.0,48.0,"Tudo mundo que nos ouvimos nos prestigiouses, nos vongos solários nos amandos."
48.0,51.0,"O deseja diz que nos odeia, mas não nos tira do vido."
52.0,59.0,Chegando aqui a edição de número 394 do Chadreis Verbal numa sexta-feira 13.
59.0,65.0,Estamos gravando esse programa numa sexta-feira 13.
65.0,67.0,Você!
67.0,69.0,Os jovens não têm mais referência a montesas.
69.0,73.0,A gente já era referência agora ao Big Chongos.
74.0,86.0,Mas o programa de sexta-feira 13 com um outro detalhe que é 13 do 9 de 24.
86.0,89.0,"E 13 mais 9 da 22, que é quase 24."
89.0,91.0,"Olha aí, tá?"
91.0,96.0,"Pois é, então sim, tá muito claro, só não vê que não quer."
96.0,100.0,"Falando o sério agora, dois recados importantes."
100.0,104.0,"Então, meu caro Matias antes da gente começar o nosso trabalho."
104.0,114.0,"Primeiro divulgar aqui pros nossos ouvintes uma newsletter que está surgindo agora de Política Internacional,"
114.0,122.0,"feita pelas minhas amigas, Fernando Acimas e Lucien Escarazate, que é a Carta Global."
122.0,126.0,"Então vocês vão lá, a Carta Global.com.br."
126.0,130.0,"Elas ainda vão produzir bastante coisa legal, a Newsletter começou há pouco tempo."
130.0,136.0,Elas estão com um projeto muito legal e estamos aqui divulgando o projeto das nossas amigas.
136.0,141.0,"E a segunda já não é uma divulgação tão alegre, meu caro Matias."
141.0,150.0,"É mais uma denúncia, né? Porque assim, outras amigas nossas, as cientistas Laura Marise e Ana Bonassa,"
150.0,156.0,"nunca vi um cientista que faz um trabalho importantíssimo de divulgação científica,"
156.0,165.0,"elas foram condenadas pelo judiciário, por uma integrante do judiciário, melhor dizendo,"
165.0,174.0,"porque um médico fez um vídeo com uma informação, que não é uma informação com uma mentira,"
174.0,179.0,de que vermes estariam ligados a diabetes.
179.0,187.0,"E elas produziram outro vídeo, esclarecendo a população e passando a informação correta."
187.0,194.0,"E o médico original, que não vamos usar muitos adjetivos,"
194.0,198.0,"ele as processou por, enfim, caluna, sei lá, o quê?"
198.0,203.0,"E elas foram condenadas no que é um absurdo, porque elas passaram a informação correta."
203.0,209.0,"Esse assunto foi tema de coluna do Renaldo lá na Folha do São Paulo,"
209.0,219.0,"foi tema de vídeo no Meteoro Brasil, várias pessoas da divulgação científica estão abordando esse assunto."
219.0,226.0,Também tivemos a sociedade brasileira para o Progresso da Ciência emitindo uma nota.
226.0,233.0,"Então, é uma situação absolutamente surreal, que as pessoas que passaram a informação correta"
233.0,241.0,"sobre um assunto de saúde, estejam sendo penalizadas enquanto a pessoa que passa uma mentira,"
241.0,247.0,"que passa algo que pode comprometer a saúde das pessoas, não acontece nada com ela."
247.0,254.0,"Então, eu peço para vocês que ouveu a coluna do Renaldo lá na Folha, ouvejam o vídeo do Meteoro"
254.0,257.0,e compartilhem esses materiais.
257.0,263.0,"Dependente do que você, não Felipe, eu não gosto desse canal, não gosto daquele canal,"
263.0,268.0,"não importa. E acompanho o trabalho das suas amigas, nunca vi um cientista."
268.0,273.0,"Bem, passemos agora para o primeiro bloco do giro de notícias."
285.0,290.0,Notícias do domingo passado de 8 de setembro.
290.0,296.0,Três raílenses morrem em ataque terrorista na frontera com a Jordânia.
296.0,308.0,"Um caminhoneiro, Jordâniano, na ponte de Alenbi, que liga a Jordânia a si Jordânia,"
309.0,322.0,"ele matou três funcionários, as raílenses, do terminal de cargas ali que ficam na região da ponte,"
322.0,337.0,e foi morto pelas forças de segurança. O governo Jordâniano identificou o criminoso e condenou o ataque contra a civis
337.0,341.0,e pediu pelo fim da escalada de tensões.
341.0,351.0,"O resbolar, por sua vez, o catair de resbolar do Irak, disse que o ataque foi uma obra da resistência islâmica na Jordânia,"
351.0,360.0,"ou seja, colocando ali um elemento de que teria um grupo por trás desse episódio e não teria sido uma ação solitária."
360.0,375.0,"E o comandante da Unidade 8200, que é uma das principais unidades de vigilância de Israel, uma unidade de inteligência,"
375.0,392.0,"o iocí-sarriel renunciou essa semana, é mais uma pessoa da inteligência israelense, que renuncia devido aos ataques do ramás do dia 7 de outubro,"
392.0,407.0,ele disse que tinha que tem responsabilidade pelas falhos e segurança que levaram ao atentado terrorista e que a Unidade sob seu comandante teve sua responsabilidade.
407.0,428.0,"A gente já comentou aqui, em outras vezes, de como essas renúncias de pessoas do aparato de segurança israelense também pode ter um elemento de querer pressionar ou próprio Netariarro para ele assumir responsabilidades pelos ocorridos."
428.0,446.0,"E o caso do iocí-sarriel, que a gente já havia mencionado ele aqui, é importante lembrar que ele teve a sua identidade revelada por acidente devido ali uma conta de meio em segura que usou, enfim, uma falha bem grave de segurança."
446.0,457.0,"Também no domingo passado e ainda em Israel, país realiza ataques aéreos contra instalações iranianas na Síria."
457.0,475.0,"Tivemos diversos ataques relenses, diversos ataques aéreos relenses contra a Síria nessa semana, a gente já falou aqui, né, algumas vezes que a soberania do espaço, a Sírio, libanês e iraquiano hoje é praticamente uma ficção."
475.0,491.0,"E a segunda autoridade é Círias de 18 pessoas morreram enquanto, segundo, o observatório da guerra na Síria disse que foram 25 pessoas mortas."
491.0,514.0,"O alvo seriam local de desenvolvimento, de armas, incluindo possivel relação com os ataques utilizando armas químicas que ocorreram na Síria anos atrás e também local ligado ao desenvolvimento e produção de minces balísticos."
514.0,523.0,Notícia da segunda-feira passada de anóvido de setembro. Principal líder sindical da Nigéria é preso.
523.0,538.0,"O presidente do Congresso trabalhista, Nigeriano, o Joe Agero, ele foi preso no aeroporto de Abuja, antes de embarcar para o Reino Unido."
538.0,561.0,"Ele dias antes disse que criticou o governo por aumentar o preço da gasolina em 39% e que o Congresso trabalhista, Nigeriano, poderia realizar uma greve geral caso essa decisão não fosse revertida."
561.0,584.0,"Lembrando que nós temos muitos meses diversos protestos na Nigeria, devido a inflação, devido a alta do custo de vida e também tivemos aliados dele e os advogados do sindicato dizendo que ele foi preso com uma tática similar a da Gestapo."
584.0,611.0,"Lembrando que a Gestapo era a agência de inteligência de repressão interna da Alemanha Nazista. Já na Tanzania, meu caromatias, o Ali Kibal, que era um dos principais líderes do partido Chadema, um partido de oposição na Tanzania, ele foi encontrado morto com sinais de tortura e que ele teria sido atacado com ácido."
611.0,640.0,"Alguma substância que o queimou, enfim, a presidente do país condenou o crime, disse que tudo será devidamente investigado, porém a oposição disse que seria necessária uma investigação independente que, segundo, ou a partir do dele, abro aspas para o Freeman em Boa, é impossível que a mesma polícia, que seja suspeita, investigue o crime."
640.0,653.0,"Já que o Ali Kibal, que foi assassinado em tempos recentes, ele é criticado o aumento da violência pela polícia, da o aumento da violência estatal no país."
653.0,682.0,"E no Kenya, meu caromatias, os funcionários do principal aeroporto do país, na aeroporto Jormo Kenyata, de Nairobi, iniciaram uma greve nessa semana, protestando contra a concessão do aeroporto ao grupo indiano Adani pelos próximos 30 anos em troca do investimento de 1,8 bilhão de dólares."
682.0,704.0,"O governo disse que o acordo vai permitir a reforma e ampliação do aeroporto, incluindo a construção de uma nova pista e um novo terminal, porém os trabalhadores dizem que esse acordo prevê o corte de poços de trabalho e piores condições de trabalho."
704.0,715.0,"Ainda no continente africano e na segunda-feira que passou, museus do Sudão estão sendo saqueados, denunciar o funcionário."
715.0,733.0,"O Guardian publicou uma tere, com um funcionário do Museu Nacional de Cartoon, que denunciou que os museus do país, que estão em áreas controladas pelas forças de apoio rápido, ou que foram afetadas."
733.0,751.0,"Pela guerra, se viu, ou seja, museus ali que foram perto de locais de combate, coisas assim, eles estão sendo saqueados com milhares de artefatos sendo contrabandeados para fora do país."
751.0,760.0,"Lembrando que o Sudão, hoje nós temos Egito Sudão, Sudão do Sul."
760.0,775.0,"Porém, quando a gente pensa em Antigo Egito, essas regiões faziam parte das mesas dinâmicas. Nós temos o nosso Sudão, pirâmides, nós temos o Sudão, muitos objetos dessas culturas."
775.0,787.0,"Nós temos ali a cultura núbia, nós temos o início da expansão islâmica, nós temos algumas das mais antigas e gregas cristãs do mundo na bacia do nilo."
787.0,793.0,"Estou fazendo essa explicação, porque alguém pode ver se ele vai falar assim, como é que vai ter lá no Sudão?"
793.0,802.0,"O que está começando a ouvir nosso programa recentemente, ou que não é tão ligado assim em história, o Sudão é um país que tem um patrimônio orqueológico gigantesco."
803.0,820.0,"Então, esses objetos estarão sendo saqueados, provavelmente vendidos no mercado clandestino internacional para colecionadores sem escrupulos, como maneira de inclusive canalizar dinheiro para compra de armamentos e coisas assim da guerra."
820.0,835.0,"Nós temos algo muito parecido, por exemplo, com Daesh, o alto-entitulado Estado islâmico, que embora fizesse-se iconoclasti, embora fizesse-se aquele escrimes contra humanidade de destruir patrimônio orqueológico, também contrabandiou muita coisa."
835.0,842.0,"Ou então, o que a gente viu no patrimônio orqueológico irá aqui ano, posem vazão dos Estados Unidos em 2003."
842.0,847.0,"Então, é uma denúncia muito importante, muito grave e muito triste."
848.0,860.0,"Bem, passemos agora para a Coluna aberta, na qual o Felipe repercutirá o encerramento das paralimpiedas e aproveitará para dar uma volta pelo velho continente."
860.0,868.0,Coluna aberta.
872.0,887.0,"Bem, pessoal, a gente vai começar nosso giro europeu pela cerimônia de encerramento dos jogos paralimpicos, que ocorreu debaixo de chuva, no Estado de France, em Sandení, no último dia 8 de setembro."
888.0,907.0,"Ceremonia contou ali com a presença do Emmanuel Macron, da prefeita de Paris, Anne Dahlgo, da prefeita de Los Angeles, a Karen Bass, e quem representou o governo dos Estados Unidos, como governo que vai receber a próxima edição dos jogos paralimpicos,"
907.0,935.0,"foi o secretário de saúde do país, o Ravier Besseira, a cerimônia, como mencionava, foi de chuva, isso acabou atrapalhando algumas detalhes ali, mas tivemos os jogos paralimpicos sendo encerrados com a melhor campanha brasileira, em todos os tempos."
935.0,959.0,"Brasil ficou com 25 medalhas de ouro e 89 medalhas no total. Se a gente usar aquele critério na tabela extraoficial de ouros no primeiro lugar, ouros como o primeiro critério, Brasil ficou em quinto, mas se a gente usar as medalhas totais como critério, o Brasil ficou em quarto."
959.0,988.0,"E se usamos os broses como critério, o Brasil ficou em segundo, então a brincadeira da parte, o Brasil teve essa ótima campanha, de destacar também que em quarto lugar, empatados com os países baixos e alguns critérios, ficou ficar os atletas paralimpicos neutros, que são os atletas paralimpicos rusos e de belarruz."
989.0,1013.0,"E isso é interessante pelo contraste com os jogos olímpicos, já que no jogos olímpicos, a maioria dos atletas rusos e de belarruz, ou botcaram jogos, até por conta da suspensão da rússia antes mesmo da invasão da Ukraine, ou então não puderam disputar as eliminatórias, as competições eliminatórias."
1014.0,1039.0,"Mas nesse caso aqui tivemos essa participação muito maior de atletas rusos e tivemos também a Ucrania em sétimo lugar pensando no número de ouros, ou em quinto lugar no número de medalhas totais, o fato que tirando ali, a China ficou em primeiro disparado, 94 ouros em segundo lugar ficou reunido com 49 ouros, então quase o dobro."
1039.0,1054.0,"E a China ficou com 220 medalhas totais, o reunido ficou com 124 medalhas totais, você tem que praticamente sou mais medalhas, reunidos e Estados Unidos para chegar nos medalhas chinesas, vai dar um pouquinho mais."
1054.0,1068.0,"Mas o fato é que tirando a China ficou disparado em primeiro, e o reunido e Estados Unidos, que ficar ali em segundo, nós tivemos vários outros países que fizeram uma campanha,"
1068.0,1079.0,"países baixos, Brasil, Itália, Ucrania e atletas paralímpicos, neutros, que fizeram uma campanha muito boa, muito interessante."
1079.0,1093.0,"Salve engano, lembra que nós falamos da atleta Nepalesa no programa passado, mas para registrar três comitês paralímpicos venceram suas primeiras medalhas paralímpicas na história."
1093.0,1101.0,"Ilhas Maurício, Nepal e o time de atletas paralímpicos refugiados."
1101.0,1113.0,"Tivemos também três eventos que deram medalhas duplas, digamos assim, não previstas em determinados categorias, então por exemplo, nos 50 metros livres,"
1113.0,1121.0,"categorias 11 do atletismo, tivemos duas medalhas de prata e nenhuma de bronze, já que tivemos um empate."
1121.0,1141.0,"E também tivemos um empate no terceiro lugar do salto e altura, categoria T64 masculino, que tivemos também um pate em terceiro lugar, então duas medalhas de bronze e duas medalhas de bronze no evento dos 100 metros rasos femininos, categoria T63."
1141.0,1160.0,"Então esse foi o panorama geral de ganas de atletas do Jogos paralímpicos e tivemos também um recorde pessoal, um estabelecimento de uma recordista, melhor dizendo, uma marca histórica,"
1160.0,1176.0,"já que a esgrimista, Salsimim Jana da Tailândia, ela se tornou a primeira atleta da esgrima concadeira de rodas, a vencer três medalhas de ouro,"
1176.0,1188.0,"porém, mais do que isso, ela venceu três medalhas de ouro nas três categorias, espada, florete e sábrio."
1188.0,1217.0,"Então ela é a primeira vez que isso aconteceu, no total ela venceu cinco medalhas de ouro, desde o início das suas participações paralímpicas, em atenas 2004, então dá para dizer que ela é provavelmente uma das maiores esgrimistas, que tem na cadeira de rodas, já que são cinco horas, uma prata, quatro bronze,"
1217.0,1233.0,"incluindo três ouro na mesma edição olímpica para a límpica em 2024 nas três categorias diferentes. Então achar essa notícia também, interessante da gente repercutir aqui no programa."
1233.0,1259.0,"E a gente começa o nosso giro pela Europa com notícias na própria França, já que no último final de semana enquanto teve encerramento dos jogos paralímpicos, tivemos protestos em 130 cidades francesas contra a nomeação do Michel Barnie, como primeiro ministro, os protestos foram mobilizados pela nova frente popular de esquerda,"
1259.0,1288.0,"segundo os organizadores, cerca de 300 mil pessoas protestaram por todo o país, então a escolha do Michel Barnie, vou repetir o que a gente falou para o programa passado, ela é muito esquisita porque ela basicamente não agrega nada, ela simplesmente mantém um minércio, ela mantém os status quo, e ela não pode ser feita sem alguma espécie de diálogo por trás os panos com a marina leper,"
1288.0,1314.0,"já o ministério do interior francês citado na matéria da Aljazira disse que foram 110 mil pessoas nas ruas, então se a gente pegar, os organizadores estão falando em 300 mil, as autoridades estão falando em 110 mil, a gente fica ali com 200, pronto, faz um rei salomão e fica com 200."
1315.0,1339.0,"Da França vamos para o Reino Unido com três notícias, primeira delas é que o governo trabalhista que tem ampla maioria na Câmara dos Comunos, anunciou que vai encerrar o programa de subisídios de Inverno para combustíveis,"
1339.0,1354.0,"para os pensioniers, ou seja, os aposentados, anunciar para os aposentados mais pobres, então apenas as pessoas que estiver ali sob determinadas,"
1354.0,1373.0,"determinadas categorias da aposentadoria, acima de 66 anos de idade, vão poder receber esse dinheiro, que é como se fosse uma espécie ali de valigaz, digamos assim, fazendo uma analogia novamente."
1373.0,1389.0,"Segundo o governo é para tampar um déficit fiscal de cerca de 22 bilhões de libras e segundo governo essa medida economizaria 1,4 bilhão de libras."
1389.0,1407.0,"O voto na Câmara dos Comunos foi recebido com voto com gritos de vergonha, porque de fato você elégio um governo trabalhista e você espera que você vai ter alguma prioridade social,"
1407.0,1424.0,"e uma das primeiras coisas que esse governo vai fazer é cortar o valigaz dos velhinhos, não que não possa ter aposentados pensioniers no reenunido, que não possam pagar do seu próprio bolso, mas ainda sim,"
1424.0,1437.0,"que pegou muito mal por motivos óbvios, embora simbolize segundo as avaliações do governo uma economia e de mais de bilhão de libras."
1437.0,1453.0,Também no reenunido um homem foi condenado a 9 anos de cana por ter incendiado um local que recebe solicitantes de asilo durante aqueles protestos racistas da extrema direita ocorridos no início de agosto.
1453.0,1464.0,"Ele foi o pintor Thomas Burley, foi julgado na chefe of crown court e pegou 9 anos de cana."
1464.0,1484.0,"E finalmente uma terceira notícia e que aí uma notícia interessante inclusive para discussões no Brasil, o governo trabalhista disse que vai colocar em prática o plano que havia sido aprovado em 2021 durante a pandemia e durante o governo conservadora ainda,"
1484.0,1503.0,"de proibir anúncios de junk food na tanto na TV, quanto online antes das 9 da noite, para evitar que crianças sejam expostas a propagandas de junk food."
1503.0,1521.0,"Essa medida foi do governo Boris Johnson, porém duas vezes elas foram adiadas inclusive porque um dos principais lobistas da indústria da junk food foi parte do governo da Alface da listras."
1521.0,1528.0,Agora os trabalhistas anunciaram que vão botar o plano em prática.
1529.0,1544.0,"Do Reino Unido vamos para Noruega, já que foi revelado que a Baleia Beluga, que o Beluga não é a Baleia, é um golfinho, é tudo primo ali, uma mim fracático com cara de bonitinho mas que pode te matar."
1544.0,1552.0,"A gente comentou no programa passado que essa Baleia, que foi a peli dada de rival de Mir, que seria supostamente uma espianhussa,"
1552.0,1567.0,"teria sido Baleia, ela teria sido morta atiros, só que não. Agora a autópsia revelou que ela morreu devido a um objeto de madeira,"
1567.0,1585.0,"um pedaço de galho, algo assim de 35 centímetros de comprimento e 3 centímetros de largura se alojou na traqueia dela e ela então não conseguia se alimentar e não conseguia respirar direito."
1586.0,1607.0,"Da Noruega vamos para a Alemanha, com a ministra do interior Nens e Fésar, anunciando que a Alemanha vai estabelecer controles temporários em todas as suas fronteiras terrestres para evitar a emigração irregular."
1608.0,1623.0,"A questão é que se você olhar para a Alemanha, se a gente olhar no mapa da Europa e ver a posição da Alemanha melhor dizendo,"
1623.0,1630.0,"nós vamos ver que a Alemanha é cercada de países que fazem parte da área comum, dar a cheguem."
1631.0,1641.0,Então a Alemanha está basicamente dizendo que vai reimpor controles de fronteiras com seus vizinhos mesmo sendo dar a cheguem.
1641.0,1657.0,"Algumas medidas já estavam vigorando nas fronteiras com Suíça, Polônia e Tequea, mas agora elas serão basicamente generalizadas em todas as fronteiras e serão expandidas."
1658.0,1670.0,"Então é um impacto muito grande na área cheguem, porque a área cheguem é justamente a ideia de você estabelecer o livre trânsito das pessoas."
1671.0,1683.0,"O próprio mecanismo da Araxenga, estabelece que questões de segurança interna ou segurança pública podem motivar a retomada desse tipo de controle,"
1683.0,1690.0,"segundo o governo da Alemanha, desde o início da imposição de alguns tipos de controle, desde o final do ano passado,"
1690.0,1700.0,"cerca de 30 mil pessoas não puderam entrar no país, seja pessoas que já estavam na Araxenga e não puderam entrar na Alemanha."
1700.0,1709.0,"Vejam, são as fronteiras terrestres. Se você vai do Brasil, vai pegar um voo, vai descendo Frankfurt, o seu procedimento vai continuar igual a antes."
1709.0,1715.0,Isso significa que tem várias variantes nessa história.
1715.0,1722.0,"E o governo Polonês viu o primeiro ministro Donald Tusk, que é um primeiro ministro pro União Europeia, vamos lembrar,"
1722.0,1732.0,"ele disse que esse tipo de ação é inaceitável, que na prática viola o espírito da União Europeia e da área cheguem,"
1732.0,1744.0,"e que a Alemanha está tentando, basicamente, deixar para os seus vizinhos impactos de controle migratório,"
1744.0,1752.0,"que ela mesma não gostaria de ter. Porque vamos lembrar, no caso, especial de Bela Rúdia da Polônia,"
1752.0,1758.0,"e a gente vai falar um pouquinho mais de, manotíssimo, vendo Bela Rússe, porque vocês ouviram que eu estava quase comentando a Tufalho,"
1758.0,1768.0,"mas o caso da Polônia, nós temos muitas pessoas que entraram na União Europeia ou entram na União Europeia via Polônia,"
1768.0,1777.0,"antes da Polônia via Bela Rússejam vindos ou via o Crânia também, o Crânia e Polônia tem fronteira."
1777.0,1784.0,"E no caso de Bela Rús, nós temos as várias denúncias do governo Polonês, do governo da Lituaña,"
1784.0,1791.0,"de que Bela Rússe estaria incentivando, trazendo pessoas de outros países como a Turquia,"
1791.0,1800.0,"para atravessar a fronteira via Bela Rússe e causarem um problema nos seus países vizinhos,"
1800.0,1808.0,"serem um problema. Então essa decisão, alemã de impor controles, fronterizos,"
1808.0,1816.0,"mais rígidos nas suas fronteiras terrestres, sendo que elas são todas do espaço chengen,"
1816.0,1823.0,"vai ainda repercutir bastante. E se a gente pensar que a Alemanha é o principal popular econômico da União Europeia,"
1823.0,1830.0,"junto com a França, também vai levar a uma discussão sobre o próprio usando os termos Dono de Tusc,"
1830.0,1837.0,"Espírito da União Europeia. E aí nós vamos para a Polônia, justamente,"
1837.0,1841.0,"uma notícia envolvendo Polônia Bela Rússe. Alguns os os nove anos se vão se lembrar que em 2021,"
1841.0,1849.0,"nós tivemos aquele voco comercial da Rainer, que ia de Atenas Avínius e fizeram uma ameaça falsa de bomba,"
1849.0,1860.0,"pro avião ser escoltado por um Ming 29 da Força Aérea de Bela Rússe e o avião ao pousar em Bela Rússe,"
1860.0,1869.0,"em Minsk, dois passageiros foram detidos, um deles a num jornalista crítico da ditadura de Bela Rússe e a sua namorada."
1869.0,1877.0,"E depois se descobriu que a ameaça de bomba falsa foi feita a partir de agentes de Bela Rússe,"
1877.0,1880.0,"ou seja, foi toda uma operação de propósito para aprender essa pessoa,"
1880.0,1886.0,"foi um caso de pirataria aérea, não ter outra palavra para outro tero, não ter outro tero, foi pirataria aérea."
1886.0,1898.0,"E agora a Polônia anunciou que vai finalizar um processo contra as autoridades de Bela Rússe,"
1898.0,1905.0,"são três integrantes ali do que seria a anake de Bela Rússe, digamos assim,"
1905.0,1913.0,e uma pessoa envolvida com serviços de inteligência e as autoridades polonezas vão processar essas pessoas.
1913.0,1925.0,Se for um processo judicial feito na própria Polônia e eles vão solicitar que a interpó...
1925.0,1930.0,"né, vão solicitar no alerta vermelho o vinterpol, dificilmente vai acontecer alguma coisa."
1930.0,1937.0,Bela Rússe não vai aprender ali os seus oficiais de aviação e entregar-los para a Polônia para serem julgados.
1937.0,1941.0,"Então é uma medida que acaba sendo muito mais simbólica, mas que foi motivada por quê?"
1941.0,1952.0,Na imprensa poloneza publicaram audios da comunicação entre a torre de controle de Minsk e o avião
1952.0,1959.0,"e que mostraria, então, deixaria claro que teria sido uma conspiração em um ato de pirataria aérea."
1959.0,1965.0,"De Polônia Bela Rússe, vamos para a Albânia, mas não com uma notícia sobre a Albânia,"
1965.0,1973.0,"mas o fato de que foi realizada essa semana a Cúpula Feminina Afegan,"
1973.0,1984.0,"eu estou traduzindo, nome em inglês é All Afghan Women Summit, reuniram mais de 130 mulheres afegãs,"
1984.0,1991.0,"muitas delas ativistas pelos direitos das mulheres, professoras universitárias,"
1991.0,1999.0,"pelo menos uma esparlamentar fez parte para denunciar as violações dos direitos humanos,"
1999.0,2008.0,"das mulheres no afeganistão atualmente pelo talibã, e todas elas tiveram que fugir do afeganistão"
2008.0,2011.0,depois da retomada de poder pelo talibã.
2011.0,2017.0,"Inclusive você olha a imagem da Cúpula, que foi repito, foi realizado na Albânia,"
