start_segment,end_segment,text
11506.0,11510.0,"já mandou o Ors, a gente tinha repercutido aqui,"
11510.0,11514.0,"que setores do partido Colorado estavam se aproximando,"
11514.0,11521.0,"da frente ampla, no segundo turno, abandonando a qualizão multi color,"
11521.0,11531.0,"e daí o Bordabére declarou que quem criticava ele eram os pelotudos,"
11531.0,11541.0,"no que o Raúbaix respondeu, que você está cada vez mais parecido ao seu pai do que o meu,"
11541.0,11549.0,"veio puxar a linhaagem, e disse que não é uma peloto deis,"
11549.0,11553.0,"que estava defendendo, o partido Colorado, enfim,"
11553.0,11559.0,então teve aí essa troca de farpas também pensando na transição de poder.
11559.0,11564.0,"É, Uruguay agora vai ter que repensar uma oposição ali,"
11564.0,11569.0,"e eu acho que nisso o Lacaj de Pouque, onde der jovem,"
11569.0,11574.0,"toda via, tem um papel importante, de reconfigurar o que vai ser a oposição"
11574.0,11581.0,"Uruguaya dos próximos anos, espero que ele não se limite a pegar para se descerreferir,"
11581.0,11590.0,"ir lá para a rota, e tudo bem, verão todos, temos direito de descanso,"
11590.0,11596.0,"mas imagino que ele se advogue essa tarefa, de reorganizar a oposição"
11596.0,11602.0,"Uruguay daqui por diante que é necessária, tanto a liberar como a conservadora."
11602.0,11609.0,"E ainda falando do oposição é morique, no mesmo dia que ele recebeu a visita"
11609.0,11614.0,"do Gustavo Petro, na quinta-feira de a 5 de dezembro,"
11614.0,11621.0,"ele também foi interrogado pelo procurador especializado em delitos de lesa,"
11621.0,11630.0,"a humanidade, o Ricardo Percibage, por conta do ocorrido em 14 de abril de 1972,"
11630.0,11636.0,quando o movimento de liberação nacional Tupamaros criou uma conta
11636.0,11645.0,"ao ofensiva em relação aos escuadões da morte, e depois as forças conjuntas"
11645.0,11651.0,"foram em duas residências nos barros de Malvin e Buseu,"
11651.0,11657.0,"no qual foram assassinados seis militantes Tupamaros naquela ocasião,"
11657.0,11665.0,que levou a uma escalada repressiva que culminou no alto golpe dado pelo borda Bair.
11665.0,11672.0,"E é um caso que ainda está em aberto, por isso que o Murrika, que era membro"
11672.0,11680.0,"dessa guerrilha, também foi interrogado, apidido das famílias desses militantes"
11680.0,11685.0,que foram assassinados pelas forças de segurança do Uruguay.
11685.0,11692.0,"E acabou gerando uma crise política nesse final de ano,"
11692.0,11700.0,"já que a esposa do Murrika, a Lucia Topolanski, que foi vice-presidenta e senadora,"
11700.0,11706.0,"declarou que muitas pessoas mentiram nesse julgamento,"
11706.0,11713.0,o que levou aos militares pedirem revisão das causas na Suprema Corte.
11713.0,11719.0,"Então, aí estamos na penúltima semana do ano,"
11719.0,11727.0,"então gerou essa crise novamente pensando na memória do Uruguay,"
11727.0,11736.0,"inclusive a associação de familiares desaparecidos,"
11736.0,11742.0,publicou uma nota criticando as declarações da Topolanski.
11742.0,11753.0,"Eu acho que pensando nessa ida mais vissente do Murrika,"
11753.0,11760.0,"que seria um momento de pegar a Topolanski e fazer uma longchíssima entrevista com ela,"
11760.0,11767.0,"sobre tantas coisas, sobre deus, anos 70, sobre a questão dela com a irmã dela,"
11767.0,11773.0,"que elas não se bica muito, mas foi irmã mais velha que colocou ela no movimento do papá,"
11773.0,11779.0,"os toda a trajetória que ela teve na política, toda a prisão dela que tudo isso foi independente,"
11779.0,11785.0,"mas separada do Murrika, muita da opção dela, se deu paralelo,"
11785.0,11787.0,mas não sempre junto a ele.
11787.0,11791.0,"E eu acho que ela teria aportes importantíssimos a história do Uruguay,"
11791.0,11795.0,"mas é que, enfim, a gente sabe como é um mundo da mídia hoje,"
11795.0,11799.0,"o mundo quer saber domogica, domogica, domogica, nem ele mais aguentar,"
11799.0,11803.0,"repetir as mesmas coisas, mas eu acho que a alucia é uma grande figura,"
11803.0,11808.0,"e ela vai, enfim, parece sentir da ausência dela, ela sabe muita coisa,"
11808.0,11811.0,deveríamos nos depressar sobre a figura dela.
11811.0,11816.0,"Pois é, bem, do Uruguay vamos agora para o Paraguay,"
11816.0,11819.0,"fazendo o mesmo caminho de os certigas,"
11819.0,11825.0,"já que o país expulsou um enviado chinês,"
11825.0,11830.0,ainda pensando nessa relação com Taiwan.
11830.0,11839.0,"Exatamente, o Chu Wei, que é representante do Ministério de Elasções Teriores Chinês para a América Latina,"
11839.0,11844.0,"ele estava no Paraguai, para a Cúpula da Unesco,"
11844.0,11855.0,"que introduziu modos artesanais do quejaminas na lista de patrimônio e material da humanidade,"
11855.0,11864.0,"e o Chu Wei, ele estava dando uma entrevista em a sonsão,"
11864.0,11872.0,"e ele disse que o Paraguai deveria optar por relações com a República Popular da China,"
11872.0,11875.0,"para a Paraguai, que tem relações com o Taiwan."
11875.0,11881.0,"E o governo Paraguai disse que isso era uma intervenção em assuntos internos,"
11881.0,11887.0,"e declarou ele persona não grata, dando 24 horas para ele ir embora,"
11887.0,11890.0,"isso no começo do mês, tá gente?"
11890.0,11897.0,"Mas deu 24 horas para ele ir embora, e ele não pode mais voltar para o Paraguai,"
11897.0,11900.0,pelo menos até revogarem esses dados ou não.
11900.0,11905.0,"Pois é, ainda em relação à política externa Paraguai,"
11905.0,11910.0,"tivemos o anúncio do fim da cooperação entre a Secretaria Nacional Antilogas,"
11910.0,11917.0,"e a agência analgua nos Estados Unidos, do EA,"
11917.0,11922.0,"isso por parte do Congresso Paraguai,"
11922.0,11926.0,"visando recuperar a soberaninha do Paraguai,"
11926.0,11932.0,"o Deputado Governista Jamiu Esgaibe, celebrou essa divisão,"
11932.0,11939.0,e ainda diz que está corrigindo a magiação do governo anterior.
11939.0,11942.0,"Então é mais um capítulo aí também,"
11942.0,11948.0,da disputa interna do Partido Colorado que chega a público.
11948.0,11951.0,"Ainda nas palavras do Esgaibe,"
11951.0,11956.0,não podemos deixar nas mãos das autoridades alheias ao nosso país
11956.0,11961.0,"como dirigir as nossas polícias,"
11961.0,11968.0,eles diretamente cumpriam ordens de fora sem que a nossa gente se interace.
11968.0,11975.0,"Agora estamos corrigindo isso, e falando ainda na disputa interna do Partido Colorado"
11975.0,11980.0,"e também relacionado ao narcotráfico no país,"
11980.0,11983.0,"o filho do Congresista Brasil-Guai,"
11983.0,11988.0,"o Lalo Gomes, que foi assassinado recentemente, o Alexandre Gomes,"
11988.0,11993.0,"foi imputado por suposto porte táfico internacional de Logas,"
11993.0,11999.0,a associação criminosa e lavagem de dinheiro proveniente do narcotráfico.
11999.0,12002.0,"Isso é a partir de uma ação dos procuradores,"
12002.0,12007.0,"Osmar Legal, que tem melhor nome para ser um procurador,"
12007.0,12011.0,a Elbacáceres e a Ingrid Kubija.
12011.0,12014.0,"Bueno, do Paraguai, vamos agora para a Argentina,"
12014.0,12018.0,começando por uma notícia da política externa do país
12018.0,12023.0,e depois vamos passar por outras da política interna argentina.
12023.0,12030.0,Primeira é que a Itália concedeu a cidadania a Ravier Milley.
12030.0,12035.0,"É, teve esse sim, foi o Jécio Simbólico,"
12035.0,12039.0,"que assim, o Milley, ele no último fim de semana,"
12039.0,12042.0,"do dia 14 de dezembro, ele visitou a Itália,"
12042.0,12047.0,"foi recebido pela Jorge Amelone, e aí a Jorge Amelone"
12047.0,12051.0,"conseguiu a cidadania italiana para ele,"
12051.0,12056.0,já que o Milley é neto de imigrantes italianos.
12056.0,12068.0,"Só que assim, esse gesto acabou sendo criticado por basicamente todo mundo,"
12068.0,12077.0,"porque a oposição na Itália disse que isso era um ato discriminatório,"
12077.0,12080.0,"já que muitas pessoas esperam por anos,"
12080.0,12083.0,"pela regularização da cidadania e tal,"
12083.0,12086.0,"e o Milley recebeu assim, do nada."
12086.0,12091.0,"E na Argentina, e aí a nossa, claro,"
12091.0,12094.0,"vai poder falar muito melhor, mas teve gente dizendo que,"
12094.0,12097.0,"foi um ato meio virala atas do Milley,"
12097.0,12100.0,"porque assim, ele como cidadão privado,"
12100.0,12104.0,pode ter quantas nacionalidades ele quiser e for justificado.
12104.0,12109.0,"Agora, ele estando chefe de estado da Argentina, não é assim."
12109.0,12110.0,Não pega bem.
12110.0,12114.0,"Não pega bem, você recebe a nacionalidade e outro país quando você não chefe de estado."
12114.0,12120.0,"Não pega bem, não pega bem até porque você começa a conjecturar bom."
12120.0,12123.0,"Então, aquilo está querendo, né?"
12123.0,12127.0,"Amanhã depois, se a coisa complica, ele vai pra lá, né?"
12127.0,12130.0,"E depois também, porque não é grande coisa,"
12130.0,12135.0,"óbvio que recebeu uma sada de nitalhana, é uma grande coisa."
12135.0,12139.0,"A questão é que aqui na Argentina, em Buenos Aires,"
12139.0,12143.0,"especialmente a colônia de talhana, é fortíssima todo mundo,"
12143.0,12145.0,"por conhecimento quase, nunca conheço,"
12145.0,12149.0,"ou tem umas duplas da nitalhana, ou tem as panolas,"
12149.0,12152.0,"diria que segundo lugar, precisaria ver os números ali."
12152.0,12155.0,"Não é uma coisa assim tão difícil de conseguir,"
12155.0,12158.0,"desde que você passa pro aquele extremo de todos, né?"
12158.0,12162.0,"Então, enfim, é mais uma coisa distual,"
12162.0,12166.0,"e é um presente de malgosto de você dar pra um chefe estado,"
12166.0,12170.0,"pra que botar o cara na frente da lista, né?"
12170.0,12173.0,"Enfim, para uma coisa que ele tem direito,"
12173.0,12179.0,"ele tem direito para uma cidadão, como outros cidadãos que são netos,"
12179.0,12183.0,"ou bisnetos de italianos aqui, que muitos têm."
12183.0,12188.0,"Esse documento é mais um capítulo do que aquilo se chamam de Bra Mance,"
12188.0,12191.0,"entre a Melone e o Millake, né?"
12191.0,12196.0,"O Moto Serra de presente, então valeu a pena, né?"
12196.0,12202.0,"Pois é, ele deu uma coisinha com o Moto Serra de presente pra Melone,"
12202.0,12205.0,"você vê aí a unível quinta série, né?"
12205.0,12207.0,Jambos látados.
12207.0,12212.0,"Boa, não, e agora está tando, né, do presente da Argentina, né?"
12212.0,12219.0,Tivemos aí a divulgação de dados referentes ao primeiro ano do governo Milley.
12219.0,12224.0,"Isso, assim, eu inclusive escreveu sobre isso na Folha de São Paulo,"
12224.0,12234.0,"assim como a maior paixão, e assim, passar por alguns esses números,"
12234.0,12240.0,"mas a inflação está menor do que estava,"
12240.0,12246.0,"os índices de pobreza continúam altos, assim como a tendência, né?"
12246.0,12251.0,"Da desindustrialização argentina, isso são números do Indec,"
12251.0,12254.0,"tá gente, com a Instituto Nacional de Satx Excensos da Argentina,"
12254.0,12258.0,"que a gente se brinca aqui na CWBG da Argentina, tá?"
12258.0,12262.0,"Então assim, vocês podem lá e vê o relatório inteiro,"
12262.0,12270.0,"porém, a grande notícia positiva para o Milley e para os seus defensores,"
12270.0,12273.0,"e aí eu, além da repercussão de notícia, não aproveitar pra me vingar aqui,"
12273.0,12280.0,"mas foi o seguinte, que pela primeira vez dos últimos,"
12280.0,12287.0,"113 anos, a Argentina registrou um trimestre sem déficit fiscal,"
12287.0,12292.0,tá? Com mais receita do que despesa.
12292.0,12296.0,"E aí, porque eu preciso me vingar? Porque toda vez que a gente falava aqui,"
12296.0,12300.0,"que a Argentina, o problema econômico da Argentina,"
12300.0,12304.0,"independe do Milley, do Mácrito Fernandes, da Cristina,"
12304.0,12308.0,"que a Argentina, na verdade, ela não se cooperou desde a crise de 29."
12308.0,12313.0,"Tinha gente que falava, né? Isso daí, vocês não estão levando a suta sério?"
12313.0,12317.0,"Ou então, a culpa do Perón, a culpa, não sei o que, a culpa do Mácrito,"
12317.0,12327.0,então tá aí. Fazia 113 anos que a Argentina não tinha um trimestre com superável fiscal.
12327.0,12330.0,"Então, assim, quando eu falava que a Argentina, na verdade,"
12330.0,12336.0,"nunca se cooperou da crise de 29, eu me sinto vingado por essa informação"
12336.0,12339.0,"e é isso aí, chupa oposição."
12339.0,12343.0,"O Pino Solana, as defende atas que desde ainda independência."
12344.0,12350.0,"Aí, aí, Felipe, eu acho que você tem razão no sentido da personalificação da crise,"
12350.0,12353.0,"né? Ah, não, por não dependia de quem estava no poder,"
12353.0,12355.0,nunca se quer fazer nada.
12355.0,12358.0,"E o Millet, talvez, tenha conseguido fazer alguma coisa."
12358.0,12360.0,Já entraremos nesse alguma coisa.
12360.0,12363.0,"Agora, ou alguma coisa que o Millet fez,"
12363.0,12366.0,"e aí, eu acho que tá bem mais explicado na ativa da Maeda,"
12366.0,12371.0,porque ela foi direitinho ali nos números da atividade econômica e tudo mais.
12371.0,12376.0,"É que ela demonstra que esse superávit e esses números da macroeconomia,"
12376.0,12380.0,"eles estão relacionados a um paratí, como se diz assim, né?"
12380.0,12383.0,"Perno, freio, da atividade econômica."
12383.0,12388.0,"Quando você tem um país em receção, obviamente, você não tem inflação,"
12388.0,12394.0,ou a inflação baixa. A gente ainda tem inflação mensal de 3%.
12394.0,12399.0,"Menção de 3%, muito país, gilha, etc., a gente tem anual de 3%."
12399.0,12401.0,A gente ainda tem mensal de 3%.
12401.0,12404.0,"Então, ainda tem taxa de inflação,"
12404.0,12409.0,"cada vez que eu vou comprar um pacote de qualquer coisa de farinha,"
12409.0,12411.0,"não é? Mas que ina, tem inflação."
12411.0,12415.0,"Já não é de 100% é de 3, mas ainda tem inflação."
12415.0,12420.0,"Então, as melhores macroeconomicas ainda não chegaram no bolso"
12420.0,12424.0,"das pessoas, embora seja o ambiente mais propício,"
12424.0,12429.0,"o ambiente mais tranquilizado, economia mais tranquila, que saa,"
12429.0,12433.0,"que se se mantiver assim, possa vir a chamar"
12433.0,12437.0,investidores estrangeiros.
12437.0,12444.0,E você tem aí um controle cambiário que divide de analistas.
12444.0,12447.0,"Há muitos analistas que dizem que essa,"
12447.0,12450.0,"eu não atuo ao valor do peso, não é sustentável,"
12450.0,12453.0,"que logo deve haver uma desvaluidização, de fato está vendo 2%"
12453.0,12458.0,"ao mês, para não fazer uma desvaluidização repentina."
12458.0,12462.0,"Então, todos esses números positivos, eles têm uma nuance."
12462.0,12465.0,Eles têm uma contrapartida.
12465.0,12469.0,"E essa contrapartida é essa, se você corta o montão de emprego,"
12469.0,12472.0,"ou em onde a gente fa rua, ninguém tem dinheiro para comprar nada."
12472.0,12476.0,"Obviamente, você diminui inflação, porque ninguém compra nada."
12476.0,12481.0,"Nesta semana, o milhei anunciou o fechamento dos tens argentinos,"
12481.0,12485.0,a companhia está tal ferroviária.
12485.0,12490.0,"Claro, e aí você corte os subsídios, por exemplo,"
12490.0,12494.0,"a estrada do transporte. O metro era 30 pesos, agora 700."
12494.0,12498.0,"Eu rondando, eu não vou pegar 700. Não vou pagar dinheiro."
12498.0,12503.0,Teve também a polêmica em relação ao distribuição de remédios
12503.0,12508.0,"para aposentados, que até um deputado do Libertad alcança,"
12508.0,12513.0,"o Julho Moreno Ovaje, foi muito feliz nas declarações."
12513.0,12519.0,"Não acredita que seja para tanto a reclamação da população de terceiridade,"
12519.0,12523.0,e que os parentes podem ajudar a comprar remédio.
12523.0,12528.0,"Mas aí estamos, não é preciso essa solução."
12528.0,12531.0,"Essa pode ser uma solução que as famílias encontrem,"
12531.0,12536.0,"mas não é função do Estado, colocar no parente essa responsabilidade."
12536.0,12540.0,"Então, sim, a economia está mais tranquila."
12540.0,12546.0,"Chegamos no final do ano sem grandes destúrbios,"
12546.0,12551.0,"mas é uma situação que se vê do ponto de vista artificial,"
12551.0,12556.0,"esperando que alguém, acho que a grande coisa esperar que alguém fale,"
12556.0,12560.0,"nossa, a gente está realmente no bom momento, vamos para uma grana aqui,"
12560.0,12564.0,"e resolve um pouco o ano que vem. Porque se isso não acontecer,"
12564.0,12569.0,"nós comparamos muito essa situação com a situação que foi do governo macro,"
12569.0,12573.0,"que foi justamente na metade do governo em 2018,"
12573.0,12577.0,que ele viu bom tudo que eu consegui segurar até aqui e não consigo mais.
12577.0,12583.0,E aí teve aquela mega desvalorização pedido de 60 bilhões de dólares
12583.0,12587.0,"e daí, indiante, foi por a decadência."
12587.0,12590.0,"Então, esse é um momento muito importante."
12590.0,12596.0,"A gente está entrando em um ano eleitoral, na Argentina,"
12596.0,12600.0,"não é eleção presidencial, mas ele são legislativa,"
12600.0,12604.0,"jogar forte com esses números, com a propaganda desses números,"
12604.0,12609.0,que já convenceram o Felipe pra convencer o resto da população pra votar.
12609.0,12614.0,"Não, não me convenceu de nada, eu só me senti vingado sobre a questão histórica a gente cina."
12614.0,12622.0,"De convencer tudo bem. Mas enfim, com esses números ele pretende ganhar a eleição de legislativa,"
12622.0,12626.0,"ganhar no sentido de ter mais votos pra aliança dele,"
12626.0,12630.0,"o Labe Líver está avança, que como a gente sabe, é um partido muito pequeno,"
12630.0,12634.0,"se ele tiver um partido mais consistente no Congresso,"
12634.0,12640.0,"ele vai poder avançar pra outras pautas dele, algumas talvez até importantes"
12640.0,12643.0,pra dar essa limpada na economia argentina.
12643.0,12647.0,"Outras mais polêmicas tem a ver com relação ao costume,"
12647.0,12655.0,"por exemplo, no revogar a lei de aborto, voltar a tratar de temas com relação à niçeos militares,"
12655.0,12659.0,"tem uma sensíveis aí, a reforma universitária,"
12659.0,12662.0,"tudo isso ele não tá com força pra fazer agora, mas ele poderá ter,"
12662.0,12664.0,"se ele vencer as eleições legislativas ou ativos,"
12664.0,12667.0,"ou não que vem, vai ser um importante nas gentinas."
12667.0,12672.0,"Então eu acho que ele nesse momento a fotografia é positiva pra ele,"
12672.0,12674.0,não estou dizendo que não seja.
12674.0,12677.0,"Agora, a fotografia negativa que eu quis mostrar,"
12677.0,12680.0,"que eu sei que é uma área a ver isso também,"
12680.0,12684.0,"e que todos que estão aqui vemos também não é exgludente,"
12684.0,12689.0,quem tá aqui tá vendo isso é ela mesma que as matérias de pobreza depois
12689.0,12691.0,e outros colegas também fizeram.
12691.0,12694.0,"A gente anda pela rua agora, isso saia agora,"
12694.0,12697.0,"não sei o datagem, eu fui encontrar vários,"
12697.0,12701.0,"mas vários indigentes,"
12701.0,12707.0,pessoas muito pobres com arames e um bau de na outra mão.
12707.0,12711.0,"Eles vão até os lixões que são caixas plásticas,"
12711.0,12714.0,"você abre a pessoa remeste,"
12714.0,12718.0,"ela dentro tira o que serve pra comer, o que serve pra reciclar"
12718.0,12721.0,e vai embora e passa pra outro e vai pra outro.
12721.0,12724.0,"E, ouve caso já,"
12724.0,12729.0,"numa certa momento, a madrugada vem o caminhão da prefeitura e leva esse lixão."
12729.0,12733.0,"Fazer um vasculante que leva e lixou e leva com gente dentro,"
12733.0,12735.0,porque tá procurando coisas lá dentro.
12735.0,12738.0,"Então, isso estamos falando de Buenos Aires,"
12738.0,12740.0,está de mais rica do país.
12740.0,12743.0,"Então, existe um problema social aí por trás,"
12743.0,12745.0,que esses números não mostram.
12745.0,12752.0,"E, só pra completar a retirada das ajudas,"
12752.0,12758.0,"as famílias que recebiam auxílio alimentação,"
12758.0,12760.0,"tá sendo um problema sério,"
12760.0,12764.0,"porque me leixegou com um papo muito,"
12764.0,12766.0,"vai, digamos, elogiável,"
12766.0,12768.0,"de vamos terminar com os intermediários,"
12768.0,12772.0,aqueles que pegam as ajudas do governo distribuem pra população.
12772.0,12774.0,"Vamos fazer uma distribuição direta,"
12774.0,12778.0,porém sem ter estrutura de fazer a distribuição direta.
12778.0,12781.0,"E, por conta disso, tem um monte de alimentos"
12781.0,12784.0,"tragando nos cilhos do governo, nos armazenhos do governo."
12784.0,12789.0,"Então, existem questões aí do ponto de vista social"
12789.0,12792.0,que estão sendo deixados no segundo plano.
12792.0,12795.0,"Agora, eu me leia que liamento só, olha, que os números."
12795.0,12797.0,"Isso foi ser só, olha, pros números de fato,"
12797.0,12798.0,que você vai ter.
12798.0,12799.0,"Por isso que, nas semanas,"
12799.0,12801.0,"a gente teve essas mensagens,"
12801.0,12803.0,"esses títulos e trouxulos, né?"
12803.0,12805.0,"Os Jornais pro mercado,"
12805.0,12807.0,"falando uma maravilha do milhei,"
12807.0,12810.0,"e outros mostrando, olha, isso aqui não dá."
12810.0,12812.0,"Os aposentados já,"
12812.0,12815.0,"se no for ajuda do filho, do Neto, de alguém,"
12815.0,12817.0,não chegam ao fim do mesmo.
12817.0,12818.0,"Pois é, né?"
12818.0,12822.0,"E isso, os pobres que estão pagando a conta,"
12822.0,12826.0,"o milhei aproveitou também para assistir a final do polo,"
12826.0,12828.0,ali no campo argentino em Palermo.
12828.0,12832.0,Esse é um baita indicativo de que ele está governando
12832.0,12833.0,"pros ricos, né?"
12833.0,12836.0,"É o esporte mais de rico que existe, né?"
12836.0,12839.0,"Porque você precisa de, não sei quantos cavalos"
12839.0,12841.0,para disputar uma partida.
12841.0,12844.0,"Então, tava ele e a carina milhei presentes, né?"
12844.0,12847.0,"Também teve a cadeia nacional, né?"
12847.0,12850.0,"Realizada no dia 10,"
12850.0,12854.0,"depois dessa visita lá ao barro de Palermo,"
12854.0,12856.0,"no qual ele aparece, né?"
12856.0,12859.0,"No primeiro plano acompanhado novamente, né?"
12859.0,12863.0,"Da sua irmã e secretária geral, a carina milhei,"
12863.0,12866.0,"do Luiz Caputo, da Patrice Aburit,"
12866.0,12869.0,"e também do Guijermo Franco, né?"
12869.0,12871.0,"Que é o atual chefe de gabinete,"
12871.0,12874.0,"e havia sido também ministro do interior,"
12874.0,12878.0,"pasta essa que foi encerrada, né?"
12878.0,12882.0,"Enfim, e nessa cadeia nacional,"
12882.0,12887.0,"milhei diz que o governo vai fazer uma reforma impositiva,"
12887.0,12890.0,"uma reforma da previdência,"
12890.0,12894.0,"e uma verdadeira reforma do trabalho,"
12894.0,12897.0,"assim como reforma nas leis de segurança nacional,"
12897.0,12901.0,"uma profunda reforma penal, uma reforma política,"
12901.0,12906.0,e outras tantas reformas que deveriam ser feitas
12906.0,12908.0,"faz décadas, né?"
12908.0,12910.0,"E ele também anunciou, né,"
12910.0,12914.0,"que vai desenvolver um plano nuclear argentino,"
12914.0,12916.0,"que no qual ele foi criticado, né,"
12916.0,12918.0,"por diversos cientistas,"
12918.0,12921.0,"já que ele diminuiu, né,"
12921.0,12927.0,em 40% o orçamento da Comissão Nacional de Energia.
12927.0,12930.0,"Isso, aproveitar o gancho do número"
12930.0,12932.0,"que você mencionou a questão nuclear, Matias."
12932.0,12935.0,"É primeiro pra me corrigir brevemente,"
12935.0,12937.0,"já que eu falei do mês, né,"
12937.0,12939.0,"com superava de primário,"
12939.0,12941.0,foi um ano com superava de primário.
12941.0,12945.0,"Segundo os dados do próprio governo argentino,"
12945.0,12949.0,"né, mostraram o corte de quase 20%"
12949.0,12952.0,"em aposentadorias e impensões,"
12952.0,12955.0,corte de 28% nas transferências
12955.0,12957.0,"para as universidades,"
12957.0,12961.0,"corte de 45% nos programas sociais,"
12961.0,12964.0,corte de 76%
12964.0,12966.0,"nas transferências, as províncias,"
12966.0,12972.0,"tá, e corte de 95% nas despesas de capital"
12972.0,12974.0,"da secretaria de educação, tá?"
12974.0,12978.0,"Então assim, tirando as despesas obrigatórias"
12978.0,12980.0,"da educação argentina,"
12980.0,12982.0,todo o resto foi cortado.
12982.0,12986.0,"E ao ponto que a revista Nature,"
12986.0,12990.0,"que é uma das principais revistas científicas do mundo,"
12990.0,12993.0,publicou um artigo de opinião
12993.0,12995.0,"no último nove de dezembro,"
12995.0,13001.0,"falando sobre o colapso da ciência na Argentina,"
13001.0,13005.0,"tá, com entrevistas e participações de professores"
13005.0,13007.0,universitários e tudo mais.
13007.0,13009.0,"Então assim,"
13009.0,13012.0,"essa motocerra,"
13012.0,13014.0,"né, como vocês mencionaram,"
13014.0,13018.0,"afeta justamente os mais pobres programas de educação,"
13018.0,13020.0,porque o programa de educação sempre
13020.0,13022.0,"é uma espada de você privatizar,"
13022.0,13024.0,"né, de você por,"
13024.0,13028.0,"na, na, na, em uma agenda lucrativa,"
13028.0,13030.0,"então, e repito,"
13030.0,13032.0,"esses são os números oficiais do governo,"
13032.0,13034.0,"não são números de pesquisas,"
13034.0,13036.0,"não são números estimativas,"
13036.0,13038.0,não são números que eu estou tirando
13038.0,13040.0,"da cachola de algum lugar,"
13040.0,13041.0,tá?
13041.0,13043.0,E você me mencionou que ele
13043.0,13045.0,"faz assistir afinal do Paulo,"
13045.0,13047.0,né? Paulo é um esporte em que o cavalo
13047.0,13049.0,joga futebol com uma mochila
13049.0,13051.0,"e a mochila ganha uma medalha, né?"
13051.0,13055.0,"É, é, é, é, é, é, é,"
13055.0,13057.0,"futebol com golfe, não é?"
13057.0,13059.0,"Porque é, enfim,"
13059.0,13063.0,que a batendo na bolinha ali com aquele martelo.
13063.0,13065.0,"É, o, o nome correta explora sua animal."
13065.0,13067.0,"É, isso sim."
